level,id,parent_id,object_id,object_type,object_key,query_status,query_time,query_type,message,created_time,like_count,comment_count,error.message
0,1,None,23230437118_1257046258053717,seed,,,None,None,,,,,
1,2,1,23230437118_1257046258053717,data,data.*,fetched (200),17:44.0,Facebook:/<post-id>/comments,"Outstanding performance by neeraj yesterday, he has gained marvelous respect and love from India and the world , respect??????",2021-08-08T03:05:02+0000,32,9,
1,3,1,23230437118_1257046258053717,data,data.*,fetched (200),17:44.0,Facebook:/<post-id>/comments,He's a human dynamo and his story should be inspiring for sedentary pre-teens everywhere and I'm sure he would not disagree,2021-08-08T00:27:19+0000,15,0,
1,4,1,23230437118_1257046258053717,data,data.*,fetched (200),17:44.0,Facebook:/<post-id>/comments,To celebrate  winning a single gold for a country of 1.3 billion people  is a matter of shame .,2021-08-08T03:40:18+0000,3,10,
1,5,1,23230437118_1257046258053717,data,data.*,fetched (200),17:44.0,Facebook:/<post-id>/comments,Yeah! He's very lucky KENYAN'S Julius yego is injured! He couldn't a've gotten that medal!,2021-08-07T21:34:35+0000,0,2,
1,6,1,23230437118_1257046258053717,data,data.*,fetched (200),17:44.0,Facebook:/<post-id>/comments,"Outstanding, tenacity, drive, passion and dedication. Wishing Neeraj all the greatness in his sport. Jai Hind! ????????",2021-08-08T00:18:59+0000,9,0,
1,7,1,23230437118_1257046258053717,data,data.*,fetched (200),17:44.0,Facebook:/<post-id>/comments,"GREAT HERO OF INDIA TODAY-WINNING ""GOLD-MEDAL ""IN TOKYO OLYMPIC. A.VERY CONGRATULATION TO NIRAJ CHOPRA & FAMILIES",2021-08-08T02:45:24+0000,2,1,
1,8,1,23230437118_1257046258053717,data,data.*,fetched (200),17:44.0,Facebook:/<post-id>/comments,Iam kurdish man and l love india and l want travled to ????,2021-08-07T23:27:06+0000,10,4,
1,9,1,23230437118_1257046258053717,data,data.*,fetched (200),17:44.0,Facebook:/<post-id>/comments,"Proud moment for india it's been winning something., INDIA CAME ON ITS TRACK.",2021-08-08T02:40:48+0000,1,0,
1,10,1,23230437118_1257046258053717,data,data.*,fetched (200),17:44.0,Facebook:/<post-id>/comments,#Accolades in oodles for garnering world of proud to the nation and being a #Symbol of pride to his family.,2021-08-08T01:16:05+0000,0,0,
1,11,1,23230437118_1257046258053717,data,data.*,fetched (200),17:44.0,Facebook:/<post-id>/comments,U gave an encouragement and motivation for every sport with ur dedication and commitment and set an example that nothing is impossible ????????,2021-08-10T01:41:41+0000,0,0,
1,12,1,23230437118_1257046258053717,data,data.*,fetched (200),17:44.0,Facebook:/<post-id>/comments,Had Milkha Singh been alive he would be very proud of Neeraj Chopra Olympic gold for India.,2021-08-08T03:34:12+0000,0,0,
1,13,1,23230437118_1257046258053717,data,data.*,fetched (200),17:44.0,Facebook:/<post-id>/comments,Neeraj have been winning Gold everywhere ... yet many of us never heard his name untill yesterday....  Virat kholi scores 10 runs & he is at front page next day.... really sad.....,2021-08-08T03:57:58+0000,1,0,
1,14,1,23230437118_1257046258053717,data,data.*,fetched (200),17:44.0,Facebook:/<post-id>/comments,"If our children have gone to win, they will get it .. Congratulations to the hero who won the war ..",2021-08-08T01:37:44+0000,0,0,
1,15,1,23230437118_1257046258053717,data,data.*,fetched (200),17:44.0,Facebook:/<post-id>/comments,Ultimate confidence ..he didn't even look back where it fell ...salute,2021-08-11T09:42:21+0000,0,0,
1,16,1,23230437118_1257046258053717,data,data.*,fetched (200),17:44.0,Facebook:/<post-id>/comments,A film will be released very soon ,2021-08-08T03:46:30+0000,0,0,
1,17,1,23230437118_1257046258053717,data,data.*,fetched (200),17:44.0,Facebook:/<post-id>/comments,He knew once the throw was completed and even he did not see where javelin landed . Confidence ????,2021-08-08T08:04:29+0000,0,1,
1,18,1,23230437118_1257046258053717,data,data.*,fetched (200),17:44.0,Facebook:/<post-id>/comments,Congratulations to Neeraj Chopra and thank you so much for winning Gold Medal. Whole Nation proud of you.,2021-08-08T00:37:14+0000,3,0,
1,19,1,23230437118_1257046258053717,data,data.*,fetched (200),17:44.0,Facebook:/<post-id>/comments, 1 gold medal from 1.2.Billion people.,2021-08-08T01:17:30+0000,0,1,
1,20,1,23230437118_1257046258053717,data,data.*,fetched (200),17:44.0,Facebook:/<post-id>/comments,Sensational young neeraj chopra had created a new  History in tokyo Olympics. He stunned every one with His great performance in Javelin throw category. ,2021-08-11T13:20:19+0000,0,0,
1,21,1,23230437118_1257046258053717,data,data.*,fetched (200),17:44.0,Facebook:/<post-id>/comments,"Yes we're proud of him, do u have any problem with that? He has made 1.3 billion people proud.. What's your achievement in life?",2021-08-09T20:59:44+0000,0,2,
1,22,1,23230437118_1257046258053717,data,data.*,fetched (200),17:44.0,Facebook:/<post-id>/comments,"Congratulations. Brilliant, this will spark talent in Asia for this game.",2021-08-10T19:54:24+0000,2,0,
1,23,1,23230437118_1257046258053717,data,data.*,fetched (200),17:44.0,Facebook:/<post-id>/comments,How strange! He didnot watch after throwing it-what a confidence--congrats Neeraj ji,2021-08-08T04:31:34+0000,3,2,
1,24,1,23230437118_1257046258053717,data,data.*,fetched (200),17:44.0,Facebook:/<post-id>/comments,I'm also a great churma lover ????should i consider myself also a big shot ??????just kidding. Great guy great efforts. Passion always wins when take it in direction ur n inspiration????,2021-08-08T04:53:27+0000,1,0,
1,25,1,23230437118_1257046258053717,data,data.*,fetched (200),17:44.0,Facebook:/<post-id>/comments,He is the most beautiful man I have ever seen,2021-08-08T21:51:15+0000,2,0,
1,26,1,23230437118_1257046258053717,data,data.*,fetched (200),17:44.0,Facebook:/<post-id>/comments,Stunning performance !  Olympic champion ! I am certain your coach Uwe Hohn is proud of you !  ??,2021-08-07T21:30:00+0000,2,0,
1,27,1,23230437118_1257046258053717,offcut,,fetched (200),17:44.0,Facebook:/<post-id>/comments,,,,,
1,28,1,23230437118_1257046258053717,headers,,fetched (200),17:44.0,Facebook:/<post-id>/comments,,,,,
1,29,1,23230437118_1257046258053717,data,data.*,fetched (200),17:44.6,Facebook:/<post-id>/comments,Kabhi churma aur dal bati kahni ho sir to padhrae mahre rajasthan hum apka wait krenge proud moment,2021-08-08T05:21:07+0000,0,0,
1,30,1,23230437118_1257046258053717,data,data.*,fetched (200),17:44.6,Facebook:/<post-id>/comments,15 August ka flag modi ji and neeraj ji ek sath uthana chaie. Esko celebrate banadijie. Jai hind.,2021-08-07T22:39:23+0000,0,0,
1,31,1,23230437118_1257046258053717,data,data.*,fetched (200),17:44.6,Facebook:/<post-id>/comments,Am pakistani but i love.  neeraj bahi cah gy ap. . . .  manat. .  hi har insan ko kamyab karti h. . . .  khush rahy. . . .,2021-08-08T08:30:53+0000,0,0,
1,32,1,23230437118_1257046258053717,data,data.*,fetched (200),17:44.6,Facebook:/<post-id>/comments,Jesus Christ That guy is good looking He should play himself in his biopic No need for another actor,2021-08-08T01:02:44+0000,3,0,
1,33,1,23230437118_1257046258053717,data,data.*,fetched (200),17:44.6,Facebook:/<post-id>/comments,No words for Neeraj chopra. Dynamic performance ??????,2021-08-08T02:43:37+0000,1,0,
1,34,1,23230437118_1257046258053717,data,data.*,fetched (200),17:44.6,Facebook:/<post-id>/comments,Congradulation from great Pakistan.,2021-08-08T03:14:04+0000,0,1,
1,35,1,23230437118_1257046258053717,data,data.*,fetched (200),17:44.6,Facebook:/<post-id>/comments,The real hero who makes the country pride and  create a historic moment !! Deserves an honors from govt !!,2021-08-10T04:59:29+0000,0,0,
1,36,1,23230437118_1257046258053717,data,data.*,fetched (200),17:44.6,Facebook:/<post-id>/comments,"Because of you, the pride of the country has increased even more. Congratulations Neeraj",2021-08-13T04:58:09+0000,0,0,
1,37,1,23230437118_1257046258053717,data,data.*,fetched (200),17:44.6,Facebook:/<post-id>/comments,One person throws for the entire nation to rejoice,2021-08-10T12:38:18+0000,1,0,
1,38,1,23230437118_1257046258053717,data,data.*,fetched (200),17:44.6,Facebook:/<post-id>/comments,Many congratulations Chopra from Pakistan side.....you really work hard govt a lot of invest on you finally you achieve best of your life.,2021-08-11T04:35:32+0000,1,1,
1,39,1,23230437118_1257046258053717,data,data.*,fetched (200),17:44.6,Facebook:/<post-id>/comments,congratulations every Indian should proud of you ,2021-08-09T17:45:54+0000,0,0,
1,40,1,23230437118_1257046258053717,data,data.*,fetched (200),17:44.6,Facebook:/<post-id>/comments,Hard work pays off. Respect from pakistan ?,2021-08-08T04:19:22+0000,0,0,
1,41,1,23230437118_1257046258053717,data,data.*,fetched (200),17:44.6,Facebook:/<post-id>/comments,"Determination and confidence worked in Neeraj Chopra's favor, Congratulations.",2021-08-09T02:43:50+0000,0,0,
1,42,1,23230437118_1257046258053717,data,data.*,fetched (200),17:44.6,Facebook:/<post-id>/comments,Congratulations! to the Golden Hero.  India salutes u.,2021-08-08T04:17:12+0000,0,0,
1,43,1,23230437118_1257046258053717,data,data.*,fetched (200),17:44.6,Facebook:/<post-id>/comments,"The nation is Proud of you , such a hardworker",2021-08-11T17:12:42+0000,0,1,
1,44,1,23230437118_1257046258053717,data,data.*,fetched (200),17:44.6,Facebook:/<post-id>/comments,The most precious nd glorious moments ever r procured by you!! U hv given Indians the most expensive crown ?? ,2021-08-08T03:51:04+0000,0,0,
1,45,1,23230437118_1257046258053717,data,data.*,fetched (200),17:44.6,Facebook:/<post-id>/comments,Great memories!Hero of India!20-21Tokyo Olympic!,2021-08-08T04:02:34+0000,0,0,
1,46,1,23230437118_1257046258053717,data,data.*,fetched (200),17:44.6,Facebook:/<post-id>/comments,The Man with d golden arm... A Nation so proud????,2021-08-08T06:13:59+0000,0,0,
1,47,1,23230437118_1257046258053717,data,data.*,fetched (200),17:44.6,Facebook:/<post-id>/comments,Loved and appreciated......he should be...... Always.,2021-08-10T16:27:37+0000,0,0,
1,48,1,23230437118_1257046258053717,data,data.*,fetched (200),17:44.6,Facebook:/<post-id>/comments,A big applause from the Philippines ?? Congratulations!,2021-08-08T01:54:22+0000,0,0,
1,49,1,23230437118_1257046258053717,data,data.*,fetched (200),17:44.6,Facebook:/<post-id>/comments,Amazing performance champion ??????????,2021-08-15T04:53:45+0000,0,0,
1,50,1,23230437118_1257046258053717,data,data.*,fetched (200),17:44.6,Facebook:/<post-id>/comments,Outstanding performance.,2021-08-08T01:08:36+0000,0,0,
1,51,1,23230437118_1257046258053717,data,data.*,fetched (200),17:44.6,Facebook:/<post-id>/comments,"Where is the Coach ,nobody talk about him.",2021-08-08T05:29:15+0000,2,0,
1,52,1,23230437118_1257046258053717,data,data.*,fetched (200),17:44.6,Facebook:/<post-id>/comments,Made the nation proud ????????????????????????,2021-08-08T01:05:54+0000,0,0,
1,53,1,23230437118_1257046258053717,data,data.*,fetched (200),17:44.6,Facebook:/<post-id>/comments,Confidence always wins congradulations sir,2021-08-08T00:44:04+0000,0,0,
1,54,1,23230437118_1257046258053717,offcut,,fetched (200),17:44.6,Facebook:/<post-id>/comments,,,,,
1,55,1,23230437118_1257046258053717,headers,,fetched (200),17:44.6,Facebook:/<post-id>/comments,,,,,
1,56,1,23230437118_1257046258053717,data,data.*,fetched (200),17:45.2,Facebook:/<post-id>/comments,HE is our MESSY.great best of all  player.,2021-08-09T18:16:23+0000,0,0,
1,57,1,23230437118_1257046258053717,data,data.*,fetched (200),17:45.2,Facebook:/<post-id>/comments,Focas  is the game all r well win gold ??????  love u all,2021-08-10T13:24:22+0000,0,0,
1,58,1,23230437118_1257046258053717,data,data.*,fetched (200),17:45.2,Facebook:/<post-id>/comments,New name in the World Olympic,2021-08-07T20:54:51+0000,0,0,
1,59,1,23230437118_1257046258053717,data,data.*,fetched (200),17:45.2,Facebook:/<post-id>/comments,congratulations the historic Gold medal.,2021-08-07T23:51:13+0000,0,0,
1,60,1,23230437118_1257046258053717,data,data.*,fetched (200),17:45.2,Facebook:/<post-id>/comments,In Last event niraj Chopara hit sixer. We proud of you.,2021-08-09T08:01:13+0000,0,0,
1,61,1,23230437118_1257046258053717,data,data.*,fetched (200),17:45.2,Facebook:/<post-id>/comments,PROUD OF OUR INDIAN CULTURE.,2021-08-10T08:10:00+0000,0,0,
1,62,1,23230437118_1257046258053717,data,data.*,fetched (200),17:45.2,Facebook:/<post-id>/comments,Now he became national crush of india,2021-08-08T03:26:56+0000,0,0,
1,63,1,23230437118_1257046258053717,data,data.*,fetched (200),17:45.2,Facebook:/<post-id>/comments,"congratulations,you have long  future,continue,gold may akways  with you,great,",2021-08-08T01:52:52+0000,0,0,
1,64,1,23230437118_1257046258053717,data,data.*,fetched (200),17:45.2,Facebook:/<post-id>/comments,CONGRATULATION  N. CHOPRA....pride of India....fr Philippines...,2021-08-08T05:40:39+0000,0,0,
1,65,1,23230437118_1257046258053717,data,data.*,fetched (200),17:45.2,Facebook:/<post-id>/comments,Only 23 years...what a dedication n concentration...??,2021-08-08T19:49:21+0000,0,0,
1,66,1,23230437118_1257046258053717,data,data.*,fetched (200),17:45.2,Facebook:/<post-id>/comments,India upsets olympic games !! By winning a gold .. ,2021-08-08T10:24:10+0000,0,1,
1,67,1,23230437118_1257046258053717,data,data.*,fetched (200),17:45.2,Facebook:/<post-id>/comments,Congratulations Bhai Niraj #Chopra  ji,2021-08-08T06:00:00+0000,0,0,
1,68,1,23230437118_1257046258053717,data,data.*,fetched (200),17:45.2,Facebook:/<post-id>/comments,Congratulations Neeraj Chopra....Bharat mata ki joy,2021-08-11T09:21:32+0000,0,0,
1,69,1,23230437118_1257046258053717,data,data.*,fetched (200),17:45.2,Facebook:/<post-id>/comments,https://instagram.com/tony.pathak.904?utm_medium=copy_link is id ko follow kardena sabhi bhai log please,2021-08-11T11:54:08+0000,0,0,
1,70,1,23230437118_1257046258053717,data,data.*,fetched (200),17:45.2,Facebook:/<post-id>/comments,"????? ??? ??? ??? ??????? ??? ?? ????  ??? ?? ????? ?????? ????? ????? ????,  ?? ??  ???? ??? ?? ????? ?? ???? ,,,,,, ???? ??????? ??? ?? ???? ???  ,, ?????? ?????",2021-08-08T05:19:14+0000,0,0,
1,71,1,23230437118_1257046258053717,data,data.*,fetched (200),17:45.2,Facebook:/<post-id>/comments,Hearty congratulations Neeraj... you are the pride son of Hindustan... it is happened only in BJP government lead by our great Prime Minister Shri Modi ji...Jai Bharat...????????????????????????????????????????????????????????????,2021-08-07T21:00:05+0000,1,6,
1,72,1,23230437118_1257046258053717,data,data.*,fetched (200),17:45.2,Facebook:/<post-id>/comments,Churma to sabhi haryanvi villagers ki most faverate dish h ji...lajabab,2021-08-08T06:31:20+0000,0,0,
1,73,1,23230437118_1257046258053717,data,data.*,fetched (200),17:45.2,Facebook:/<post-id>/comments,????? ?? ????? ??? ????? ???? ?? ?? ,2021-08-08T02:57:59+0000,0,0,
1,74,1,23230437118_1257046258053717,data,data.*,fetched (200),17:45.2,Facebook:/<post-id>/comments,?? ??????? ? ???????? ????! ?????? ??? ???? ?? ?????? ??? ?????? ?? ??? ???? ????? ?? ????-???? ????? ???? ???? ??????? ?? ??? ?? ??? ?? ?? ?????? ?????? ?? ?? ?? ?? ?????? ?? ???? ??? ???? ???? ???? ?? ??????? ??????? ?? ?????? ??? #Tokyo2020,2021-08-08T04:25:42+0000,0,0,
1,75,1,23230437118_1257046258053717,data,data.*,fetched (200),17:45.2,Facebook:/<post-id>/comments,Not bad for a population of 1.3 billion I guess .,2021-08-18T19:26:29+0000,0,0,
1,76,1,23230437118_1257046258053717,data,data.*,fetched (200),17:45.2,Facebook:/<post-id>/comments,Masha Allah Allah Kare zorey Shabab aur zayda,2021-08-09T15:12:14+0000,0,0,
1,77,1,23230437118_1257046258053717,data,data.*,fetched (200),17:45.2,Facebook:/<post-id>/comments,Yes he's a real talent and a champion! Congratulations from Pakistan!,2021-08-08T00:43:41+0000,3,1,
1,78,1,23230437118_1257046258053717,data,data.*,fetched (200),17:45.2,Facebook:/<post-id>/comments,"??? ??? ???? ????? ??? ?? ??? ???? ???? ??? ???? ??? ?? 70 ??? ??? ???? ?? ??????? ??? ?? ???? ????????? ??? ?? ???? ????,?? ???? ???? ???",2021-08-08T01:55:48+0000,0,0,
1,79,1,23230437118_1257046258053717,data,data.*,fetched (200),17:45.2,Facebook:/<post-id>/comments,Omshanti ji ???? ?????? we salute you,2021-08-09T03:46:17+0000,0,0,
1,80,1,23230437118_1257046258053717,data,data.*,fetched (200),17:45.2,Facebook:/<post-id>/comments,Finally an Indian stands up for 1.3 billion people. For a while I thought what a lost Olympic cause. Chalo kuch accha to huwa finally.,2021-08-08T00:57:34+0000,0,0,
1,81,1,23230437118_1257046258053717,offcut,,fetched (200),17:45.2,Facebook:/<post-id>/comments,,,,,
1,82,1,23230437118_1257046258053717,headers,,fetched (200),17:45.2,Facebook:/<post-id>/comments,,,,,
1,83,1,23230437118_1257046258053717,data,data.*,fetched (200),17:45.8,Facebook:/<post-id>/comments,Barat  mata  Ki joy ho.,2021-08-09T03:36:15+0000,0,0,
1,84,1,23230437118_1257046258053717,data,data.*,fetched (200),17:45.8,Facebook:/<post-id>/comments,Bhi ka no milega,2021-08-13T03:28:19+0000,0,0,
1,85,1,23230437118_1257046258053717,data,data.*,fetched (200),17:45.8,Facebook:/<post-id>/comments,Modi ke jaisa feko to maane,2021-08-09T09:30:23+0000,0,0,
1,86,1,23230437118_1257046258053717,data,data.*,fetched (200),17:45.8,Facebook:/<post-id>/comments,May Allah always shower blessing on our country INDIA.... Proud moment for all indians....,2021-08-08T09:28:26+0000,0,0,
1,87,1,23230437118_1257046258053717,data,data.*,fetched (200),17:45.8,Facebook:/<post-id>/comments,Farooq Ahmed ek saaada neeraj hai ??,2021-08-11T13:15:42+0000,0,0,
1,88,1,23230437118_1257046258053717,data,data.*,fetched (200),17:45.8,Facebook:/<post-id>/comments,Despite govt drastically reducing sports budget! ,2021-08-09T04:27:39+0000,0,0,
1,89,1,23230437118_1257046258053717,data,data.*,fetched (200),17:45.8,Facebook:/<post-id>/comments,Diamond medal winner. Fakundra,2021-08-11T10:01:57+0000,0,0,
1,90,1,23230437118_1257046258053717,data,data.*,fetched (200),17:45.8,Facebook:/<post-id>/comments,https://www.top-five-things.site/2021/08/top-five-things-about-gold-medalist.html?m=1,2021-08-08T14:48:57+0000,0,0,
1,91,1,23230437118_1257046258053717,data,data.*,fetched (200),17:45.8,Facebook:/<post-id>/comments,"Breaking News??? 7 Sister States of India Arunachal Pradesh, Assam, Meghalaya, Manipur, Mizoram, Nagaland and Tripura is going to cut off from India. It means 40% of India is going to cut.",2021-08-08T01:37:13+0000,0,0,
1,92,1,23230437118_1257046258053717,data,data.*,fetched (200),17:45.8,Facebook:/<post-id>/comments,,2021-08-08T10:08:17+0000,1,0,
1,93,1,23230437118_1257046258053717,data,data.*,fetched (200),17:45.8,Facebook:/<post-id>/comments,,2021-08-08T10:05:53+0000,1,0,
1,94,1,23230437118_1257046258053717,data,data.*,fetched (200),17:45.8,Facebook:/<post-id>/comments,,2021-08-08T19:20:47+0000,0,0,
1,95,1,23230437118_1257046258053717,data,data.*,fetched (200),17:45.8,Facebook:/<post-id>/comments,,2021-08-17T12:15:45+0000,0,0,
1,96,1,23230437118_1257046258053717,data,data.*,fetched (200),17:45.8,Facebook:/<post-id>/comments,,2021-08-07T21:47:11+0000,0,0,
1,97,1,23230437118_1257046258053717,data,data.*,fetched (200),17:45.8,Facebook:/<post-id>/comments,,2021-08-10T01:11:22+0000,0,0,
1,98,1,23230437118_1257046258053717,data,data.*,fetched (200),17:45.8,Facebook:/<post-id>/comments,,2021-08-09T16:56:32+0000,0,0,
1,99,1,23230437118_1257046258053717,data,data.*,fetched (200),17:45.8,Facebook:/<post-id>/comments,,2021-08-09T03:37:58+0000,0,0,
1,100,1,23230437118_1257046258053717,data,data.*,fetched (200),17:45.8,Facebook:/<post-id>/comments,,2021-08-08T04:25:44+0000,0,0,
1,101,1,23230437118_1257046258053717,data,data.*,fetched (200),17:45.8,Facebook:/<post-id>/comments,Congratulations to Neeraj Chopra and thank you so much for winning Gold Medal. Whole Nation proud of you.??????????????,2021-08-08T08:24:58+0000,0,0,
1,102,1,23230437118_1257046258053717,data,data.*,fetched (200),17:45.8,Facebook:/<post-id>/comments,,2021-08-07T21:41:35+0000,0,0,
1,103,1,23230437118_1257046258053717,data,data.*,fetched (200),17:45.8,Facebook:/<post-id>/comments,,2021-08-11T18:01:22+0000,0,0,
1,104,1,23230437118_1257046258053717,data,data.*,fetched (200),17:45.8,Facebook:/<post-id>/comments,Great memories!Hero of India!20-21Tokyo Olympic!...,2021-08-08T06:20:36+0000,0,0,
1,105,1,23230437118_1257046258053717,data,data.*,fetched (200),17:45.8,Facebook:/<post-id>/comments,Someone please Explain in English what his mom and sis said. I'm from Sri Lanka.We are really happy too??,2021-08-08T03:56:31+0000,2,4,
1,106,1,23230437118_1257046258053717,data,data.*,fetched (200),17:45.8,Facebook:/<post-id>/comments,Congratulations the historic Gold medal.,2021-08-08T02:14:29+0000,0,0,
1,107,1,23230437118_1257046258053717,data,data.*,fetched (200),17:45.8,Facebook:/<post-id>/comments,Muhammad Zubair  Musadiq Akbar  neeraj ki bhan to apny Arshad nadeem ki tarha lagti a bc ,2021-08-08T04:19:18+0000,1,0,
1,108,1,23230437118_1257046258053717,offcut,,fetched (200),17:45.8,Facebook:/<post-id>/comments,,,,,
1,109,1,23230437118_1257046258053717,headers,,fetched (200),17:45.8,Facebook:/<post-id>/comments,,,,,
1,110,1,23230437118_1257046258053717,data,data.*,fetched (200),17:46.3,Facebook:/<post-id>/comments,Bada wala joker hai sab ke sab????,2021-08-08T02:25:26+0000,0,0,
1,111,1,23230437118_1257046258053717,data,data.*,fetched (200),17:46.3,Facebook:/<post-id>/comments,"Self created, talent",2021-08-22T14:43:47+0000,0,0,
1,112,1,23230437118_1257046258053717,data,data.*,fetched (200),17:46.3,Facebook:/<post-id>/comments,Proud very proud. If bollywood has to make a movie on him. Siddharth Malhotra should play the role of him. You are amazing Neeraj Chopra. God bless u,2021-08-21T17:02:14+0000,0,0,
1,113,1,23230437118_1257046258053717,data,data.*,fetched (200),17:46.3,Facebook:/<post-id>/comments,Fantastic ????,2021-08-21T15:50:04+0000,0,0,
1,114,1,23230437118_1257046258053717,data,data.*,fetched (200),17:46.3,Facebook:/<post-id>/comments,https://youtu.be/7ZBxeqzCp28,2021-08-21T07:48:12+0000,0,0,
1,115,1,23230437118_1257046258053717,data,data.*,fetched (200),17:46.3,Facebook:/<post-id>/comments,MR.CHURMA SHARMA IS INDIAS PROUD CHILD OF HIS MOTHER???? GIFTED BY HIS RESPECTED MOM & DAD AND HIS FAMILY MEMBERS????????????????????????,2021-08-20T08:51:55+0000,0,0,
1,116,1,23230437118_1257046258053717,data,data.*,fetched (200),17:46.3,Facebook:/<post-id>/comments,Bharat Mata ki Jai superb Neeraj,2021-08-17T16:39:04+0000,0,0,
1,117,1,23230437118_1257046258053717,data,data.*,fetched (200),17:46.3,Facebook:/<post-id>/comments,"Niraj chopra drawing video link https://youtu.be/Cj8Lg3juJX4 Watch, like, comments and subscribe",2021-08-17T03:39:08+0000,0,0,
1,118,1,23230437118_1257046258053717,data,data.*,fetched (200),17:46.3,Facebook:/<post-id>/comments,,2021-08-16T18:33:19+0000,0,0,
1,119,1,23230437118_1257046258053717,data,data.*,fetched (200),17:46.3,Facebook:/<post-id>/comments,,2021-08-16T06:16:22+0000,0,0,
1,120,1,23230437118_1257046258053717,data,data.*,fetched (200),17:46.3,Facebook:/<post-id>/comments,What A Confidence After Towing. Really You Great Neeraj ??????,2021-08-15T11:58:52+0000,0,0,
1,121,1,23230437118_1257046258053717,data,data.*,fetched (200),17:46.3,Facebook:/<post-id>/comments,God bless you neeraj,2021-08-15T11:32:11+0000,0,0,
1,122,1,23230437118_1257046258053717,data,data.*,fetched (200),17:46.3,Facebook:/<post-id>/comments,https://youtu.be/ipFXPGUqypI,2021-08-15T09:37:09+0000,0,0,
1,123,1,23230437118_1257046258053717,data,data.*,fetched (200),17:46.3,Facebook:/<post-id>/comments,Nice,2021-08-15T08:05:01+0000,0,0,
1,124,1,23230437118_1257046258053717,data,data.*,fetched (200),17:46.3,Facebook:/<post-id>/comments,Congratulations,2021-08-15T05:58:56+0000,0,0,
1,125,1,23230437118_1257046258053717,data,data.*,fetched (200),17:46.3,Facebook:/<post-id>/comments,Very very big congratulations????????????????????,2021-08-15T03:27:13+0000,0,0,
1,126,1,23230437118_1257046258053717,data,data.*,fetched (200),17:46.3,Facebook:/<post-id>/comments,,2021-08-15T02:06:38+0000,0,0,
1,127,1,23230437118_1257046258053717,data,data.*,fetched (200),17:46.3,Facebook:/<post-id>/comments,????,2021-08-14T16:22:18+0000,1,0,
1,128,1,23230437118_1257046258053717,data,data.*,fetched (200),17:46.3,Facebook:/<post-id>/comments,????????????????,2021-08-14T02:21:04+0000,0,0,
1,129,1,23230437118_1257046258053717,data,data.*,fetched (200),17:46.3,Facebook:/<post-id>/comments,Ishika Mukherjee ,2021-08-13T21:12:16+0000,0,0,
1,130,1,23230437118_1257046258053717,data,data.*,fetched (200),17:46.3,Facebook:/<post-id>/comments,Congratulations,2021-08-13T16:54:14+0000,0,0,
1,131,1,23230437118_1257046258053717,data,data.*,fetched (200),17:46.3,Facebook:/<post-id>/comments,https://www.facebook.com/100001635675944/posts/4382134198517726/?fs=e&s=cl,2021-08-13T16:35:06+0000,0,0,
1,132,1,23230437118_1257046258053717,data,data.*,fetched (200),17:46.3,Facebook:/<post-id>/comments,,2021-08-13T15:27:03+0000,0,0,
1,133,1,23230437118_1257046258053717,data,data.*,fetched (200),17:46.3,Facebook:/<post-id>/comments,Your style is so beautiful.. I am very proud for your  stunning performance..,2021-08-13T13:46:49+0000,0,0,
1,134,1,23230437118_1257046258053717,data,data.*,fetched (200),17:46.3,Facebook:/<post-id>/comments,https://youtu.be/DQfGiiZTAI4,2021-08-13T13:22:57+0000,0,0,
1,135,1,23230437118_1257046258053717,offcut,,fetched (200),17:46.3,Facebook:/<post-id>/comments,,,,,
1,136,1,23230437118_1257046258053717,headers,,fetched (200),17:46.3,Facebook:/<post-id>/comments,,,,,
1,137,1,23230437118_1257046258053717,data,data.*,fetched (200),17:46.8,Facebook:/<post-id>/comments,congrats,2021-08-13T10:32:12+0000,0,0,
1,138,1,23230437118_1257046258053717,data,data.*,fetched (200),17:46.8,Facebook:/<post-id>/comments,The confident man ,2021-08-13T10:27:52+0000,0,0,
1,139,1,23230437118_1257046258053717,data,data.*,fetched (200),17:46.8,Facebook:/<post-id>/comments,https://youtu.be/ANxdln0pdfM,2021-08-13T03:43:25+0000,0,0,
