Name,Comment,Time,Likes,Reply Count,Reply Author,Reply,Published,Updated
satnam singh,It&#39;s painful to see him disgraced to a mere congressi tota,2021-01-27T02:34:31Z,5,0,,,,
Suresh Chowta,"This guy never leaves the opportunity to prove his stupidity. If police take action, he barks saying they are forcefully trying to suppress and is a game plan. If the police didn&#39;t take any action, it&#39;s again a game plan. Either way, it is always governments mistake and police is the culprit.<br><br>He kept on trying to find supporting points saying only one bad organization in 30 to 40 organizations. Just because it matches his ideology that is against BJP. He can&#39;t find one thing right if the same thing happens on the other side.",2021-01-27T02:34:28Z,0,0,,,,
Lokendra Airy,sir itne paise kyu khate ho hadd h phle tumhe acha lg raha tha ki esa ho rha h ab saara thikra police m daal do saram kro tum bhi isi desh k ho bura ni  lgta yeah sab dekh k shame on u,2021-01-27T02:34:28Z,0,0,,,,
satnam singh,You keep enjoying it Mr. Ravish but remember one day someone may get mad at you you will get cornered and few police men will be there<br>Then they might flee for their life and u will be on mercy of bheed,2021-01-27T02:32:25Z,0,0,,,,
Vijay Rana,Meri city main murder hua hai.... Police inspector ko saja honi chahiye!!!! Police k rehte murder hua kese 😂😂,2021-01-27T02:32:22Z,3,0,,,,
Abby,Kya Ravish ji ye toh fhir violence ho gya ab Kya justify karoge apne sarcasm se?,2021-01-27T02:32:18Z,10,1,,,,
,,,,,Dalveer Kular,Sb srkar ki sazish thi,2021-01-27T07:13:31Z,2021-01-27T07:13:31Z
Rajesh Razz Singh,Khan market me wine chalega,2021-01-27T02:32:16Z,0,0,,,,
Jagdeep Singh Khalsa Jagdeep Khalsa,Sala guu khana oi bhonki janda,2021-01-27T02:32:00Z,0,0,,,,
sk,Bikau midea  fak news  fak video  <br>Bjp ka dalali kar rah h badawa <br>Ye fak news  chal raha h.<br>Congrsh ko badnaam karane k leye,2021-01-27T02:31:17Z,0,0,,,,
Jan seva Education,Ye khalistani the,2021-01-27T02:31:05Z,0,0,,,,
Shahnaz Khan,Way to go brothers,2021-01-27T02:31:04Z,0,0,,,,
Rajesh Razz Singh,Aaj to toda muskura lo,2021-01-27T02:30:34Z,0,0,,,,
NIRAMAYA SINGH,Ab farm bill wapas v ho jayega aur msp v fix ho jayegi 😂😂😂,2021-01-27T02:29:11Z,2,0,,,,
Abhishek Sharma,"Ravish bhai,itna bhi kya cover up karna... Bar bar koshish kar rahe ho k police ki galti batayi jaye, saari galti police ki thi, kisaan to bohat thode the. Arey sahab jab lathi chal rahi hai, tractor chal rahe hai tab kya kijiyega? Pura narrative ye hi banane ki koshish ho rahi h k galti police ki thi. 26 January thi aaj, tank bhi pade the thoda door. Chal sakte they, automatic rifles thi, chal sakti thi...fir aap hi kehte k nihattey kisano par goliya chala di.<br><br>Jaha tak tayyari ki baat hai, jo decide kiya hua route hai, uske alawa saare raste block kiye huve they, dtc ki bises se, cement blocks se or simple barricades se bhi. Par jab koi soch k hi aaya h k humne to laal kila hi jaana hai, tractor police pr hi chadhana hai...to kya kiya jaaye?<br><br><br>Par aap aapna geet gaogey, police ki galti hi bataogey...ravish bhai, aapki bohat ijjat karta tha, par itni saaf tasvir ko bhi aap apne ek tarfa tareeke se bata rahe ho,ye theek nahi hai...<br><br>Bohat dukh hua aapki report dekh kar, sharmindagi bhi hui h aur gussa h tabhi ye likh raha hu. Kshama karna par ab me aapka pehle jesa samman nahi kar paunga...<br><br>Jai hind!!!",2021-01-27T02:29:10Z,0,0,,,,
NIRAMAYA SINGH,Ab farm bill wapas v ho jayega aur msp v fix ho jayegi 😂😂😂,2021-01-27T02:29:10Z,7,3,,,,
,,,,,SuccessNama,Ab to lund bhi vapas nhi hona,2021-01-27T03:38:19Z,2021-01-27T03:38:19Z
,,,,,aa,ab to ghanta kuch nahi hoga.,2021-01-27T06:03:03Z,2021-01-27T06:03:03Z
,,,,,NIRAMAYA SINGH,@Mudit Pandey kya kare aaj raveesh babu ka sarcasm gayab hai 😂😂,2021-01-27T06:06:18Z,2021-01-27T06:06:18Z
NIRAMAYA SINGH,Ab farm bill wapas v ho jayega aur msp v fix ho jayegi 😂😂😂,2021-01-27T02:29:06Z,12,3,,,,
,,,,,NIRMAL KUMAR,Ye to trailer hi...pura sanima abhi baki hi,2021-01-27T09:20:28Z,2021-01-27T09:20:28Z
,,,,,Darshit Sheth,Nai hoga kuch,2021-01-27T10:21:50Z,2021-01-27T10:21:50Z
,,,,,Manoj Rathore,सपने देखो अब कुछ समय बाद यह फर्ज़ी आंदोलन खत्म हो जाएगा।,2021-01-27T16:17:18Z,2021-01-27T16:17:18Z
Raja lavlesh yadav,BJP ke kisan ne lal kile pe jhanda fahraya kisan andolan jindabad,2021-01-27T02:27:28Z,0,0,,,,
PRAVIN TIDKE,What is rabish khans view on flagging nishan sahib on red fort,2021-01-27T02:26:10Z,0,0,,,,
IAS TINA RIA DABI,Gjb sir,2021-01-27T02:26:03Z,0,0,,,,
Twinkle nayak Adhiti Das,Ravish Ji aap to khud hi hinsa ko uska rahe thee. To phir chinta kis baat ki.,2021-01-27T02:25:54Z,0,0,,,,
MOHAMMED RAFI,Salute  farmers💪👍,2021-01-27T02:25:31Z,0,0,,,,
Rahul verma,Kishano ko lal kila par nhi jana chahiye. Isse kafi image kharab ho gui kishano ki,2021-01-27T02:24:48Z,0,0,,,,
HUSSAINS,Delhi police puri tarha fail.. Lakin jnu may apni mardani dikhane K liye Delhi police ghuss K marti hai lakin ajj 26 January ko aisaa hona Sharam ki baat hai..,2021-01-27T02:24:20Z,0,0,,,,
Jayanta kumar Giri,"Be shale tera knowledge nehihe , Desh kaa log desh ko tod rehe , tu shale kya bol raha aa police kaa bhul he 😡😡😡😡😡😡😡😡😡😡😡😡😡 a desh ko tad ne baala MEDIA (NDTV)",2021-01-27T02:24:16Z,0,0,,,,
Love u Zindgi,Rawish kumar. Abeyy chutiyee. Police walo ki baat kar le tuu<br><br>112 police wale gayal hue hai,2021-01-27T02:23:32Z,1,0,,,,
Jay shree Ram,"Chalo aaj se NDTV nehi dekhenge. Jo channel Army ke death ke baad enjoy karta he, usko dekhenge. Chalo re chalo.",2021-01-27T02:22:58Z,0,0,,,,
Karan,Agr police force use krti toh kehte ki police ann data pr voilence kr rhi ha ?,2021-01-27T02:22:45Z,5,0,,,,
Love u Zindgi,Rawish kumar jaise Chamchee log kahege. Sab bjp ne karwaya hai😃,2021-01-27T02:22:20Z,1,9,,,,
,,,,,31 IMBA Aqsa Javid,Ap revisit kare apna statement..Kuch aur hi lag Raha h😂😂...,2021-01-27T03:00:12Z,2021-01-27T03:00:12Z
,,,,,Love u Zindgi,@31 IMBA Aqsa Javid   all.kisaan atank waadi<br>Asli.kisaan.apne.khet.me.hai,2021-01-29T10:46:19Z,2021-01-29T10:46:19Z
,,,,,31 IMBA Aqsa Javid,"@Love u Zindgi unless you take a plough in hand, you won&#39;t realise...lekin Apne sach Kaha...kisanu k sath Sab changa sii...Khush...",2021-01-29T11:29:32Z,2021-01-29T11:30:29Z
,,,,,Love u Zindgi,@31 IMBA Aqsa Javid i want jo kisaan andholaan kar rahe hai<br>Unko goli kar deni chahiye<br>Bcz ye sab khaalistaani aur atank waadi hai<br><br>Laal kile se tringa hata diya en logo ne<br>Aur delhi police ke 800 police wale gayal kar diye. Talwar se<br><br>Shame<br>Aisi kisaano ko jail me hona chahiye,2021-01-30T06:24:39Z,2021-01-30T06:24:39Z
,,,,,31 IMBA Aqsa Javid,"@Love u Zindgi sure..go and do that...but jisdin apke interest k khilaaf koi unlawful bill pass hogi..uss din I believe that you would always believe Mr  Prime Minister because he can&#39;t be infallible and I also believe he is one of the most trustworthy PM of India and he promotes peace everywhere whether it be bringing goodwill to Trump and building Walls for hiding dirty slums instead of investing for the poor or he being the promoter of peace....Sab changa sii.....You know what our economy is blooming with success , so what the GDP is less than 4, we should believe him. Jobs have been created, no one is fired from offices and see how many Pakodawalas are emerging. Those who are against Mr Minister do not understand what a great job creation he has brought...ignore those who are against Modi...",2021-01-30T06:37:43Z,2021-01-30T06:41:34Z
,,,,,Love u Zindgi,@31 IMBA Aqsa Javid  your cetegary belong chamcha giri karna<br>So your PM is Rahul gandhi<br>Maybe u are muslims<br>And all muslim never vote for BjP<br>Modi sarkar ne kitne saare kaam kiye but all muslim never support bjp.   Aaj tak kabhi kisi kaam tarif nhi ki. <br>Aur 1 baat aur. Kisaan bill wapas nhi hoge yaad rakhna<br>Agr wapas ho gaye so fir 370 tripple tallak CAA ye sab against log bahar nikal aayege aur road par andholan suro kar dege<br><br>Bcz he understand. Road jaam karo andholan karo aur modi ko PM post se hata do<br><br>Sayad tumhe nhi pata kisaan bill good for farmers but 5% farzi kisaan andholan kar rahe. Kyuki unki dusmani modi se<br><br>Ok PM bekar hai but india ke President ram nath kovind unki baat par tu belive karoge na🙄,2021-01-30T09:04:02Z,2021-01-30T09:04:02Z
,,,,,31 IMBA Aqsa Javid,"@Love u Zindgi who the hell is Rahul Gandhi ..why do you think the people who are against Modi are supporters of that rahul...and one more thimg chamchagiri tum Kar rahe ho...kisan bill pada h...hoarding i.e unethical stock piling by MNCs  is legalised, MSP has been removed and Contract farming is promoted and no ethical redressal of grievances would be done if the contract is breached by private players causing a menace in courts...we people are not illiterate ...we know what&#39;s going on ...they say kisan ab kahin bhi Fasal bech Sakta h...par wou bechega kaise when the hoarding has been legalised and there&#39;s no proper way if the contract is breached by private players...BJP BJP laga rakha h...pata Kuch bhi Nahi h...jab b asli mudde p aao divert karte ho discussion ko...aur ye Muslim Muslim Ka kya naara h...agar koi policy galat h Tou isme religion Kaha se Aaya...we are against their policies...ankh band Kar k koi bhi behas shuru karte ho...Jake kisan bills ko analyse Karo phir aao baat Karne asli mudde par...ye Rahul Gandhi, Muslims, etc etc Karke divert mat Karo asli mudde ko...behas Karni h Tou bolo 3 fayde kisan bills k...Mai tume 1000 nuksan bataongi...ye religion-religion game mat khelo...we all are citizens...Rahul Gandhi h kon Jo uski baat karte ho... dichotomy Bana Diya h Sab Kuch..",2021-01-30T09:34:27Z,2021-01-30T09:49:30Z
,,,,,Love u Zindgi,"@31 IMBA Aqsa Javid  Aree wah kaafi samajdar ho tu<br>But why you forget your team and your type people never support modi.  Why why??   Modi me kitne kaam kiye. Swach bharat mission, Jan dhan a/c aur hazaaro prakar ki yojnaaye chal rahi hai. Jisse samaj desh aur garibo ka vikaas ho<br>But your type people ne kabhi bjp and modi ki tarif nhi ki. And i sure muslim people never vote for bjp<br>But u forget itne adhikar humko prapat nhi hai. Jitne aap Alpshankyak(non Minority) walo ko hai.    But fir bhi aap log kabhi modi ko vote nhi dete<br>Aree bewakof insaan kaam dekho. Kitna kaam kiya hai<br>Aur hamare state ki CM yogi 1 din bhi rest nhi karte. Everyday UP ki devlop me lage rehte hai aur rooz koi na koi nayi pariyojna and devlopment UP ka karte hai",2021-01-31T10:14:04Z,2021-01-31T10:14:04Z
,,,,,31 IMBA Aqsa Javid,"@Love u Zindgi jitne ache kaam kiye unke liye Kisi ne protest nhi Kia...mje fayde batao kisan bills k...phir se Muslim Muslim Kar rahe ho...mje 3 fayde batao kisaan bill k.. economy all time down, youth jobless, reserves empty, but Sab changa sii...Swatch Bharat abhyan aur toilets Tou bann gaye na...a/c banaya Gaya gareebi door Karne k liye ...issi liye trump k aate hi deewar khadi Kar Di...aur Swatch Bharat Tou itna safal hogaya ki ajkl Kahi gandagi nhi dikh Rai desh mai..lekin tum fikar mat Karo kyunki Sab changa sii..ek kaam Karo tum support Karo Modi ko... tume Kisi ne nhi Roka...enjoy...kyunki democracy h..u r free to vote",2021-01-31T10:19:43Z,2021-01-31T10:35:29Z
Havoc,BJP at fault.,2021-01-27T02:22:00Z,0,0,,,,
Manisha Sahoo,Shame Ravishji!!!!! Ek bar ninda to kar lete....,2021-01-27T02:21:34Z,9,1,,,,
,,,,,2140 sarbjeet Singh,Kis baat ki ninda 1783 me laal kila sikho ne jeet ke choda tha aur 26 March ko delhi fateh diwas mnaate hai aur india ke jhnde ka taan koi apmaan nhi hua apmaan saale bjp ke dalle krte hai,2021-01-27T04:20:00Z,2021-01-27T04:20:00Z
Govind Saraswat,Ndtv bik chuka hai,2021-01-27T02:21:30Z,0,0,,,,
Sanjay Shrivastav,In haramjade kisano ko face se pehchan kar sara nuksaan wasoolna Chahiye.,2021-01-27T02:21:19Z,0,0,,,,
Shivam Maurya,Kisano ne dil jeet liya ravish ji 😆😆,2021-01-27T02:21:00Z,0,0,,,,
Piyush Kumar,"Wah, wah ! ..... सर   चीत भी आप की पट भी आप की .... किया तो क्यु किया ना किया तो कयुँ नहीं किया...",2021-01-27T02:20:27Z,33,11,,,,
,,,,,Anshul Dahiya,bro yeah bas ab sabka paise kamaaney ka dhanda baan gya h. govt and media bas apne subscriber bnane mein lagey h,2021-01-27T02:44:16Z,2021-01-27T02:44:16Z
,,,,,Broke Guy,Bhai Red Fort apne desh ki shaan hai. Maana kishan andolan sahi muddo par ho raha hai magar jiss jagah 15th August aur 26th January ko Tiranga lehraya jata hai uss jagah pe Kishan bhaiyon ko aisa nahin karna chahiye tha. Red Fort ke bahar ka ilaka sahi rehta.,2021-01-27T02:52:59Z,2021-01-27T02:52:59Z
,,,,,Rahul Singh,Aao modi ke tattte,2021-01-27T02:53:07Z,2021-01-27T02:53:07Z
,,,,,Anshul Dahiya,@Rahul Singh bhai dekh Zara aankh khol kar... Tatto se maat dekh. Dono ki kammi h bhai....,2021-01-27T02:55:35Z,2021-01-27T02:55:35Z
,,,,,Anshul Dahiya,@Broke Guy iskey liye toh yeah log ka padha likha hona jaruri hai bhai. Inko koi matlab he nhi h.,2021-01-27T02:56:20Z,2021-01-27T02:56:20Z
,,,,,KAMLESH PAL,Ye dogala hai,2021-01-27T02:58:36Z,2021-01-27T02:58:36Z
,,,,,Rahul Singh,@Anshul Dahiya bhai kami sarkar ki h kisana ki nhi je sarkar chahti ye kanoon vaps le sak thi,2021-01-27T02:59:53Z,2021-01-27T02:59:53Z
,,,,,Rahul Singh,@KAMLESH PAL kon h dogla,2021-01-27T03:00:45Z,2021-01-27T03:00:45Z
,,,,,truth knowledge,@Rahul Singh or mandi k dalal,2021-01-27T03:06:54Z,2021-01-27T03:06:54Z
,,,,,Anshul Dahiya,@Rahul Singh bhai shi baat h tumhari but hinsahh or yeah red fort par police walo ko khai mein kudaana and tractor unn par chadhana and leaders ka gayab hona. yeah bhi toh theek ni h.,2021-01-27T03:10:03Z,2021-01-27T03:10:03Z
,,,,,Rahul Singh,@truth knowledge modi ke tatte door raho,2021-01-27T03:10:22Z,2021-01-27T03:10:22Z
Sem Samra,Kisan mazdoor ekta zindabad 🙏🤲🧡,2021-01-27T02:20:07Z,4,0,,,,
Hoi Choi,"Sir kitna din Tak log Santi purna tarika sa andolan karanga sarkar na to bol Diya ham stay lagayenga kanoon raad nahi karanga,<br><br>Sir kisan Gandhi baad ka saath saath Subhash baad bhi kar Raha hai or ya karna chahiya.",2021-01-27T02:19:33Z,1,0,,,,
Jay shree Ram,"Are bhai log total news sunlo, baad me comments karna ya gali dena.",2021-01-27T02:18:58Z,0,0,,,,
Sanjay Shrivastav,Desh ka Dil jeet rahe hain fake kisan 😂😂😂,2021-01-27T02:18:06Z,0,0,,,,
Abhimanyu,jab 2 mounth se chup chap bhete the tan kuch nahi abb apni mang  karne ke leye sadk mer autre abb ooo atenkwadi,2021-01-27T02:17:42Z,0,0,,,,
PhantomX Pro,On 1783 Same Khalsa Flag Was Flagged On Red Fort! Sikh Fought against mughals Rights ! History Repeats🔥,2021-01-27T02:17:42Z,4,4,,,,
,,,,,Shivam Chaudhary,"1757 me Marathas ne bhagwa bhi lagaya tha Red fort pe, 1803 me british ne bhi jhanda lagaya tha. Tiranga hata ke laga dete hain bhagwa aur british jhanda? 🔥🔥",2021-01-27T04:31:20Z,2021-01-27T04:31:20Z
,,,,,vitamin protin,@Shivam Chaudhary lol! Tiranga was first hoisted in 1906.1757 and 1803 m to Tiranga tha hi nahi,2021-01-27T04:52:04Z,2021-01-27T04:52:57Z
,,,,,Shivam Chaudhary,"@vitamin protin mere bhai, mera comment dhyan se padh. Maine likha, kyuki ek time pe waha pe koi aur flag lagaya gya, jaise marathas ka jhanda yaa british ka jhanda, toh ye matlab nahi ki dobara se laga dein. Abhi tiranga hai, tiranga rehne do. Red fort pe bhi chadh gye toh koi kuch ni bolta, agar sirf tiranga chedha nhi hota toh.",2021-01-27T05:10:55Z,2021-01-27T05:10:55Z
,,,,,vitamin protin,@Shivam Chaudhary right bro🇮🇳🇮🇳,2021-01-27T05:17:15Z,2021-01-27T05:17:15Z
Sanjay Shrivastav,Maro in kutte kisaano ko encounter me 😡,2021-01-27T02:16:51Z,0,0,,,,
Kiratgun sran,BJP samarthak deep sidhu ne yah sab kuchh kaarvayi ab ismein Kya Karen kisan,2021-01-27T02:16:40Z,2,1,,,,
,,,,,Rohit S,Ch**ye Rakesh Tikait to congress ke ticket pr chunav bhi lda hai aur Yogendra Yadav to AAP me tha ...,2021-01-27T12:22:22Z,2021-01-27T12:22:22Z
M,"Dikhaya to saara  din, aap  ne  bhi  godi media  jaisa  hi hai",2021-01-27T02:16:06Z,0,0,,,,
vijyant goliyan,"All the news channels are sold out to bjp that&#39;s why they got 142nd rank out of 163 countries in freedom press report....🤐🤐🤐🤐🤐🤐🤐,so firstly try yourself to be honest to nation not for bjp....🤐🤐🤐🤐🤐🤐🤐🤐🤐, shame on you Indian media because now the people voice has not been reached to Delhi by media that&#39;s why farmers reached there🤐🤐🤐🤐🤐🤐🤐🤐🤐🤐🤐🤐🤐🤐🤐🤐",2021-01-27T02:15:07Z,0,0,,,,
ABHISHEK CHOUKSEY,NDTV is behind the danga. Ravish Kumar kush to bahut ho ga aaj.<br><br>NDTV should be baned.,2021-01-27T02:15:06Z,1,1,,,,
,,,,,Shubham Kumar,Chutiya hai kya saale us hisab se to baaki news channel bhagwan honge tere liye,2021-01-27T05:08:38Z,2021-01-27T05:08:38Z
Sandeep Kumar,कोई बात नहीं किसान अपना हक लेकर जायेगा,2021-01-27T02:14:32Z,7,0,,,,
Golok chandra Hembram,Sikh kun he aapna dharmik jhanda peherana desh ki sambhidhan ku tudna,2021-01-27T02:13:47Z,0,0,,,,
Sandeep Kumar,ये पूलिस की चाल है ।सरकार के साथ मिलकर पूलिस ने रूट बदला ।bjp का नेता था जिसने झण्डा फहराया ।try to understand,2021-01-27T02:13:15Z,2,0,,,,
Pappu Raj,Jo kuchh huaa  sarkar Dosi hai  Jaha 157  kisan sahid  Huaa waha kisano me Ab Mausi hai Sarkar ko  ab Andha Bahra nhi Banana chahey   Aur jis Tarah  Parsasan Bhag rahi thi Aise bhi  Sarkar ko yh ab Samjh jana chahey  ki Kisano ko Rokna sarkar k Bas ki bat nhi hai  aur kisan Bill ko Wapass Lelena chahey  jor se Bolo kisan ektajindabad jay jawan jay kisan,2021-01-27T02:12:40Z,1,0,,,,
prasad awari,Ravishji still you are blaming police?<br>If police fired shot then also u would have blame police? <br>Change your question and ask this idiots who climbed on Red Fort?,2021-01-27T02:12:21Z,0,0,,,,
Harry siyan,Jhutha median,2021-01-27T02:12:20Z,1,0,,,,
BIVASH Chakraborty,Boycott Sikhs,2021-01-27T02:12:18Z,0,0,,,,
Sukhbir Bindal,Police ko order mile to sahi. .... dimaag thikaane rkhkr baat ki jaaye sir ... <br>Agr police ko order hote to mahol kuch or hotaa ... media ko sense bhi honi chahiye baat ko smjhne ki 🤫,2021-01-27T02:10:49Z,0,0,,,,
Govind Das,This Ravish Kumar said in one of his videos that the whole country will see and admire on Kisan tractor Rally. It looks like if he was aware of all these. The entire police force have been very restraints in handling the situation as they have agreement with the Kisan Union. So all these questions Ravish Kumar  should answer himself not the Govt or administration.,2021-01-27T02:10:33Z,1,0,,,,
Kunal Tamta,Bjp ki strategy hai ye dange bhdka krr kisan ko iss andolan se hatana 😂😂😂😂,2021-01-27T02:10:20Z,24,2,,,,
,,,,,kalpan shah,It&#39;s totally possible BJP ke khate me bohot planned dange hai<br><br>2002 was the one that landed PM Modi to our Television screens,2021-01-27T13:05:42Z,2021-01-27T13:05:42Z
,,,,,Mirttunjay Paswan,Kasmir PR kush bolo,2021-01-27T14:23:46Z,2021-01-27T14:23:46Z
Be Brilliant,Ravish ka propoganda kaam nii krr rhaa😂😂😂😂,2021-01-27T02:10:10Z,0,0,,,,
Sem Samra,"People are more upset about a flag going up than our farmers dying in the cold weather,It’s the power of media ....it’s sad 😞",2021-01-27T02:10:07Z,3,0,,,,
Aditya Priyadarshi,"घड़ा भर गया है, अब आगे आगे देखो मोटा भाई क्या करेंगे।।।",2021-01-27T02:09:56Z,11,1,,,,
,,,,,DANVEER SINGH MEEL,"Mote bhai ke hi bheje hue kuch BJP supporter the, jo kisaan andalon ko badnaam kar rhe h",2021-01-27T07:31:46Z,2021-01-27T07:31:46Z
Nishan Nath,Lal Quila or Babri Masjid ke photos same he lagtA ha crowd???????,2021-01-27T02:09:29Z,1,0,,,,
Goldy Pillay,Aap ka dil toh jeet liya hoga ravish ji aaj...,2021-01-27T02:09:18Z,0,0,,,,
Dr. Brijendra Singh,अबे भड़वे कल तो बोल रहा था कि किसान दिल जीत लेंगे।आज तो तू बहुत खुश होगा।अब ये सरकार को घेरेगा।,2021-01-27T02:08:52Z,0,0,,,,
Mahimaマヘシュ,Sale dogle,2021-01-27T02:08:34Z,0,0,,,,
Sandeep Kumar,धूर्त है रवीश.....भगवान देश की इससे रक्षा करे।,2021-01-27T02:07:19Z,1,1,,,,
,,,,,Jay shree Ram,"Sahi bola bhai, hamko 4,5 Arnab chahiye. Jo army ke death pe enjoy kare. Bharat Mata ki Jay.",2021-01-27T02:13:14Z,2021-01-27T02:13:14Z
rama shankar,Raste se bhatak sakte hai??? Sach mai Abe ye sb jaan buj ke ito or laal kila gaye the,2021-01-27T02:06:34Z,0,0,,,,
Maninder Singh,<b>I will embolden farmers to become rulers of the world</b><br><b>said by sri Guru Gobind Singh ji Maharaj</b> .<br>gurubilas patshai dasvi (1751)<br>ਕਿਸਾਨ ਜਗ ਮੈ ਭਏ ਰਾਜਾ ll,2021-01-27T02:06:33Z,0,0,,,,
invincible,Ye rally kisano ki nahi aatnkiyo ki thi<br>Khalistani plus congress ki,2021-01-27T02:06:12Z,0,0,,,,
RK Lohan,Something is better than nothing.<br>जो हुआ हमें अच्छा नहीं लगा।लेकिन आजादी दिलवाने में सभी गांधीजी नहीं हो सकते। मोदी सरकार ने देश को शर्मसार किया है।नकली किसान देख लिया अगर असली होता तो क्या होता? कल्पना से परे होता।<br>तीनों काले कानून निरस्त।<br>किसान घर वापसी समस्त।<br>किसान मजदूर एकता जिन्दाबाद।<br>जय जवान जय किसान।,2021-01-27T02:03:25Z,0,0,,,,
VISHNU DHOBI,Ja ho Kishan,2021-01-27T02:03:13Z,0,0,,,,
Chaitali Patel,Rubbish Kumar is anti India!,2021-01-27T02:03:01Z,0,0,,,,
Bihar Bullet,Police ke rahte Lal kila par kaise chadh gaye kisan.<br>Pichle bar to aapne bola tha ki desh ki janta ka Dil jitne ja rahe hai kisan.,2021-01-27T02:02:43Z,37,11,,,,
,,,,,Dalveer Kular,Police ne jo rasta diya tha bo bnd kr diya or jan buj kr lal kile wala rasta khol diya taki dhrna bdnam ho jaye..,2021-01-27T07:12:00Z,2021-01-27T07:12:00Z
,,,,,Harsh Pareek,"@Dalveer Kular wah kya baat sochi h, or kuch nhi mila kya jispe km se km yakeen to ho🙄😭",2021-01-27T09:27:05Z,2021-01-27T09:27:05Z
,,,,,Uttarakhand Films Official,@Dalveer Kular chutiya kisi or ka bnna samjha kam se kam jo delhi mai hia unko to bilkul mat bnna.. Kisan k naam per bhut chuitya kaat liya,2021-01-27T11:01:24Z,2021-01-27T11:01:24Z
,,,,,saske184,"@Dalveer Kular video bhi sun liya karo yeh tumhara fav channel hai <a href=""https://www.youtube.com/watch?v=Ya5b9L9cL5Q&amp;t=8m29s"">8:29</a> ya yeh bhi jud kahi rahey hai tum jo bologe wahi sach chahey kuch bhi baki sab judhey hai?",2021-01-27T11:06:34Z,2021-01-27T11:06:34Z
,,,,,Dalveer Kular,Jab tk tum log modi ki bhgti krna nhi chodoge tab tk tum log andhe ke andhe rhoge jakr dekho delhi kya hua tha ghr baith kr mat btao je bo.. Video dekh lao social media pr police camera kyu tod rhi hai or je btao 26 jan ko itni security hoti thi vo kll kyu nhi thi lal kile pr logo ko kyu jane diya jd ki je root to police ne kha tha ki nhi ja skte pr kll kyu nhi roka akho pr lgi modi ki patti khol kr dekho ki hua ka tha godi media ki baton pr ykeen krte ho jo vo dikhate vhi shi hai.. Agr kisan protest kre to aantkawadi or agr sikh kre ton khalistani or agr tum log kro to desh bhagt wah kya baat hai.. Fir ton hum log is desh ka hissa hi nhi hai... Jis thali mai khate ho usi mai shed nhi krna chihye.. Or last baat agr chowkidar imandar hota to ajj sb log apne ghro mai hote.. 🙏🏻,2021-01-27T11:25:44Z,2021-01-27T11:25:44Z
,,,,,saske184,@Dalveer Kular brain toh tumney apna bech diya hai aur sabad uskey bol rahey ho jisney tumhara brainwash kiya hai kisi bhi channel pai dekh saaf pata chal raha hai ki sahi hai kya aur galat kya par yeh tumhey nahi dekheyga. <br>   Aur mujey yeh batao mainey kaha kaha atankwadi comment bhi dheel sai nahi pad saktey?,2021-01-27T11:29:49Z,2021-01-27T11:32:30Z
,,,,,Bihar Bullet,Lal kila par lagane ke liye jhanda bhi police ne diya tha.,2021-01-27T11:39:33Z,2021-01-27T11:39:33Z
,,,,,Shade-E,@Dalveer Kular bhai Andhe tum bhi ho.. main bhi Modi government ko support nhi karta par Itna bewajah bakwaass bhi mat bolo .. main bhi farmers protest support Kar rha tha par iss bakchodi ko na support karunga na justify.. Jo galat hai wo galat hai.. Peaceful protest ke support me tha main iss Tarah ki harkat bardaast Nahi ki jaa sakti .. It&#39;s an utter Shame.,2021-01-27T11:42:19Z,2021-01-27T11:42:19Z
,,,,,Aditya Raj,police ko maar kr gye hai ye sb...,2021-01-27T12:08:31Z,2021-01-27T12:08:31Z
,,,,,charu mehra,I think news mai aya tha ki bird flue ki wajah se 27 Jan tk band hai..to gate khula kaise reh gya wo bhi republic day par 🤔,2021-01-27T16:20:21Z,2021-01-27T16:20:21Z
,,,,,Bindu Verma,😂😂😂😂😂😂😂😂😂<br>Yh rabish mumar ka khasiyt hai,2021-01-27T17:24:35Z,2021-01-27T17:24:35Z
1104_Anik Barua,what happened in republic day cannot take lightly and a big loss for farmer. From the very beginning i support farmers decision over govt decision now i think Farmers should be apologize what happened with police and what happened in iot,2021-01-27T02:02:22Z,0,0,,,,
