Name,Comment,Time,Likes,Reply Count,Reply Author,Reply,Published,Updated
,,,,,Himanshu Chauhan,"@birraj kaur or neta nahi chahiye to kissan unions me neta kyo hai,or kal rayta faila kar kaha chip gaye the",2021-01-27T08:16:29Z,2021-01-27T08:16:29Z
,,,,,birraj kaur,@Himanshu Chauhan raita wo rajnitik log faila rhe h or unka support apke jaise log krte h ap hi kre inki gulami dusro ko gyan na de kripa krke,2021-01-27T08:21:52Z,2021-01-27T08:21:52Z
,,,,,Vishesh Bhaskar,@sachin meena चूतिये पहले contract पढ़ फिर यहा आकर कंमेंट करना,2021-01-27T08:47:30Z,2021-01-27T08:47:30Z
,,,,,Hiren Patel,@Himanshu Chauhan as expected. And the world knows who the real pappu is.,2021-01-27T09:57:56Z,2021-01-27T09:57:56Z
,,,,,Himanshu Chauhan,@Hiren Patel pappu ke chamche ko bura laga😀,2021-01-27T11:16:34Z,2021-01-27T11:16:34Z
,,,,,Hiren Patel,"@Himanshu Chauhan Ise sirf hoshiyar banne ki koshish kehte hai.<br>Modi, nahi pasand iska matlab ye nahi ki RaGa pasand. Tum ande ke ande rahoge,",2021-01-27T11:36:06Z,2021-01-27T11:36:06Z
,,,,,Himanshu Chauhan,@Hiren Patel bhaiya ji aap jite hum hare krpya bar bar ungal na kare danywad,2021-01-27T11:46:48Z,2021-01-27T11:46:48Z
,,,,,Hiren Patel,"@Himanshu Chauhan ye NDTV ka channel hai, andh bhakto ki yaha aake jati hai to aate kyu kai. Ungal nahi kisan hai ab to kudal karege.",2021-01-27T12:18:41Z,2021-01-27T12:18:41Z
,,,,,Himanshu Chauhan,"@Hiren Patel ab chamche hume sikhayege ki kon kisan hai kon kisan nahi jinhone aaj tak kheto ke darshan na kiye h.o jo aalu ko factory me banate ho jo seedhe lal mirch ki kheti katre ho jinhe gehun or dhan me antar na pata ho ,jinhe man beegha paseri vise ke bare mai pata na ho vo aaj hame kisani sikhayege.beta ye jaruri nahi ki sabhi kisan chamche ho.or desh ki janta aur mere jaise madhayam vargeeya kisan ye dekh rahe hai ki kis tarah inhone desh ka apmaan kiya kis tarah us yograaj ne hinduism or women ka apmaan kiya.samay samay par har chunav me chamcho ko inki aukat dikayi hai or agle chunav me bhi dekha lena bhakto ki takat ko",2021-01-27T15:22:03Z,2021-01-27T15:22:03Z
,,,,,Hiren Patel,"@Himanshu Chauhan Tum gadho ko ram ki ramayan aur krishna ki geeta nahi kuch sikha payi meri kya himmat jo tum jaiso ko sikhane chalu. Geeta ki ek line bhi to jivan me utar nahi sakte, kheti kya khak karoge tum. Tum haramiyo ko insaan nahi pehchanne ate koan kisan kya ghanta bataoge.",2021-01-27T15:30:19Z,2021-01-27T15:30:19Z
,,,,,Himanshu Chauhan,@Hiren Patel bhaiya Ramayan aur gita namak  grantho ki tareef karna  aap ke  secularist chavi ko dhumil kar sakti hai so please is secularism ka mukota pahane chuti@ banate rahe  dusaro ko bhi banaye lekin har kisi ko chutia na samje aap hi ek geeta gyani nahi hai is bharat varsh mai,2021-01-27T15:50:32Z,2021-01-27T15:50:32Z
,,,,,Himanshu Chauhan,@Hiren Patel aur kangress ke anusar jin shree ram ka astitaw hi nahi tha jo shree ram mandir ka virodh kar rahe the aur jinhe jai shree ram ek communal slogan lagta ho ve Ramayan ki to baat hi na kare,2021-01-27T15:53:35Z,2021-01-27T15:53:35Z
,,,,,Himanshu Chauhan,@Hiren Patel aur jo log kal tak america w house ki ghatna par ro rahe the aur use modi se jod rahe the ve log aaj lal kile ki gatana ko defend kar rahe hai.       Hypocrisy ki bhi seema hoti hai,2021-01-27T15:57:19Z,2021-01-27T15:57:19Z
,,,,,Srikanth Nair,"@Himanshu Chauhan Toh Udaipur High Court sarkari property nahi hai? Wahan jisne jhanda lagaya apne baap ki jagir samajh ke lagaya, nai?",2021-01-27T18:00:57Z,2021-01-27T18:00:57Z
MonU janGra,Bai ab dekho ravish ki media vs godi media 🤣🤣🤣सच में रवीस को कोई फ़र्क़ नहीं पड़ा जो लाल क़िले पर एक धर्म का जंडा लगाया ह।  यदि वहाँ पर कोई मुसलमान जंडा लगा देता तो फिर क्या बोलते ये लोग।   <br>में एक किसान हूँ लेकिन किसान आन्दोलन के पक्स मे नहीं हूँ <br>में इन क़ानूनों को एक बिज़नेस मेन के दिमाख से देख सकता हूँ। ओर ये मेरे हित मे ह,2021-01-26T20:35:22Z,0,0,,,,
rashmi jaitly,Ye loog kisan nahi ho sakte,2021-01-26T20:35:21Z,0,0,,,,
muZic festa,I think government should start rubber bullets so that no one will die but we can majorly control,2021-01-26T20:35:10Z,0,0,,,,
Shashi Kumar,Delhi Police ka control Central Govt ke andar aata he. Republic Day par bhi itna low security lagaya gaya he. Ye Central Govt ki kami ka natija he.,2021-01-26T20:34:42Z,0,0,,,,
GAURAV SINGH,hdd hai bhai... apka channel hi dikha rha ki police wale 20 feet diwar se kudd rhe hai aur apke journalism ko prnam jo aisi shrmnak incident ko kaise sfai se explain kiya ja rha,2021-01-26T20:34:34Z,0,1,,,,
,,,,,rahul yadav,Sahi bat👌 mujhse to dekha nhi ja raha police walein ki halat,2021-01-26T21:03:37Z,2021-01-26T21:03:37Z
Abhishek Chaubey,Yr abhi v tumhe sarm nhi aa rhi h.... Jo ki tum gunde ko v bachane lge<br>Sach me tum bahut besharm ho ravish kumar😢,2021-01-26T20:34:13Z,1,3,,,,
,,,,,rahul yadav,Sahi bat bhai👌,2021-01-26T20:53:59Z,2021-01-26T20:53:59Z
,,,,,Abhishek Chaubey,@rahul yadav bhai ye sbse bda gunda h.... Ye pseudo reporter h sb ko gumrah krta h,2021-01-26T20:58:09Z,2021-01-26T20:58:09Z
,,,,,rahul yadav,@Abhishek Chaubey yes bro👍,2021-01-26T21:05:44Z,2021-01-26T21:05:44Z
Review World,लाल बहादुर शास्त्री जी ने कहा था जय जवान जय किसान<br>लेकिन इस सरकार ने हल निकालने का काम नहीं किया बल्कि तारीख़ पर तारीख़ देकर और किसानो को समस्या को बढ़ाया और  जवान से किसान को लड़ाने का काम किया,2021-01-26T20:34:00Z,12,0,,,,
ashwani mishra,"Kisan talwar chala raha hai @ <a href=""https://www.youtube.com/watch?v=Ya5b9L9cL5Q&amp;t=20m08s"">20:08</a> pe to Mr. Ravish Kumar keh rahe hai ki kisan jid kar raha hai aage jane ke liye... aapke yaha jid talwar chala ke ki jati hai kya ...",2021-01-26T20:33:08Z,1,0,,,,
Gopal Krishan Kataria,"Abhi toh police ki vajah say ek bhi kissan nahin mara, nahin toh yey haraami aisey parlaap karta jaisey iska khud ka baap marr gaya ho....",2021-01-26T20:33:03Z,0,0,,,,
Aka Ash,अराजक तत्वों द्वारा चलाया जा रहा आंदोलन <br>लाल किले में भारतीय झंडे को फेंककर खलिस्तानी झंडे को फहराया गया <br>टिकैत व अन्य छूट दलों नेता की यही झंडे फहराए जाने की बात की गयी थी इसमें यही लोग मुँहपर कालिख पोत सफाई पेश करने लग जायेंगे,2021-01-26T20:32:43Z,1,0,,,,
Zahir Shah,Stand with Farmers👏❤<br>M  ( Modi)<br>A    ( Ameeth)<br>D    (  Doval )<br>BJP  is  MAD,2021-01-26T20:32:35Z,2,1,,,,
,,,,,Harry Bhangoo,Farmers,2021-01-26T20:53:02Z,2021-01-26T20:53:02Z
Gaurav Mishra,Ravish ji ....besharmi aur gaddari ki ek hadd hoti hai<br>Aap ne sab paar kr di,2021-01-26T20:31:55Z,0,0,,,,
Farhat Ara,"Two worlds largest democracies were under pressure this Jan 2021,copital hill USA,redfort Newdehli , what a wonderful coincidence, both the leaders best friends!!!! ,Howdy Modi Namste Trump,👍👍",2021-01-26T20:30:34Z,0,0,,,,
Sudhanshu Singh,Inka to thumbnail hi alag rehta<br>Agar police lati charg karti to inka headline rehta <br>Masumo pe police ne ki lathi charge.<br>Ab na ki tab v police doshi. Kya Rubish ji ghum phir k sarkar ko hi villian batana hai?,2021-01-26T20:30:14Z,0,0,,,,
Rajiv Rishidev,जानकारी सही देते हैं अन्य मिडिया सही जानकारी नहीं देता बात उलझाने लगता है जहाँ तक पुलिस के बैठने की बात दिखाए उससे किसान आक्रोश में शांति का शंदेसा जाता है वही शंदेसा देखकर जनता भी लाल किले खाली कर दिया यह देखने के बाद यकिन हुआ कि हम जो नारा एक साथ लगाते हैं &quot;जय जवान-जय किसान&quot; सफल और सारथक हुआ फिर कुछ झड़प तो हुआ वह बहुत ही सर्मसार हुआ और नींदनीय है,2021-01-26T20:30:04Z,14,1,,,,
,,,,,jagat singh,जान बचाने के लिए नाले में कूद मरते पुलिस कर्मी नही दिखाई दिए  सरम नही आती इस रवीश को । <br>कांग्रेस की चमचा गिरी करते करते  ढीट हो गया ह ये रविश,2021-01-27T12:13:49Z,2021-01-27T12:13:49Z
ManN ManN,bhola insaan ...kitna bhola hai re tu .<br><br>mtlb police ko firing krni chahiye .....lathi chalani chahiye ......<br>agar chala dete to phir aap av bhok bhok kr halla krte......<br><br>the Delhi Police commendable job by showing restrain.,2021-01-26T20:30:02Z,0,0,,,,
AA 123,"There is a conspiracy for sure, farmers will not change peace into violence for one day.",2021-01-26T20:29:54Z,0,0,,,,
Ali Raza,Nai to police wale maar jaye in ko rook k 🤪pagal ho Kiya,2021-01-26T20:29:38Z,0,0,,,,
Rafik khalifa Rafik khalifa,सब कोNDTV दीखावो कुके बादमे टाम यापके पास हो या नाहो  बाद मे 20 साल बाद बेटा बोले गा रवीस कुमार कोनथा आप नही बोल पायेगे ओ पागलथा  कुके याप का बेटा पागल नही होगा,2021-01-26T20:29:38Z,1,0,,,,
Kr Singh,मोदी नफ़रत में कितना गिरोग़े????,2021-01-26T20:29:35Z,1,0,,,,
Cpnc India,Tab to hindu .Muslim .aur sare darmo ka flag lagana chahiye red fort par 👍,2021-01-26T20:29:16Z,2,3,,,,
,,,,,ss,red fort pr khalsa flag pehle bhi tha isliye lgaya tha,2021-01-26T21:40:12Z,2021-01-26T21:40:12Z
,,,,,5911 Mafia,Tatto MA paani hy toh lgaa lo 😂,2021-01-27T00:01:24Z,2021-01-27T00:01:24Z
,,,,,PhantomX Pro,On 1783 Same Khalsa Flag Was Flagged On Red Fort! Sikh Fought against mughals Rights ! History Repeats🔥,2021-01-27T02:17:17Z,2021-01-27T02:17:17Z
DARTHASHPIE,So what did you want the police to do? Shoot the violent rioters? If they did that you would have gotten a chance to bash them again.,2021-01-26T20:28:40Z,0,0,,,,
izzat Khan Swati,Khalistan zindabad,2021-01-26T20:28:27Z,0,0,,,,
Arjun singh,थू   क्या न्यूज चनैल है सबसे खराब रवीश कुमार की सोच है एनडीटीवी को ऐसे बात के लिए लोग नहीं जानते    हमारे सुरक्षाकर्मी पे सवाल उठाते है    कोन सा देश में रहते है आप रवीश कुमार  जो आप ऐसे लोग को किसान बोलते हो   जो गद्दार लोग को हमेशा सपोर्ट करते हो,2021-01-26T20:28:15Z,0,0,,,,
Sukhjeet Kaur,"Ravish Kumar<br>There  is picture with<br>Modi ,sonny deol,Deep Sindhu,there is other MP in picture.<br>Modi ji know who is Deep Sindhu. If u want picture can have on<br>TV LIVE They put picture on TV.<br>Modi ji know who is Deep Sindhu.",2021-01-26T20:27:27Z,0,0,,,,
Akshay R,that&#39;s what happens When a tornado meets a volcano 🌪️🌋,2021-01-26T20:27:10Z,5,1,,,,
,,,,,The Spectre,It makes lavanado,2021-01-27T03:54:42Z,2021-01-27T03:54:42Z
Sandeep Sharma,Bhai trump ne capital hil karwaya power ki khatir ranga billa ke aadmi lal kile pe jhanda laga k badnam kargaye kisan ko,2021-01-26T20:27:07Z,0,0,,,,
love india,Bhai kya aaj kisi ko corona ka dar nhi tha kya,2021-01-26T20:26:47Z,0,0,,,,
Alimuddin Ali saha,This is the Indian government by midi.e kaisa sarkar graib Admi or fresh Kishan ko goli Mar Raha hai,2021-01-26T20:26:42Z,2,1,,,,
,,,,,Abhishek Pandey,"Kaha goli chali be, dimaag meh gober bhara hai kya??",2021-01-26T23:05:37Z,2021-01-26T23:05:37Z
DARTHASHPIE,Don&#39;t test the patience of us silent voters. First delhi riots last year and now this. Disrespecting our flag.,2021-01-26T20:26:38Z,0,0,,,,
Suraj Khan,Yeah jo hinsha howa hai isme pura RSS n BJP walon ka sath hai<br>Mera bharat mahan,2021-01-26T20:26:33Z,0,0,,,,
Manjit Virk,Deep Sidhu instigated it,2021-01-26T20:26:11Z,1,1,,,,
,,,,,Manjit Virk,He sent this route online day before,2021-01-26T20:26:42Z,2021-01-26T20:26:42Z
Cristatus,Kuch logo ne hinsa ki h kuch???😂😂<br>Aur police ki galti  to h hi<br>Kisano ki nai h??<br>Matlab ye to wahi baat hui ki chor to chori karega chor ki galti thodi h,2021-01-26T20:26:09Z,0,1,,,,
,,,,,rahul yadav,Sahi bat,2021-01-26T20:48:15Z,2021-01-26T20:48:15Z
Gul Mohammed,Very good news,2021-01-26T20:25:54Z,0,0,,,,
Hamidur Rahman,Ravish ji aap bhi bik gye  aap ke bagal men arnab ko nahi darna chahiye      ....or aap dar....,2021-01-26T20:25:32Z,0,0,,,,
gaurav kumar,Very biased reporting,2021-01-26T20:25:05Z,0,0,,,,
Abhi Jeet,Police k hath khule chorh dete to lal quila chorho delhi m enter ni kr pate ye lg..ravish kumar chutyapanti s upr utho thoda ....bjp or police k against jate jate humanity s bhot door ho chuke ho tum.....,2021-01-26T20:25:04Z,0,0,,,,
pushpander singh rathore,besharam patrakar hai tu,2021-01-26T20:24:48Z,0,0,,,,
Rohit,"Ch*tiya Ravish, if police had used force and guns then he would&#39;ve been first to scream &#39;mudi fascist&#39; etc. <br>Now police used restrain so he&#39;s blaming them<br>THIS hypocrisy and lies of the left will lead to its downfall",2021-01-26T20:24:36Z,8,0,,,,
Vinay Kumar,Ya apna bap k upar fire kra,2021-01-26T20:24:27Z,0,0,,,,
Sourav EE,Ap jaise log pehle bharkayenge phir bad me prime time me puchenge galti kiski thi?,2021-01-26T20:24:09Z,0,0,,,,
amit sarkar,Tum bhi godi media me samil ho geye<br>Boycott godi media ( ndtv),2021-01-26T20:24:04Z,0,0,,,,
Review World,Sir बार बार किसानो को तारीख़ पर तारीख दिया गया<br>लिहाजा कुछ अनहोनी होना ही था,2021-01-26T20:23:58Z,65,12,,,,
,,,,,Jagdeep sharma kaushik,ये किसान नहीं है 😡😡😡😡,2021-01-27T01:33:23Z,2021-01-27T01:33:23Z
,,,,,Nasim Ansari,@Jagdeep sharma kaushik Abe tu kitna bada andbhakt hai 😡😡😡😡😡😡😡😡😡😡😡😡😡,2021-01-27T01:54:01Z,2021-01-27T01:54:01Z
,,,,,Jaspreet Grewal,@Nasim Ansari  je modi ka  🦮,2021-01-27T01:56:02Z,2021-01-27T01:56:02Z
,,,,,Nasim Ansari,@Jaspreet Grewal right bro,2021-01-27T02:03:20Z,2021-01-27T02:03:20Z
,,,,,Atar Singh Meena,@Jagdeep sharma kaushik क्यों??,2021-01-27T02:06:22Z,2021-01-27T02:06:22Z
,,,,,nitish kumar shukla,Jai Shri ram jai Modi Modi jindabad,2021-01-27T03:02:45Z,2021-01-27T03:02:45Z
,,,,,Neetu Kumari,@nitish kumar shukla bhag be,2021-01-27T03:09:12Z,2021-01-27T03:09:12Z
,,,,,Jagdeep sharma kaushik,@Nasim Ansari हा भाई अंध बक्त ही सही पर गद्दार नहीं है,2021-01-27T06:32:12Z,2021-01-27T06:32:12Z
,,,,,Jagdeep sharma kaushik,"@Atar Singh Meena g.  जो देश का अपमान करे, शहीदो का अपमान करे वो किसान हो सकता है क्या 😡😡😡",2021-01-27T06:33:41Z,2021-01-27T06:33:41Z
,,,,,Nasim Ansari,@Jagdeep sharma kaushik to Jo jawano ke sahadat per Khushi manaye wo deshdrohi nahi hai,2021-01-27T14:30:46Z,2021-01-27T14:30:46Z
,,,,,Nasim Ansari,@Jagdeep sharma kaushik tum jaiso ki waja se desh Barbad ho Raha hai,2021-01-27T14:31:31Z,2021-01-27T14:31:31Z
,,,,,Nasim Ansari,@nitish kumar shukla are yaar Sri ram ki modi se tulna kar rahe ho kya,2021-01-27T14:32:37Z,2021-01-27T14:32:37Z
mustafa kamal BELE049,jhugta wahi hai jismai jaan hoti hai<br>akadna toh murdai ki pehchaan hoti hai<br>modi ji ab toh jhuk jawo.gha***nd nhi marenge<br>promise.,2021-01-26T20:23:37Z,3,0,,,,
Neeraj Thakur,"Jinko tum kisan bol rhe ho, wo terrorist hai",2021-01-26T20:23:13Z,0,0,,,,
Deepak Chandra,Country push towards civil war by the present central government like the TRUMP Government in USA.,2021-01-26T20:23:04Z,0,0,,,,
Pratik Sharma,Sharam Karo dalal...thandak padi tiranga girte dekh,2021-01-26T20:23:04Z,0,0,,,,
mahendr singh,Desh ka apman huwa h ye glt h,2021-01-26T20:23:03Z,2,1,,,,
,,,,,rahul yadav,Ekdam sahi bat,2021-01-26T20:56:46Z,2021-01-26T20:56:46Z
Avinash Srivastava,Govt was constantly  trying to say that  that some radical non sense group will join the rally and create destruction  but at time leaders of kisan netas were assuring us that no such incident would happen<br><br>Now it has happened<br>Who will pay the price for the destruction of respect of our motherland <br>Who will be held responsible  for putting india into bad light especially  on republic day.<br><br>I watched ur entire video but never u said that those non sense people must be arrested rather than  u tried put finger on efficiency of police .man how can police handle 1 kac people <br>Also u knowingly or unknowingly blamed govt of intentionally acting  leniently  and carelessly<br>U remember unfulfilled promises of modiji very well and condemn it every time now what about false promises of those leaders <br>U always cry that Democracy is in danger and govt  trying to control everything but today when democracy  was really insulted u dont condemn rather &quot; it&#39;s too early to decide what&#39;s gone wrong&quot;<br><br>Courage is not about standing against  the govt always but also to praise it for its work<br>Mob has no mind and none can control such a large mob<br>Do stop blaming others,2021-01-26T20:22:55Z,1,0,,,,
Sofia Nabi,Kisano ki koi galti nahi hai. Kisano ne sirf Bharat ja jhanda Lal Qile per pheraya hai. Kisan ekta zindabad,2021-01-26T20:22:54Z,0,0,,,,
P S,Shame on you for calling it intelligence failure and can’t see the barbaric behaviour of agitators which you couldn’t criticise. Stop being biased against Police.,2021-01-26T20:22:37Z,9,14,,,,
,,,,,Makeyoufit26 komale a.saboowala,"Godi media showing fake new 116 kissan died, and 85 police injured so all godi media barking dog",2021-01-28T04:23:45Z,2021-01-28T04:23:45Z
,,,,,RAJDEEP SINHA RAY,PS .. better you watch godhi media channels,2021-01-28T05:38:41Z,2021-01-28T05:38:41Z
,,,,,P S,@RAJDEEP SINHA RAY You do the same  Chamach media and don’t have to tell me what I have to watch. Democracy is both ways!,2021-01-28T07:46:38Z,2021-01-28T07:47:34Z
,,,,,P S,"@Makeyoufit26 komale a.saboowala Chamach media Dog stop spreading fake news, we  can compete on slang.",2021-01-28T07:49:19Z,2021-01-28T07:49:19Z
,,,,,RAJDEEP SINHA RAY,@P S I am wondering why you follow Ravish Kumar in YouTube🤣🤣..Do you represent BJP IT Cell,2021-01-28T07:54:00Z,2021-01-28T07:54:00Z
,,,,,P S,"@RAJDEEP SINHA RAY lol am wondering the same, how you know what Godi media is showing, are you part of Congress Fake news factory 😈",2021-01-28T08:15:45Z,2021-01-28T08:15:45Z
,,,,,RAJDEEP SINHA RAY,@P S we both are debating on NDTV(Ravish Kumar ) page....my question remains unanswered....being a bhakt..why are you following this page🤣🤣🤣,2021-01-28T08:20:32Z,2021-01-28T08:20:32Z
,,,,,P S,"@RAJDEEP SINHA RAY this was about content and not a person, you got it all wrong and deviated from topic. Having said that I am not following Chamach media, if you understand how the YouTube algorithm works when they show you more of similar content on news channels. I don’t need your opinion on what I should watch, last I checked we still a democracy so frankly live with your opinion and I am happy with mine.",2021-01-28T08:38:04Z,2021-01-28T08:38:04Z
,,,,,RAJDEEP SINHA RAY,@P S democracy under your beloved leader Modi.???😂😂 Democracy gone extinct wef 2014,2021-01-28T08:42:42Z,2021-01-28T08:42:42Z
,,,,,P S,"@RAJDEEP SINHA RAY hahaha funny enough you don’t understand our constitution and articles therein which grants us democracy and not person. You jump topics rampantly from Ravish to Modi, Heal soon☺️my prayers with you . Ta",2021-01-28T08:51:37Z,2021-01-28T08:51:37Z
,,,,,RAJDEEP SINHA RAY,@P S bhakts brain is half baked..so the understanding is limited only😂,2021-01-28T09:12:29Z,2021-01-28T09:12:29Z
,,,,,P S,"@RAJDEEP SINHA RAY lol chamcha is fully baked, no understanding left 😂😂",2021-01-28T12:42:48Z,2021-01-28T12:42:48Z
,,,,,RAJDEEP SINHA RAY,@P S true..you nailed it finally 😂,2021-01-28T12:48:19Z,2021-01-28T12:48:19Z
,,,,,P S,"@RAJDEEP SINHA RAY lol seems you very happy being chamcha, am happy for you 😁😂",2021-01-28T12:57:24Z,2021-01-28T12:57:24Z
Randhir Singh,"पाकिस्तान इसे खालिस्तानी झंडा बता रहा है। भाजपा भी इसे खालिस्तानी झंडा बता रही है। यानि मोदी और गोदी दोनों पाकिस्तान की भाषा बोल रहे है,,",2021-01-26T20:22:29Z,3,0,,,,
Roopinder Pal Singh Randhawa,"Patience was tested by making it difficult for the farmers. Farmers left the fort by themselves easy. That tells that they made a statement.<br><br>Why are killing the farmers ok in the chill of the winter? So many people dying for no reason, except for greed of the government owners.",2021-01-26T20:22:29Z,6,0,,,,
Devendra Panchal,ये लोग जो इस अराजक तत्वों को समर्थन कर रहे हैं उनकी मंशा पे संदेह होता है।<br>किसान आंदोलन नहीं है रहा अब इन लोगो की मंशा पे शक हो रहा है,2021-01-26T20:22:21Z,5,0,,,,
Sukhamoy Barman,"Es harkat ko jo samarthan karta haye , O sab deska gaddar haye , Apka gala etna cold kiu ????",2021-01-26T20:21:56Z,0,1,,,,
,,,,,marvelfan,i support.. 💪💪💪,2021-01-26T21:26:57Z,2021-01-26T21:26:57Z
Akshay Nair,"&quot;Kisaan Itna ugra nahi hua ki halat kharab ho jaye&quot;, ye Ravish ko aur kitna ugra chahiye tha bhai. DoGala reporter",2021-01-26T20:21:09Z,4,1,,,,
,,,,,With Chauhan Vlogs,Bahut bada waala hain d***a Hain,2021-01-26T20:49:05Z,2021-01-26T20:49:05Z
Rahul Jain,Sir it&#39;s a biased reporting today!! Why should police be questioned for such barbaric act by so called anndata? Why have farmers diverted from route? Even a single voilent act by any farmer pulls down the whole movement. Shameful this time from farmers. Not Expected !!,2021-01-26T20:20:56Z,0,0,,,,
Rajeev Ranjan,Chutiya hai kya ravish kumar,2021-01-26T20:20:51Z,0,0,,,,
Tiraj Kaur,"The farmers have been protesting for a while now, they have been patient for too long! Many of our farmers and those who protested have also sadly died but the media is not showing that.",2021-01-26T20:20:39Z,15,9,,,,
,,,,,Prabhsimranjot Kaur,Exactly!!! Bas ab is baat ko media wale aur BJP wale kuch aur hi rang denge,2021-01-26T21:19:10Z,2021-01-26T21:19:10Z
,,,,,arjunsinh zala,Tum khalsistaani ka insaaf hoga jaroor hoga tum desh k tirange ko nicha dikhaya hai tumhari (khalistanio)ki vajah se pura desh sharminda hai,2021-01-26T21:39:41Z,2021-01-26T21:39:41Z
,,,,,Prabhsimranjot Kaur,"Arjunsinh zala tumhare tukde tukde gang aur maowadiyo ka insaf bhi modi kr devega..bas dekhte raho. Baki tiranga to upar hi tha sabhi flags se. Sachi news dekha Karo, atankwadi lakhdar e media ki news nahi",2021-01-26T22:09:22Z,2021-01-26T22:09:22Z
,,,,,arjunsinh zala,@Prabhsimranjot Kaur Haha mere tukde tukde gang nahi jiski bhi gang hogi uski kehke lenge agar aap tukde tukde gang k khilaaf ho to aap mere sath ho bhai kya bat karte ho,2021-01-26T22:29:57Z,2021-01-26T22:29:57Z
,,,,,Prabhsimranjot Kaur,To tumne kaise khalistani bol diya fir? Agar khud maowadi nahi ho,2021-01-27T03:59:32Z,2021-01-27T03:59:32Z
,,,,,arjunsinh zala,@Prabhsimranjot Kaur aapk hisaab se desh me koi farmer nahi hai in so called peacefull  protestesters logo k siva ....,2021-01-27T05:38:31Z,2021-01-27T05:38:31Z
,,,,,Prabhsimranjot Kaur,@arjunsinh zala khalistani kyo bola yeh batao? Mera naam par ke?,2021-01-27T07:30:10Z,2021-01-27T07:30:10Z
,,,,,arjunsinh zala,@Prabhsimranjot Kaur mere bhai aap vahan par nahin honge mein bhi nahi tha lekin aap search karoge to shayad mile na mile apko video inhone khalistanio ne indian flag utarkar koi aur flag laga diya aap dekhoge to manoge agar aap nahi dekhoge ya dekhna nai chahate to aapke upar hai ..<br>Sikh hamare bhai hai lekin pakistan aur canada se milkar khalistan ko support mat karo video mile to dekhna bhai ..Images to mil jayegi ..Aap sachhe. Deshbhakt ko aur Bharat ko apni mata mante hoge to video dekhkar aaap sochna ...,2021-01-27T10:13:05Z,2021-01-27T10:13:05Z
