Name,Comment,tone
Bos Sha,And they ask you about the soul say the soul is a command of my Lord and you indeed you have had of knowledge just a little bit.,{'document_tone': {'tones': []}}
Uttam Halder,рдлреЗрдХреВ goverment рдЕрдорд╛рдирд╡реАрдпрддрд╛ рдХреА рд╕рд╛рд░реА рд╣рджреЗ рдкрд╛рд░ рдХрд░ рдЪреБрдХрд╛ рд╣реИ.. <br><br>рдЕрдм parliament рднреА рдмреЗрдЪ рджреЗрдЧрд╛ рддреЛ рднреА рдХреЛрдИ рдХреБрдЫ рдирд╣реАрдВ рдмреЛрд▓ рдкрд╛рдпреЗрдЧрд╛.. <br><br>рдХреЛрдИ рдХреБрдЫ рдмреЛрд▓реЗ рддреЛ рдЙрдиреНрд╣реЗ рднреА father stan swamy рдХреА рддрд░рд╣ рдЬреЗрд▓ рдореЗ рдбрд╛рд▓рдХреЗ рдорд╛рд░ рджреЗрдЧрд╛.. <br>рд╕рдЪ рдореЗ рдлреЗрдХреВ рдХреЗ рдмрд╛рдк рдХрд╛ рд░рд╛рдЬ рдЪрд▓ рд░рд╣рд╛ рд╣реИ..<br>..,{'document_tone': {'tones': []}}
Bos Sha,┘И┘К╪│╪г┘Д┘И┘Ж┘Г ╪╣┘Ж ╪з┘Д╪▒┘И╪н ┘В┘Д ╪з┘Д╪▒┘И╪н ┘Е┘Ж ╪г┘Е╪▒ ╪▒╪и┘К ┘И┘Е╪з ╪г┘И╪к┘К╪к┘Е ┘Е┘Ж ╪з┘Д╪╣┘Д┘Е ╪е┘Д╪з ┘В┘Д┘К┘Д╪з.,{'document_tone': {'tones': []}}
Roseline Benjamin,Sad heartbreaking God bless your soul father Stan Swamy ЁЯЩПЁЯЩПЁЯЩП,"{'document_tone': {'tones': [{'score': 0.535909, 'tone_id': 'joy', 'tone_name': 'Joy'}]}}"
Bos Sha,┘И┘Д╪з ╪к╪п╪▒┘К ┘Ж┘Б╪│ ╪и╪г┘К ╪г╪▒╪╢ ╪к┘Е┘И╪к.,{'document_tone': {'tones': []}}
Ravi Mishra,Whatsapp University...fb...twittter... wale judge aa gye honge apni judgement dene..ЁЯСПЁЯСП,{'document_tone': {'tones': []}}
Sad Com,"Desh Droh ke naam pe logoko khatm karne wala ye Desh. Jis desh me na garibo ki kadr hai, na Muslimo ki, na Dalit logo ki, na majdooro ki, na kisano ki! Aise desh me desh droh karna garv ki baat hai! Aise Desh me desh key khilaf yuddh karna hi sahi hai! Ye Desh insaaniyat ke khilaf hai! Laanat hai aise Desh par.","{'document_tone': {'tones': []}, 'sentences_tone': [{'sentence_id': 0, 'text': 'Desh Droh ke naam pe logoko khatm karne wala ye Desh.', 'tones': []}, {'sentence_id': 1, 'text': 'Jis desh me na garibo ki kadr hai, na Muslimo ki, na Dalit logo ki, na majdooro ki, na kisano ki! Aise desh me desh droh karna garv ki baat hai! Aise Desh me desh key khilaf yuddh karna hi sahi hai! Ye Desh insaaniyat ke khilaf hai! Laanat hai aise Desh par.', 'tones': [{'score': 0.516145, 'tone_id': 'joy', 'tone_name': 'Joy'}]}]}"
Vivek Pratap Singh,Communist ravish Kumar,{'document_tone': {'tones': []}}
Vivek Pratap Singh,Kitna chatoge be,{'document_tone': {'tones': []}}
Shibu M,India will always silence the truthтАж.they donтАЩt like people who help the poorтАж. They want to keep the poor poorerтАж.caste divides will still remainтАж.,"{'document_tone': {'tones': [{'score': 0.701027, 'tone_id': 'sadness', 'tone_name': 'Sadness'}, {'score': 0.901164, 'tone_id': 'confident', 'tone_name': 'Confident'}]}, 'sentences_tone': [{'sentence_id': 0, 'text': 'India will always silence the truthтАж.they', 'tones': [{'score': 0.530277, 'tone_id': 'sadness', 'tone_name': 'Sadness'}, {'score': 0.967339, 'tone_id': 'confident', 'tone_name': 'Confident'}]}, {'sentence_id': 1, 'text': 'donтАЩt like people who help the poorтАж.', 'tones': [{'score': 0.656082, 'tone_id': 'sadness', 'tone_name': 'Sadness'}, {'score': 0.681699, 'tone_id': 'tentative', 'tone_name': 'Tentative'}]}, {'sentence_id': 2, 'text': 'They want to keep the poor poorerтАж.caste', 'tones': [{'score': 0.645863, 'tone_id': 'sadness', 'tone_name': 'Sadness'}]}, {'sentence_id': 3, 'text': 'divides will still remainтАж.', 'tones': []}]}"
Sabyasachi Dasgupta,"Investigating agencies should be booked but unfortunately in our country the people at the top are simply ruthless and not bothered any other&#39;s interest, except their own.",{'document_tone': {'tones': []}}
Sikandra Kumar,ЁЯЩПЁЯЩПЁЯЩПЁЯЩП,"{'document_tone': {'tones': [{'score': 0.5621, 'tone_id': 'joy', 'tone_name': 'Joy'}]}}"
Jay Makwana,A zee news Anchor compared Stan Swamy with Hafees Sayeed and Osama bin laden even after his death. And questioned all those people that why they sympathize with a terrorism accused. The same anchor when it comes to making a terrorism accused a parliament member showed how she pats nad feed cows. I am so furious with godi media.,"{'document_tone': {'tones': [{'score': 0.546128, 'tone_id': 'analytical', 'tone_name': 'Analytical'}]}, 'sentences_tone': [{'sentence_id': 0, 'text': 'A zee news Anchor compared Stan Swamy with Hafees Sayeed and Osama bin laden even after his death.', 'tones': [{'score': 0.680723, 'tone_id': 'sadness', 'tone_name': 'Sadness'}, {'score': 0.724236, 'tone_id': 'analytical', 'tone_name': 'Analytical'}, {'score': 0.5538, 'tone_id': 'tentative', 'tone_name': 'Tentative'}]}, {'sentence_id': 1, 'text': 'And questioned all those people that why they sympathize with a terrorism accused.', 'tones': [{'score': 0.591321, 'tone_id': 'anger', 'tone_name': 'Anger'}, {'score': 0.775702, 'tone_id': 'confident', 'tone_name': 'Confident'}]}, {'sentence_id': 2, 'text': 'The same anchor when it comes to making a terrorism accused a parliament member showed how she pats nad feed cows.', 'tones': []}, {'sentence_id': 3, 'text': 'I am so furious with godi media.', 'tones': [{'score': 0.697351, 'tone_id': 'anger', 'tone_name': 'Anger'}]}]}"
,,{'document_tone': {'tones': []}}
Balraj Singh,LAAL SALAM ZINDABAD....Live long,{'document_tone': {'tones': []}}
imrana khan,ЁЯШеЁЯШеЁЯШеbohot afsos ye kya ho gaya mere mulk ko ЁЯЗоЁЯЗ│,"{'document_tone': {'tones': [{'score': 0.7716, 'tone_id': 'sadness', 'tone_name': 'Sadness'}]}}"
Walter Lobo,"So sad , Injustice of Modi Government.","{'document_tone': {'tones': [{'score': 0.86357, 'tone_id': 'sadness', 'tone_name': 'Sadness'}]}}"
SHellDie,"You will find bhakts calling father Stan a lot of names, don&#39;t lose your cool with them. Even hitler had his supporters, blind and misguided they may have been.","{'document_tone': {'tones': [{'score': 0.6954, 'tone_id': 'sadness', 'tone_name': 'Sadness'}, {'score': 0.963757, 'tone_id': 'tentative', 'tone_name': 'Tentative'}]}, 'sentences_tone': [{'sentence_id': 0, 'text': 'You will find bhakts calling father Stan a lot of names, don&#39;t lose your cool with them.', 'tones': [{'score': 0.577286, 'tone_id': 'sadness', 'tone_name': 'Sadness'}]}, {'sentence_id': 1, 'text': 'Even hitler had his supporters, blind and misguided they may have been.', 'tones': [{'score': 0.520094, 'tone_id': 'sadness', 'tone_name': 'Sadness'}, {'score': 0.946222, 'tone_id': 'tentative', 'tone_name': 'Tentative'}]}]}"
Trueindian Trueindian,The guy got what he deserved...parkinsonism by GOD and jail by authorities.....if u r anti national...we r also coming for u,{'document_tone': {'tones': []}}
Trueindian Trueindian,Ravish...what happened to farm laws crusade?..... u lost as usual,"{'document_tone': {'tones': [{'score': 0.619108, 'tone_id': 'sadness', 'tone_name': 'Sadness'}]}}"
liQuid Gaming AKA,"No more democracy,its DICTATORSHIP...",{'document_tone': {'tones': []}}
Roshan Zameer,Ashamed to be Indian because of these criminal politics and government,"{'document_tone': {'tones': [{'score': 0.944551, 'tone_id': 'analytical', 'tone_name': 'Analytical'}]}}"
Zebra Crossing,Shame on BJP government.<br>BJP rule is equivalent to tyranny.<br>This government has no consideration for humanitarian issues and uses NIA for fabricated cases.,"{'document_tone': {'tones': []}, 'sentences_tone': [{'sentence_id': 0, 'text': 'Shame on BJP government.<br>BJP', 'tones': []}, {'sentence_id': 1, 'text': 'rule is equivalent to tyranny.<br>This government has no consideration for humanitarian issues and uses NIA for fabricated cases.', 'tones': []}]}"
hindu,Kayar janta kayar log,{'document_tone': {'tones': []}}
Sisir Murmu,Is this our India or Taliban!!! Adivasi o ka haq marke sarkar kya prove karna chahti hai!!!,{'document_tone': {'tones': []}}
Rajesh Tanwar,"Chutiya, sunwayi sarkar kr rhi h ya court ;)","{'document_tone': {'tones': [{'score': 0.79019, 'tone_id': 'joy', 'tone_name': 'Joy'}]}}"
pabadhe,Is Ravish trying to say that the Judges hearing the case couldnt understand the situation or deliberately delaying the case?,"{'document_tone': {'tones': [{'score': 0.504887, 'tone_id': 'sadness', 'tone_name': 'Sadness'}, {'score': 0.69164, 'tone_id': 'tentative', 'tone_name': 'Tentative'}, {'score': 0.889429, 'tone_id': 'analytical', 'tone_name': 'Analytical'}]}}"
,,{'document_tone': {'tones': []}}
grace &ing,"ItтАЩs disgusting to see India getting better to worse used that kind of law for not to raise their voices front of governments, soon they can Beat North Korea.",{'document_tone': {'tones': []}}
DON BOSCO,Our judiciary is a body without heart a golden soul (stan) was deprived justice. An angel for poor and downtrodden.,"{'document_tone': {'tones': [{'score': 0.619926, 'tone_id': 'sadness', 'tone_name': 'Sadness'}]}, 'sentences_tone': [{'sentence_id': 0, 'text': 'Our judiciary is a body without heart a golden soul (stan) was deprived justice.', 'tones': [{'score': 0.505657, 'tone_id': 'joy', 'tone_name': 'Joy'}]}, {'sentence_id': 1, 'text': 'An angel for poor and downtrodden.', 'tones': [{'score': 0.557626, 'tone_id': 'fear', 'tone_name': 'Fear'}, {'score': 0.524344, 'tone_id': 'sadness', 'tone_name': 'Sadness'}]}]}"
Srinath Shrothrium,Can Stans death be compared to the lynching of Palghar Sadhus? Were Palghar sadhus a threat to Congress? Was it taken up with the US ambassador?,"{'document_tone': {'tones': [{'score': 0.857009, 'tone_id': 'analytical', 'tone_name': 'Analytical'}]}, 'sentences_tone': [{'sentence_id': 0, 'text': 'Can Stans death be compared to the lynching of Palghar Sadhus?', 'tones': [{'score': 0.815926, 'tone_id': 'sadness', 'tone_name': 'Sadness'}, {'score': 0.944551, 'tone_id': 'analytical', 'tone_name': 'Analytical'}]}, {'sentence_id': 1, 'text': 'Were Palghar sadhus a threat to Congress?', 'tones': [{'score': 0.822758, 'tone_id': 'fear', 'tone_name': 'Fear'}]}, {'sentence_id': 2, 'text': 'Was it taken up with the US ambassador?', 'tones': []}]}"
,,{'document_tone': {'tones': []}}
Mhod Aasim,Good job,"{'document_tone': {'tones': [{'score': 0.805063, 'tone_id': 'joy', 'tone_name': 'Joy'}]}}"
Narendra Singhania,рдЬреЛ рднрд╛рдЬрдкрд╛ рдирд╣реАрдВ рдХрд░рддреЗ рдЙрдиреНрд╣реЗрдВ рдЬреЗрд▓ рднреЗрдЬ рджрд┐рдпрд╛ рдЬрд╛рддрд╛ рд╣реИ,{'document_tone': {'tones': []}}
Wilson Raj,His blood is on this government,{'document_tone': {'tones': []}}
Narendra Singhania,рдиреНрдпрд╛рдп рдкреНрд░рдгрд╛рд▓реА рд╕рд░рдХрд╛рд░ рдХреА рджрд╛рд╕ рдмрди рдЧрдИ рд╣реИ,{'document_tone': {'tones': []}}
archana jadhav,ЁЯШФЁЯШФЁЯШФ,"{'document_tone': {'tones': [{'score': 0.780604, 'tone_id': 'sadness', 'tone_name': 'Sadness'}]}}"
Satish Saluja,Kanun wahi jo modijee ke man ko bhaye shame to government for such injustice,{'document_tone': {'tones': []}}
P M,Jai Shree Raam ЁЯЪйЁЯЪйЁЯЪй Jai Shri RaamЁЯТкЁЯП╗ЁЯТкЁЯП╗ЁЯТкЁЯП╗,{'document_tone': {'tones': []}}
Aman Deep,ЁЯШТЁЯШТЁЯШТVery sad  to hear this,"{'document_tone': {'tones': [{'score': 0.861235, 'tone_id': 'sadness', 'tone_name': 'Sadness'}, {'score': 0.961633, 'tone_id': 'confident', 'tone_name': 'Confident'}]}}"
Mala Sinha,"Moolah niwasi ke sath unyay, thor anarth.",{'document_tone': {'tones': []}}
Rubina Qureshi,No ravish sir i believe no body is trying to even get ur point...wat happened to fr stan was injustice n cruel ....n still ppl don&#39;t get this that turn by turn sabka number aayega.. n this will be the story of every house hold in India......bjp n Modi has to go,"{'document_tone': {'tones': [{'score': 0.660996, 'tone_id': 'sadness', 'tone_name': 'Sadness'}]}}"
Manoj Mohapatra,Acha din of criminal justice system...history will never forgive  the collective conscience of a state.,{'document_tone': {'tones': []}}
Parmjot Singh,Puri report dekh k meri roh kaamp gyi,"{'document_tone': {'tones': [{'score': 0.704642, 'tone_id': 'confident', 'tone_name': 'Confident'}]}}"
Manoj Mohapatra,Indian morality and conscience is dead .....soul had died since 7yrs and physically covid is daily killing dead.....rip  father......dear God tear away these draconian system...really Indians are not free....no matter what the crime 84yr sick man deserves bail...a state can hang on conviction but cant kill by denying bail....,"{'document_tone': {'tones': [{'score': 0.614715, 'tone_id': 'sadness', 'tone_name': 'Sadness'}, {'score': 0.517217, 'tone_id': 'analytical', 'tone_name': 'Analytical'}]}}"
Rajashree Choudhury,Is there any morality left in this country??,"{'document_tone': {'tones': [{'score': 0.88939, 'tone_id': 'tentative', 'tone_name': 'Tentative'}]}}"
Kapil Satdive,Swami ko bhavpurn shradhanjali,{'document_tone': {'tones': []}}
Rajashree Choudhury,Is there any humanity left ?? ЁЯЩП,"{'document_tone': {'tones': [{'score': 0.968123, 'tone_id': 'tentative', 'tone_name': 'Tentative'}]}}"
Aryan Singh,TADIPAAR KA 1 AUR MURDER!,{'document_tone': {'tones': []}}
Vikbohi The рд▓реЗрдЦрдХ,shame on you NIA..,"{'document_tone': {'tones': [{'score': 0.597667, 'tone_id': 'sadness', 'tone_name': 'Sadness'}]}}"
Rajesh Varghese,Ravish ji....super...love you. Be honest like this with your journalism,"{'document_tone': {'tones': [{'score': 0.809788, 'tone_id': 'joy', 'tone_name': 'Joy'}, {'score': 0.865388, 'tone_id': 'tentative', 'tone_name': 'Tentative'}]}, 'sentences_tone': [{'sentence_id': 0, 'text': 'Ravish ji....super...love you.', 'tones': [{'score': 0.87625, 'tone_id': 'joy', 'tone_name': 'Joy'}]}, {'sentence_id': 1, 'text': 'Be honest like this with your journalism', 'tones': [{'score': 0.681699, 'tone_id': 'tentative', 'tone_name': 'Tentative'}]}]}"
sakshi Tyagi,"Om shanti onЁЯЩПЁЯШЯЁЯШЯjo hua galt hua ha...sabko saja kyu milegi bhai vo to system ka log ha America jessa koi ha<br><br>Mujhe apne desh ka system and court par vishvas nhi ...system ka trika Jo ha vo illegal ha...politicans,godi media, system ki vhjha sa sab khrab ho gya....aj mera bada bhai hmre bich nhi reha kyu coivd....agr fake facts media,politicians,system apne administration par focus krte ha to death rate kam hote shyad kiska beta or beti bach skte.... Hospital administration bhi jimdar ha unhe phichla sal ka data or ane wale time ka pta second wave m kya hoga....<br><br>Ab kya aam janta apna system bnaye...<br><br>Ya satan sir ka sath bhi galt hua",{'document_tone': {'tones': []}}
Inderneil Bose Roy Chowdhury,Gobar Sarkar ke Right Wing ka ghotala aur shajish hai.. Tribal communities ko looteh hue aye hai 1947 se lekar aaj tak.. So be it Congress or Bjp.. Both are 3rd class Political party with criminal background at large.. Ignorant &amp; Superstitious citizens will keep on voting for such corrupt Government &amp; view cheap Bollywood movies &amp; Cricket matches...,"{'document_tone': {'tones': [{'score': 0.564885, 'tone_id': 'tentative', 'tone_name': 'Tentative'}]}, 'sentences_tone': [{'sentence_id': 0, 'text': 'Gobar Sarkar ke Right Wing ka ghotala aur shajish hai.. Tribal communities ko looteh hue aye hai 1947 se lekar aaj tak..', 'tones': []}, {'sentence_id': 1, 'text': 'So be it Congress or Bjp..', 'tones': [{'score': 0.946222, 'tone_id': 'tentative', 'tone_name': 'Tentative'}]}, {'sentence_id': 2, 'text': 'Both are 3rd class Political party with criminal background at large.. Ignorant &amp; Superstitious citizens will keep on voting for such corrupt Government &amp; view cheap Bollywood movies &amp; Cricket matches...', 'tones': []}]}"
arun thakur,It is heartbreaking...!!!! So Ashamed....God Bless his Soul...condolences  to His Family.,"{'document_tone': {'tones': [{'score': 0.526016, 'tone_id': 'sadness', 'tone_name': 'Sadness'}]}, 'sentences_tone': [{'sentence_id': 0, 'text': 'It is heartbreaking...!!!!', 'tones': []}, {'sentence_id': 1, 'text': 'So Ashamed....God Bless his Soul...condolences  to His Family.', 'tones': [{'score': 0.527783, 'tone_id': 'joy', 'tone_name': 'Joy'}]}]}"
Peeing human 2,Pm Modi should he held in contempt for the genocide and so many people and charges of terrorism should be put on him,{'document_tone': {'tones': []}}
saturn Parida,Fack and ruined judiciary,"{'document_tone': {'tones': [{'score': 0.610869, 'tone_id': 'anger', 'tone_name': 'Anger'}]}}"
Rajesh Varghese,Modi and Shah is dangerous for unity of India. NIA... please take action,"{'document_tone': {'tones': []}, 'sentences_tone': [{'sentence_id': 0, 'text': 'Modi and Shah is dangerous for unity of India.', 'tones': []}, {'sentence_id': 1, 'text': 'NIA... please take action', 'tones': []}]}"
Vijay Bhasker,"Indians can only think of collective solution if one man&#39;s food is another man&#39;s poison, this is really sad news","{'document_tone': {'tones': [{'score': 0.839762, 'tone_id': 'sadness', 'tone_name': 'Sadness'}, {'score': 0.9375, 'tone_id': 'analytical', 'tone_name': 'Analytical'}]}}"
Rajesh Varghese,Father&#39;s murder is on Modi and Shah. They are answerable but I know these phattus will not speak,"{'document_tone': {'tones': [{'score': 0.939283, 'tone_id': 'analytical', 'tone_name': 'Analytical'}]}, 'sentences_tone': [{'sentence_id': 0, 'text': 'Father&#39;s murder is on Modi and Shah.', 'tones': []}, {'sentence_id': 1, 'text': 'They are answerable but I know these phattus will not speak', 'tones': [{'score': 0.932977, 'tone_id': 'analytical', 'tone_name': 'Analytical'}]}]}"
Aman Aman,Itihaas dohraya jayega. Karma will strike. I dont know what stan swamy did or not but he was 84 years old person. Asking for sipper bcoz of parkinsons  that&#39;s shame for human rights.,"{'document_tone': {'tones': [{'score': 0.958239, 'tone_id': 'tentative', 'tone_name': 'Tentative'}]}, 'sentences_tone': [{'sentence_id': 0, 'text': 'Itihaas dohraya jayega.', 'tones': []}, {'sentence_id': 1, 'text': 'Karma will strike.', 'tones': []}, {'sentence_id': 2, 'text': 'I dont know what stan swamy did or not but he was 84 years old person.', 'tones': [{'score': 0.955608, 'tone_id': 'tentative', 'tone_name': 'Tentative'}]}, {'sentence_id': 3, 'text': 'Asking for sipper bcoz of parkinsons  that&#39;s shame for human rights.', 'tones': [{'score': 0.502031, 'tone_id': 'sadness', 'tone_name': 'Sadness'}]}]}"
Harchand kothala Malerkotla Punjab Dhaliwal,Thanks Rivis kumar from Harchand kothala Malerkotla Punjab,{'document_tone': {'tones': []}}
Arbin Mishra,stan swamy was a criminal,{'document_tone': {'tones': []}}
,,{'document_tone': {'tones': []}}
,,{'document_tone': {'tones': []}}
,,{'document_tone': {'tones': []}}
,,{'document_tone': {'tones': []}}
,,{'document_tone': {'tones': []}}
,,{'document_tone': {'tones': []}}
,,{'document_tone': {'tones': []}}
,,{'document_tone': {'tones': []}}
,,{'document_tone': {'tones': []}}
,,{'document_tone': {'tones': []}}
Khurshid Ahmed,"Stan swamy will remain in history as good Samaritan, the ruling party n NIA  who followed instructions from PM n HM, will face inner soul at least when they are bed ridden n see their families live in worst part of their poverty n diseases. God is there n we be he knows when to punish.","{'document_tone': {'tones': [{'score': 0.613832, 'tone_id': 'sadness', 'tone_name': 'Sadness'}]}, 'sentences_tone': [{'sentence_id': 0, 'text': 'Stan swamy will remain in history as good Samaritan, the ruling party n NIA  who followed instructions from PM n HM, will face inner soul at least when they are bed ridden n see their families live in worst part of their poverty n diseases.', 'tones': [{'score': 0.513783, 'tone_id': 'sadness', 'tone_name': 'Sadness'}]}, {'sentence_id': 1, 'text': 'God is there n we be he knows when to punish.', 'tones': [{'score': 0.703409, 'tone_id': 'analytical', 'tone_name': 'Analytical'}]}]}"
,,{'document_tone': {'tones': []}}
,,{'document_tone': {'tones': []}}
Saddam Hussain,Ye kutte harami sarkar h in bujurg ko bewajah utha liya gaya inki umr ki v lehaj nhi rakha wah bjp wale aur pragya Thakur jo thik h mgr wo bail m bahar h sehat khrb hone ki wajah se mgr wo atankwadi pragya Thakur usse chor diya bht khoob harami sarkar,{'document_tone': {'tones': []}}
Ankit kumar,Huge respect father Stan Swami ЁЯЩМ,"{'document_tone': {'tones': [{'score': 0.715247, 'tone_id': 'joy', 'tone_name': 'Joy'}]}}"
Lalit Sharma,Our Saint father didn&#39;t get justice..<br>Rest in Peace Father,"{'document_tone': {'tones': [{'score': 0.67158, 'tone_id': 'sadness', 'tone_name': 'Sadness'}]}}"
Shubham Sinha,No justice in india. Only this country is for zoo,"{'document_tone': {'tones': [{'score': 0.596122, 'tone_id': 'analytical', 'tone_name': 'Analytical'}]}, 'sentences_tone': [{'sentence_id': 0, 'text': 'No justice in india.', 'tones': []}, {'sentence_id': 1, 'text': 'Only this country is for zoo', 'tones': [{'score': 0.620279, 'tone_id': 'analytical', 'tone_name': 'Analytical'}]}]}"
Shubham Sinha,Ye india nahi hai ye butcher market hai jahan roj saachai ko maar dete hain. Hindu desh hai Musalman desh iss pe laddte raho please wo galati maat karna jo humarr parents ne kiya jiske wajah se aaj tak law and order are witch craft and magic in india . And if u think u can make it right bruh u r wrong this country has those people who suck your money and show themselves as baachare log. Ye desh mein roj tum tax dete ho wo bhi kha jaate hai,"{'document_tone': {'tones': [{'score': 0.502636, 'tone_id': 'sadness', 'tone_name': 'Sadness'}]}, 'sentences_tone': [{'sentence_id': 0, 'text': 'Ye india nahi hai ye butcher market hai jahan roj saachai ko maar dete hain.', 'tones': []}, {'sentence_id': 1, 'text': 'Hindu desh hai Musalman desh iss pe laddte raho please wo galati maat karna jo humarr parents ne kiya jiske wajah se aaj tak law and order are witch craft and magic in india .', 'tones': []}, {'sentence_id': 2, 'text': 'And if u think u can make it right bruh u r wrong this country has those people who suck your money and show themselves as baachare log.', 'tones': [{'score': 0.549185, 'tone_id': 'sadness', 'tone_name': 'Sadness'}]}, {'sentence_id': 3, 'text': 'Ye desh mein roj tum tax dete ho wo bhi kha jaate hai', 'tones': []}]}"
Saji Cherian,He is from TN and not Kerala,{'document_tone': {'tones': []}}
Yaesir arafat Molla,Ajj shram se sir jhuk gya.. Ajj ghin a raha hai.. Aise namard jhuta ghinone systems par reh raha hu.. Chiiii<br>Thooo aise judiciary par,{'document_tone': {'tones': []}}
Azmat Perween,Aap ki qurbani desh yaad rakhegi,{'document_tone': {'tones': []}}
Kankana sen,Inhuman Government. I have no words. RIP Stan Swamy,"{'document_tone': {'tones': []}, 'sentences_tone': [{'sentence_id': 0, 'text': 'Inhuman Government.', 'tones': []}, {'sentence_id': 1, 'text': 'I have no words.', 'tones': []}, {'sentence_id': 2, 'text': 'RIP Stan Swamy', 'tones': [{'score': 0.750176, 'tone_id': 'sadness', 'tone_name': 'Sadness'}]}]}"
Geeta Chilvari,Ae kesi court he Fr Stain garib loko ka Kam karte he uniko aesa Kiya damag he Kya 84 Age thi or Jell me  Modi Sirf Amiro ko dekhta he,{'document_tone': {'tones': []}}
Azmat Perween,"Sharmnaak, Akhir mar hi gai.",{'document_tone': {'tones': []}}
Geeta Chilvari,Modi sarkar ne Mara he fr stain ko aesi sarkar he sarkar ne madar Kiya he fr svarg me Jake Jisne bhi  fr ko Mara he vo sabko bhagvan chode get nai Modi sarkar ko hatavo Des se Plz bhagvan sab dekh rahe he sabka din aye ga,{'document_tone': {'tones': []}}
Braja bandhu Khora,"Sayad, court b BJP ki isaro pe chalati hen",{'document_tone': {'tones': []}}
srushti munjal,We r not deserving such a superhero ft.stanswami may rip,"{'document_tone': {'tones': [{'score': 0.560077, 'tone_id': 'sadness', 'tone_name': 'Sadness'}, {'score': 0.786991, 'tone_id': 'tentative', 'tone_name': 'Tentative'}]}}"
sanjeeb mohanty,Recall murder of Laxamnananda saraswati. Who killed him?,"{'document_tone': {'tones': [{'score': 0.908592, 'tone_id': 'analytical', 'tone_name': 'Analytical'}]}, 'sentences_tone': [{'sentence_id': 0, 'text': 'Recall murder of Laxamnananda saraswati.', 'tones': [{'score': 0.882284, 'tone_id': 'analytical', 'tone_name': 'Analytical'}]}, {'sentence_id': 1, 'text': 'Who killed him?', 'tones': [{'score': 0.931034, 'tone_id': 'fear', 'tone_name': 'Fear'}, {'score': 0.916667, 'tone_id': 'sadness', 'tone_name': 'Sadness'}]}]}"
Sk Ehesan,mahan desh he hamara madar karne wale log gaddi me war be kasur log jeel me dam tor rahe he wah kiya mahan desh he hamara <br>bharat zinda bad modi zinda bad amit sah zinda bad nia zinda bad,"{'document_tone': {'tones': [{'score': 0.774181, 'tone_id': 'sadness', 'tone_name': 'Sadness'}]}}"
sanjeeb mohanty,All the terrorist and its hidden promoter should be dealt strongly,"{'document_tone': {'tones': [{'score': 0.825035, 'tone_id': 'confident', 'tone_name': 'Confident'}]}}"
Braja bandhu Khora,"Steno ji ko sahid ki nam pe darja kiaa jana chahiye, steno ji aadibasi ke liye Amor rehenge.",{'document_tone': {'tones': []}}
