Name,Comment,tone
Susanta Mardi,Merciless government,{'document_tone': {'tones': []}}
Sachin,"Whine some more lol...white supremacy, fascist and what not... ЁЯШВЁЯШВЁЯШВ Meltdown achha laga ЁЯШнЁЯШнЁЯШн","{'document_tone': {'tones': [{'score': 0.77212, 'tone_id': 'sadness', 'tone_name': 'Sadness'}, {'score': 0.716301, 'tone_id': 'tentative', 'tone_name': 'Tentative'}]}}"
MD SEHAN,"рз│.<br><br>?<br><br><br>.<br>,<br><br><br>..",{'document_tone': {'tones': []}}
MD SEHAN,рз│рз│рз│,{'document_tone': {'tones': []}}
родро░рпНроородро╛роЪройрпН Indian,Whole bunch of anti nationals are in NDTV funded by Chinese. Boycott NDTV.,"{'document_tone': {'tones': []}, 'sentences_tone': [{'sentence_id': 0, 'text': 'Whole bunch of anti nationals are in NDTV funded by Chinese.', 'tones': []}, {'sentence_id': 1, 'text': 'Boycott NDTV.', 'tones': []}]}"
Dr Ratan Kumar,рдПрдХ рдЕрдВрдзреЗ рдХрд╛рдиреВрди рдФрд░ рдЕрдВрдз рднрдХреНрддреЛрдВ рдХреА рднреЗрдЯ рдЪрдв рдЧрдпреЗрдВ рдмреЗрдХрд╕реВрд░ рд╕реНрд╡рд╛рдореА,{'document_tone': {'tones': []}}
sandeep roy,Yep murdered by nia,{'document_tone': {'tones': []}}
Lalchand Jhorar,Who was this Satan chavani?,{'document_tone': {'tones': []}}
Robert Sahotra,Proud of sr. Ravish kumar .... God bless you,"{'document_tone': {'tones': [{'score': 0.955569, 'tone_id': 'joy', 'tone_name': 'Joy'}]}, 'sentences_tone': [{'sentence_id': 0, 'text': 'Proud of sr.', 'tones': [{'score': 0.933851, 'tone_id': 'joy', 'tone_name': 'Joy'}]}, {'sentence_id': 1, 'text': 'Ravish kumar .... God bless you', 'tones': [{'score': 0.890486, 'tone_id': 'joy', 'tone_name': 'Joy'}]}]}"
I love my India,рд╣рдорд╛рд░реЗ рд╕рдорд╛рдЬ рдХреЛ рдИрд╕рд╛рдИ рдмрдирд╛рдиреЗ рдХрд╛ рдХрд╛рдо рдХрд░рдиреЗ рд╡рд╛рд▓реЗ рд▓реЛрдЧ рдХреНрдпрд╛ рд╡рд╛рд╕реНрддрд╡ рдореЗрдВ рдЧрд╛рдВрд╡ рдХреЗ рд▓реЛрдЧреЛ рдХрд╛ рд╡рд┐рдХрд╛рд╕ рдЪрд╛рд╣рддреЗ рдереЗ? рдХреЗрд╡рд▓ рдЖрджрд┐рд╡рд╛рд╕реА рд╕рдорд╛рдЬ рдХреЗ рд▓реЛрдЧ рдХреЛ рд╣реА рдИрд╕рд╛рдИ рдмрдирд╛рддреЗ рд╣реИред рджреБрд╕рд░реЗ рд╕рдорд╛рдЬ рдХреЛ рдХреНрдпреБрдВ рдирд╣реАрдВ рдмрдирд╛рддреЗ? рд╕реЗрдХреБрд▓рд░рд┐рдЬреНрдо рдХреЗ рдирд╛рдо рдкрд░ рд╕рдирд╛рддрди рд╡реИрджрд┐рдХ рдзрд░реНрдо рд╕рдорд╛рдЬ рдХреЛ рддреЛрдбрд╝рдиреЗ рдХреА рдХреЛрд╢рд┐рд╢ рдХреА рдЧрдИ рд╣реИред рдЬреЛ &quot;рдЬреИрд╕рд╛ рдХрд░реНрдо рдХрд░реЗ рд╡реИрд╕рд╛ рдлрд▓ рдкрд╛рдпреЗ&quot; рдпрд╣реА рдиреАрддрд┐ рдХрд╛ рдирд┐рдпрдо рд╣реИред<br>-рдлрд╛рджрд░ рд╕реНрдЯреЗрди рдХреА рдЖрддреНрдорд╛ рдХреЛ рдИрд╕рд╛ рд╢рд╛рдВрддрд┐ рджреЗ ЁЯМ╣,"{'document_tone': {'tones': []}, 'sentences_tone': [{'sentence_id': 0, 'text': 'рд╣рдорд╛рд░реЗ рд╕рдорд╛рдЬ рдХреЛ рдИрд╕рд╛рдИ рдмрдирд╛рдиреЗ рдХрд╛ рдХрд╛рдо рдХрд░рдиреЗ рд╡рд╛рд▓реЗ рд▓реЛрдЧ рдХреНрдпрд╛ рд╡рд╛рд╕реНрддрд╡ рдореЗрдВ рдЧрд╛рдВрд╡ рдХреЗ рд▓реЛрдЧреЛ рдХрд╛ рд╡рд┐рдХрд╛рд╕ рдЪрд╛рд╣рддреЗ рдереЗ? рдХреЗрд╡рд▓ рдЖрджрд┐рд╡рд╛рд╕реА рд╕рдорд╛рдЬ рдХреЗ рд▓реЛрдЧ рдХреЛ рд╣реА рдИрд╕рд╛рдИ рдмрдирд╛рддреЗ рд╣реИред рджреБрд╕рд░реЗ рд╕рдорд╛рдЬ рдХреЛ рдХреНрдпреБрдВ рдирд╣реАрдВ рдмрдирд╛рддреЗ?', 'tones': []}, {'sentence_id': 1, 'text': 'рд╕реЗрдХреБрд▓рд░рд┐рдЬреНрдо рдХреЗ рдирд╛рдо рдкрд░ рд╕рдирд╛рддрди рд╡реИрджрд┐рдХ рдзрд░реНрдо рд╕рдорд╛рдЬ рдХреЛ рддреЛрдбрд╝рдиреЗ рдХреА рдХреЛрд╢рд┐рд╢ рдХреА рдЧрдИ рд╣реИред рдЬреЛ &quot;рдЬреИрд╕рд╛ рдХрд░реНрдо рдХрд░реЗ рд╡реИрд╕рд╛ рдлрд▓ рдкрд╛рдпреЗ&quot; рдпрд╣реА рдиреАрддрд┐ рдХрд╛ рдирд┐рдпрдо рд╣реИред<br>-рдлрд╛рджрд░ рд╕реНрдЯреЗрди рдХреА рдЖрддреНрдорд╛ рдХреЛ рдИрд╕рд╛ рд╢рд╛рдВрддрд┐ рджреЗ ЁЯМ╣', 'tones': []}]}"
Harit Singh Tomar,Even highcourt said Fr Louduswamy was a great man. ЁЯЩП,"{'document_tone': {'tones': [{'score': 0.757395, 'tone_id': 'joy', 'tone_name': 'Joy'}, {'score': 0.856622, 'tone_id': 'tentative', 'tone_name': 'Tentative'}]}, 'sentences_tone': [{'sentence_id': 0, 'text': 'Even highcourt said Fr Louduswamy was a great man.', 'tones': [{'score': 0.757395, 'tone_id': 'joy', 'tone_name': 'Joy'}, {'score': 0.856622, 'tone_id': 'tentative', 'tone_name': 'Tentative'}]}, {'sentence_id': 1, 'text': 'ЁЯЩП', 'tones': []}]}"
wakeup india,Rest in peace. Father.ЁЯТР,"{'document_tone': {'tones': [{'score': 0.728628, 'tone_id': 'sadness', 'tone_name': 'Sadness'}]}, 'sentences_tone': [{'sentence_id': 0, 'text': 'Rest in peace.', 'tones': [{'score': 0.812416, 'tone_id': 'sadness', 'tone_name': 'Sadness'}]}, {'sentence_id': 1, 'text': 'Father.ЁЯТР', 'tones': []}]}"
ans berri,"Uppar wala sab dekh raha hai,,,sab ka hisab  hoga we believe in Christ.","{'document_tone': {'tones': [{'score': 0.73677, 'tone_id': 'analytical', 'tone_name': 'Analytical'}]}}"
ans berri,NIA to dalla hai government ka,{'document_tone': {'tones': []}}
Af,рдлрд╛рджрд░  stan swami рдХреА рдордиреБрд╡рд╛рджрд┐рдпреЛрдВ рдиреЗ рд╣рддреНрдпрд╛ рдХрд░ рджреА,{'document_tone': {'tones': []}}
Poonam Verma Verma,ЁЯТРЁЯЩПЁЯП╗ЁЯСНЁЯП╗ЁЯСНЁЯП╗тЭд,"{'document_tone': {'tones': [{'score': 0.676464, 'tone_id': 'joy', 'tone_name': 'Joy'}]}}"
abhijit12325,Shame on you father stan..,"{'document_tone': {'tones': [{'score': 0.676933, 'tone_id': 'sadness', 'tone_name': 'Sadness'}]}}"
Kumar Rajan,"Lodu swamy was nexelite, hehehe",{'document_tone': {'tones': []}}
Nit Dandi,Naxal died.,"{'document_tone': {'tones': [{'score': 0.908059, 'tone_id': 'sadness', 'tone_name': 'Sadness'}]}}"
gaurav singh,"Comunist , secular , aur kya kehtey h vo haye allah ,, naxal , sadana ki maut pr hasney wala bchodi kar ra h aaj",{'document_tone': {'tones': []}}
pooja sonawane,"NIA should be held responsible for the years innocent people held in jail.  Newspapers should publish the news about the innocence  like they publish it when people are arrested. Indian jails provide many services to bomb blast accused, how can it not provide the mere sipper to the activist whose crime is not even proved?","{'document_tone': {'tones': [{'score': 0.869591, 'tone_id': 'tentative', 'tone_name': 'Tentative'}]}, 'sentences_tone': [{'sentence_id': 0, 'text': 'NIA should be held responsible for the years innocent people held in jail.', 'tones': []}, {'sentence_id': 1, 'text': 'Newspapers should publish the news about the innocence  like they publish it when people are arrested.', 'tones': [{'score': 0.615352, 'tone_id': 'tentative', 'tone_name': 'Tentative'}]}, {'sentence_id': 2, 'text': 'Indian jails provide many services to bomb blast accused, how can it not provide the mere sipper to the activist whose crime is not even proved?', 'tones': [{'score': 0.511787, 'tone_id': 'tentative', 'tone_name': 'Tentative'}]}]}"
nafi valalin,The country need people like Fr  Stan God the Almighty in heaven knows all.,"{'document_tone': {'tones': [{'score': 0.560098, 'tone_id': 'analytical', 'tone_name': 'Analytical'}]}}"
Charlin Muthappan,"It is murder, so please take action against Modi especially BJP.",{'document_tone': {'tones': []}}
Ashish Singh,Dukhad khabar hai,{'document_tone': {'tones': []}}
Ketan Bhargava,Wow a Maoist who had had the charges of over throwing democracy even HC refused his bail is now a marytr for the people. This is India where the army chief is called as &quot;Sadak ka Gunda&quot; and a Maoist is portrayed as &quot;Activist&quot;.,"{'document_tone': {'tones': [{'score': 0.647781, 'tone_id': 'tentative', 'tone_name': 'Tentative'}]}, 'sentences_tone': [{'sentence_id': 0, 'text': 'Wow a Maoist who had had the charges of over throwing democracy even HC refused his bail is now a marytr for the people.', 'tones': []}, {'sentence_id': 1, 'text': 'This is India where the army chief is called as &quot;Sadak ka Gunda&quot; and a Maoist is portrayed as &quot;Activist&quot;.', 'tones': []}]}"
,,{'document_tone': {'tones': []}}
RP Lall,"May his blessed soul rest in peace.The day of Judgment is very near wen every one will face it in front of Jesus Christ, nothing will be hidden.","{'document_tone': {'tones': [{'score': 0.514072, 'tone_id': 'sadness', 'tone_name': 'Sadness'}]}}"
Jmj Selvin,Salute NDTV,{'document_tone': {'tones': []}}
Charlin Muthappan,"Stop NIA,","{'document_tone': {'tones': [{'score': 0.560519, 'tone_id': 'anger', 'tone_name': 'Anger'}]}}"
Sandeep Chavan,ЁЯШД,"{'document_tone': {'tones': [{'score': 0.832238, 'tone_id': 'joy', 'tone_name': 'Joy'}]}}"
Neville Dsouza,BJpee and their bhakts .. can&#39;t expect humanity from them .. pure vultures..,"{'document_tone': {'tones': [{'score': 0.509368, 'tone_id': 'confident', 'tone_name': 'Confident'}, {'score': 0.589295, 'tone_id': 'analytical', 'tone_name': 'Analytical'}]}}"
Asha Lopes,Rest in peace fr stan Swamy you are in with your father who loves you so much  that you may not suffer any more in hands of wicked  government  you will be a saint one day,"{'document_tone': {'tones': [{'score': 0.581494, 'tone_id': 'sadness', 'tone_name': 'Sadness'}, {'score': 0.5538, 'tone_id': 'tentative', 'tone_name': 'Tentative'}]}}"
Asha Lopes,Shame on this Government misusing the power,"{'document_tone': {'tones': [{'score': 0.668239, 'tone_id': 'sadness', 'tone_name': 'Sadness'}]}}"
STARs Adivashi js,NDTV  рдХреЛ рдзрдиреНрдпрд╛рд╡рд╛рдж рдЬреЛ рдХрд┐ рд╣рдореЗрд╢рд╛ рд╕рдЪреНрдЪрд╛рдИ рдХреЛ рджрд┐рдЦрд╛рддреА рд╣реИ рдЖрдЬ рдореИрдВ рд╕рд┐рд░реНрдл NDTV  рд╣реА рджреЗрдЦрддрд╛ рд╣реВрдБ рдХреНрдпреЛрдВрдХрд┐ рдЖрдк рд╕рдЪреНрдЪрд╛рдИ рджрд┐рдЦрд╛рддреЗ рд╣реЛ,{'document_tone': {'tones': []}}
Alom Roy,Father Stan Swamy .... Red Salute... Long live revolution ..ЁЯЩП,"{'document_tone': {'tones': [{'score': 0.709389, 'tone_id': 'joy', 'tone_name': 'Joy'}]}}"
Salman Khan,NIA ya Police pe kya kanun lagna chahiye jab police NIA kisi ko jail daal deta hai 10-15 shak ke naam pe aur pata nai kya kya naam pe and fir uska 10-15 saal barbaad.. Wo kon bharke dega kon handle karega aise police walo ko ya NIA ko ya aise Government ko jo jaan buj kar logo ko target karti hai.. Kabi politics ke liye kabi election ko divert karne ke liye..,{'document_tone': {'tones': []}}
Salman Khan,"Koi Muslim BJP government ke khilaf bole ya protest kare then they are called Terrorist, jihadi and pakistani.. Any Christian speak against BJP Government then they are called moist funded by foreign and bla bla and if Dalit speaks about against BJP Government then they are urban naxal tukde tukde gang.. Wow.. And BJP doodh ki dhuli h.. BJP is the worst nothing else.. Wo chai wale ko kon marega chutye ko.. Jo RSS ke karan and Muslim se nafrat ke karan PM ban gaya hai..","{'document_tone': {'tones': [{'score': 0.576661, 'tone_id': 'tentative', 'tone_name': 'Tentative'}]}, 'sentences_tone': [{'sentence_id': 0, 'text': 'Koi Muslim BJP government ke khilaf bole ya protest kare then they are called Terrorist, jihadi and pakistani.. Any Christian speak against BJP Government then they are called moist funded by foreign and bla bla and if Dalit speaks about against BJP Government then they are urban naxal tukde tukde gang.. Wow..', 'tones': []}, {'sentence_id': 1, 'text': 'And BJP doodh ki dhuli h.. BJP is the worst nothing else.. Wo chai wale ko kon marega chutye ko.. Jo RSS ke karan and Muslim se nafrat ke karan PM ban gaya hai..', 'tones': []}]}"
Salman Khan,Why soo much power to central and NIA .. NIA lapdop of Modi and Amit Shah..,{'document_tone': {'tones': []}}
Md Sameeullah,Very Very shame on Indian government,"{'document_tone': {'tones': [{'score': 0.673111, 'tone_id': 'sadness', 'tone_name': 'Sadness'}, {'score': 0.989586, 'tone_id': 'confident', 'tone_name': 'Confident'}]}}"
Md Sameeullah,Shame on BJP government,{'document_tone': {'tones': []}}
Vikram Aditya,рдпрд╣реА рддреЛ рд╣реИ рдЖрдзреБрдирд┐рдХ рднрд╛рд░рдд рдХрд╛ рд░рд╛рдорд░рд╛рдЬ рдЬрд┐рд╕ рдореЗрдВ рджрд▓рд┐рддреЛрдВ рдЖрджрд┐рд╡рд╛рд╕рд┐рдпреЛрдВ рдУрдмреАрд╕реА рдФрд░ рдорди рдорд╛рдЗрдиреЙрд░рд┐рдЯреА  рдХреЗ рд▓реЛрдЧреЛрдВ рдХрд╛ рд╢реЛрд╖рдг рд╣реЛрдЧрд╛,{'document_tone': {'tones': []}}
Devendra Patel,Bahut badhiya ЁЯСПЁЯП╗ЁЯСПЁЯП╗ЁЯСПЁЯП╗,{'document_tone': {'tones': []}}
Brijesh Madhdheshya,Father stan swami gajab seculer naam hai,{'document_tone': {'tones': []}}
Selvaraj Selladurai,Get rid of Modi and save this nation.,"{'document_tone': {'tones': [{'score': 0.972852, 'tone_id': 'analytical', 'tone_name': 'Analytical'}]}}"
Fanindra Sharma,Badhai ho,{'document_tone': {'tones': []}}
Anju Minz,Fr.may u live in the heart of adiwasi people.,"{'document_tone': {'tones': [{'score': 0.556417, 'tone_id': 'joy', 'tone_name': 'Joy'}, {'score': 0.822231, 'tone_id': 'tentative', 'tone_name': 'Tentative'}]}}"
Nisha Verma,Iswer nyay kare,{'document_tone': {'tones': []}}
Rohit Kumar,That&#39; was all the planning of government to remove the Stan swamy through this case. This is a murder acted by government.,"{'document_tone': {'tones': [{'score': 0.930277, 'tone_id': 'confident', 'tone_name': 'Confident'}]}, 'sentences_tone': [{'sentence_id': 0, 'text': 'That&#39; was all the planning of government to remove the Stan swamy through this case.', 'tones': [{'score': 0.746197, 'tone_id': 'confident', 'tone_name': 'Confident'}]}, {'sentence_id': 1, 'text': 'This is a murder acted by government.', 'tones': []}]}"
Jawanaram Parmar,"рдЬрдм рддрдХ рдЬрдЬреЛрдВ рдХреА рдирд┐рдпреБрдХреНрддрд┐ рд╕рдВрд╡реИрдзрд╛рдирд┐рдХ рд░реВрдк рд╕реЗ рдирд╣реА рд╣реЛрдЧреА , рдкреНрд░рддрд┐рдирд┐рдзрд┐рддреНрд╡ рдХреЗ рдЕрдиреБрд╕рд╛рд░ рдирд╣реА рд╣реЛрдЧреА рддрдм рддрдХ рдРрд╕реЗ рд╣реА рд╣реЛрддрд╛ рд░рд╣реЗрдЧрд╛ред",{'document_tone': {'tones': []}}
Sukhdeen Markam,Baba ne sahi kaha hai ..ye savidhan agar sahi hatho me rahega to surakchit hai dunia ka best hai .but galat haatho me gaya to desh jal jaayega,"{'document_tone': {'tones': []}, 'sentences_tone': [{'sentence_id': 0, 'text': 'Baba ne sahi kaha hai ..ye savidhan agar sahi hatho me rahega to surakchit hai dunia ka best hai .but', 'tones': []}, {'sentence_id': 1, 'text': 'galat haatho me gaya to desh jal jaayega', 'tones': []}]}"
Arya YOUGANTAK,This killing if it is killing then this killing is awesome...,"{'document_tone': {'tones': [{'score': 0.788547, 'tone_id': 'analytical', 'tone_name': 'Analytical'}]}}"
puneet walia,Manipulation in its purest form,"{'document_tone': {'tones': [{'score': 0.578624, 'tone_id': 'joy', 'tone_name': 'Joy'}, {'score': 0.920855, 'tone_id': 'analytical', 'tone_name': 'Analytical'}]}}"
Arvind Mishra,84 saal ka istemaal....sjayad 22 baar...kavita srivastav...ha ha ha....pulitzar award kyon mila...dekho India,{'document_tone': {'tones': []}}
my suloi,RIP FR STAN SWAMY,"{'document_tone': {'tones': [{'score': 0.695573, 'tone_id': 'sadness', 'tone_name': 'Sadness'}]}}"
Uma Shanker Ram,Shame to you rabbis the great. Traitor indeed.,"{'document_tone': {'tones': [{'score': 0.551044, 'tone_id': 'sadness', 'tone_name': 'Sadness'}, {'score': 0.986725, 'tone_id': 'confident', 'tone_name': 'Confident'}, {'score': 0.694442, 'tone_id': 'analytical', 'tone_name': 'Analytical'}]}, 'sentences_tone': [{'sentence_id': 0, 'text': 'Shame to you rabbis the great.', 'tones': [{'score': 0.616744, 'tone_id': 'sadness', 'tone_name': 'Sadness'}]}, {'sentence_id': 1, 'text': 'Traitor indeed.', 'tones': [{'score': 0.996934, 'tone_id': 'confident', 'tone_name': 'Confident'}, {'score': 0.920855, 'tone_id': 'analytical', 'tone_name': 'Analytical'}]}]}"
Rajesh Shaw,Bb,{'document_tone': {'tones': []}}
diana choeyang,"Desh ko blast karnewale to mazey se tamasha dekh raha hai!!! Bakto ki kirpa hai desh ko bech raha hai, jaise ma beheno ko b!!!","{'document_tone': {'tones': [{'score': 0.505615, 'tone_id': 'joy', 'tone_name': 'Joy'}]}}"
Sam Dhariwal,"рдПрдХ рдирд┐рд░реНрджреЛрд╖ рд╕рдВрдд рдХреА рдореГрддреНрдп рдЗрд╕ рдмрд╛рдд рдХрд╛ рдЪрд┐рдиреНрд╣ рд╣реИ рдХрд┐ рд╡рд┐рдирд╛рд╢ рдЕрдм рджреВрд░ рдирд╣реАрдВ рд╣реИ I рдПрдХ рднрд╛рд░рддреАрдп рд╣реЛрдиреЗ рдХреЗ рдирд╛рддреЗ рд╣рдореЗ рдЪрд╛рд╣рд┐рдпреЗ рдХрд┐ рд╣рдо рдкреВрд░реЗ рд░рд╛рд╖реНрдЯреНрд░ рдХреЛ рдкреНрд░рд╛рдпрд╢реНрдЪрд┐рдд рдХрд░рдирд╛ рдЪрд╛рд╣рд┐рдП I <br><br>Ravish рдЬреА  рдЖрдкрдХрд╛ рдзрдиреНрдпрд╡рд╛рдж ,<br>рдИрд╢реНрд╡рд░ рдЖрдкрдХреА рджреБрд╖реНрдЯреЛрдВ рд╕реЗ рд░рдХреНрд╖рд╛ рдХрд░реЗ рдФрд░ рдЖрдкрдХреЛ рд╕рддреНрдп рдХреЛ рдЬрд╛рдирдиреЗ рдФрд░ рдкреНрд░рдХрдЯ рдХрд░рдиреЗ рдореЗрдВ рд╕рд╣рд╛рдпрддрд╛ рдХрд░реЗ I",{'document_tone': {'tones': []}}
RAUL CONRAD,If the government of India runs scared of a 84 year old physically sick man then I can only say hey Ram.  Save these people.,"{'document_tone': {'tones': [{'score': 0.509556, 'tone_id': 'fear', 'tone_name': 'Fear'}, {'score': 0.900364, 'tone_id': 'analytical', 'tone_name': 'Analytical'}]}, 'sentences_tone': [{'sentence_id': 0, 'text': 'If the government of India runs scared of a 84 year old physically sick man then I can only say hey Ram.', 'tones': [{'score': 0.574962, 'tone_id': 'fear', 'tone_name': 'Fear'}, {'score': 0.653099, 'tone_id': 'analytical', 'tone_name': 'Analytical'}]}, {'sentence_id': 1, 'text': 'Save these people.', 'tones': [{'score': 0.955445, 'tone_id': 'analytical', 'tone_name': 'Analytical'}]}]}"
vikaslakrasj,рдЬрдм рддрдХ рд╕реВрд░рдЬ рдЪрд╛рдБрдж рд░рд╣реЗрдЧрд╛ рдореЛрджреА рдмрд╛рдмрд╛ рд╢рд╛рдиреНрдд рд░рд╣реЗрдЧрд╛ред lolЁЯШК,"{'document_tone': {'tones': [{'score': 0.873327, 'tone_id': 'joy', 'tone_name': 'Joy'}]}}"
Raise Passi,God bless the adivasi,"{'document_tone': {'tones': [{'score': 0.922322, 'tone_id': 'joy', 'tone_name': 'Joy'}]}}"
Akash Momin,тЭдтЭдтЭдЁЯСН,"{'document_tone': {'tones': [{'score': 0.853929, 'tone_id': 'joy', 'tone_name': 'Joy'}]}}"
Dhananjay Singh,Sir abhi samaj yesa hogya hai ki koi sach sunna hi nhi chahta log hindu muslim<br>Mandir masjid ki ladai me khus hai,{'document_tone': {'tones': []}}
VIVEK GAUTAM,"рдЕрджрд╛рд▓рддреЗрдВ, рдЪреБрдирд╛рд╡ рдЖрдпреЛрдЧ, рд╕рд╛рд░реЗ рдЖрдпреЛрдЧ рдЖрд░ рдПрд╕ рдПрд╕ рдФрд░ рдмреАрдЬреЗрдкреА рдЕрдореНрдмрд╛рдиреА рдЕрдбрд╛рдиреА рдиреЗ рдЦрд░реАрдж рд▓рд┐рдпрд╛ рд╣реИ",{'document_tone': {'tones': []}}
Bigyan Sahoo,In dosio ko treatment kia phasi turant dena chahiye,{'document_tone': {'tones': []}}
Madhukar Manohar,"Why you people calling him Swami  as if he was Hindu . His name was Sami .. he was doing the the work of converting  poor Hindu aadivasi in to his religion. He was funded by inter national lobies who work against Hindu religion. But just to  symethise Hindu people, your agenda is to show as if he was Swami and Hindu. If you  have any guts  why don&#39;t you give his real name Sami and telling people he has converted thoda da of Hindu in his religion..","{'document_tone': {'tones': [{'score': 0.624873, 'tone_id': 'sadness', 'tone_name': 'Sadness'}, {'score': 0.567218, 'tone_id': 'tentative', 'tone_name': 'Tentative'}]}, 'sentences_tone': [{'sentence_id': 0, 'text': 'Why you people calling him Swami  as if he was Hindu .', 'tones': [{'score': 0.550852, 'tone_id': 'sadness', 'tone_name': 'Sadness'}, {'score': 0.653099, 'tone_id': 'analytical', 'tone_name': 'Analytical'}]}, {'sentence_id': 1, 'text': 'His name was Sami .. he was doing the the work of converting  poor Hindu aadivasi in to his religion.', 'tones': [{'score': 0.670902, 'tone_id': 'sadness', 'tone_name': 'Sadness'}]}, {'sentence_id': 2, 'text': 'He was funded by inter national lobies who work against Hindu religion.', 'tones': []}, {'sentence_id': 3, 'text': 'But just to  symethise Hindu people, your agenda is to show as if he was Swami and Hindu.', 'tones': [{'score': 0.5538, 'tone_id': 'tentative', 'tone_name': 'Tentative'}]}, {'sentence_id': 4, 'text': 'If you  have any guts  why don&#39;t you give his real name Sami and telling people he has converted thoda da of Hindu in his religion..', 'tones': []}]}"
Oodnari Alina,Pragya thakur can get bail bt sten Swamy could not..so sad ....... democracy is demolished finished and doomed in india since so long...ЁЯЩП Atma mar chuki he ham sabki.....,{'document_tone': {'tones': []}}
Bipin Jha,Inko goli marna  chyai <br>Inka bhasan sunogay to aapka khun khol jayai ga <br>Yai  log dalit ko uskata thai <br>Tai log naxalwadi ko badhwa dai raha tha,{'document_tone': {'tones': []}}
Oodnari Alina,Kya kahu .......aaj kal trend he kisi ko b uapa laga k ander krne ka kadi ninda krne ka or jaach krne ka ....bs yahi bacha he ..... corrupt politicians ko b jail me daalne ki takat he kya is democracy me ...sharm aati he khud pe or is desh peЁЯЩП,{'document_tone': {'tones': []}}
Roshni Horo,"Fr s swamy ki hi nahi, hamare nyayik vyavastha kiwi nirman hatya hai ЁЯШн","{'document_tone': {'tones': [{'score': 0.773205, 'tone_id': 'sadness', 'tone_name': 'Sadness'}]}}"
Etore Costa,Terrorist organisations RSS  se kya ummid kar sakten?.,{'document_tone': {'tones': []}}
Aksa M. Wani,Thanks for mentioning about Bashir Ahmad Baba and Nissar.,"{'document_tone': {'tones': [{'score': 0.5538, 'tone_id': 'tentative', 'tone_name': 'Tentative'}]}}"
Jugal Nath,Shame on Modi govt.,"{'document_tone': {'tones': [{'score': 0.775059, 'tone_id': 'sadness', 'tone_name': 'Sadness'}]}}"
Luke Jalal,So he deserved state funeral. International community is requested to interfere in the murder conducted by esteemed Government of India.,"{'document_tone': {'tones': [{'score': 0.674757, 'tone_id': 'sadness', 'tone_name': 'Sadness'}]}, 'sentences_tone': [{'sentence_id': 0, 'text': 'So he deserved state funeral.', 'tones': [{'score': 0.769, 'tone_id': 'sadness', 'tone_name': 'Sadness'}]}, {'sentence_id': 1, 'text': 'International community is requested to interfere in the murder conducted by esteemed Government of India.', 'tones': []}]}"
Artin shar,"Thank you Modiji ,Another head under your crown. ЁЯТА ЁЯТА ЁЯТАЁЯж┤ЁЯж┤ <br>More you kill  ЁЯТАЁЯТАЁЯТА,More votes you will get.Thank you for growing bjp.","{'document_tone': {'tones': []}, 'sentences_tone': [{'sentence_id': 0, 'text': 'Thank you Modiji ,Another head under your crown.', 'tones': [{'score': 0.643038, 'tone_id': 'joy', 'tone_name': 'Joy'}]}, {'sentence_id': 1, 'text': 'ЁЯТА ЁЯТА ЁЯТАЁЯж┤ЁЯж┤ <br>More you kill  ЁЯТАЁЯТАЁЯТА,More votes you will get.Thank you for growing bjp.', 'tones': []}]}"
