Name,Comment,tone
Lalita parvi,Hlo sir plsss help me,{'document_tone': {'tones': []}}
Chandan Prasad,Mara gaya Urban naxal .,{'document_tone': {'tones': []}}
Prashant Babu,Ye mere watan k logo..kya tumhare saarir ka khoon nhi ubaltaa..yaad rakhna inn masoom ki murder ka jawaab denaa hogaa..,{'document_tone': {'tones': []}}
sunny rao,"A great passionate personality of this Generation, <br>Great role model","{'document_tone': {'tones': [{'score': 0.706494, 'tone_id': 'joy', 'tone_name': 'Joy'}]}}"
rk roze,рдкрд╛рдХрд┐рд╕реНрддрд╛рди рдмрд╛рдВрдЧреНрд▓рд╛рджреЗрд╢ рдФрд░ рднрд╛рд░рдд рдореЗрдВ рдИрд╕рд╛рдЗрдпреЛрдВ рдкрд░ рд╣рдорд▓реЗ рдмрдбрд╝рддреЗ рд╣реА рдЬрд╛ рд░рд╣реЗ рдореБрд╕реНрд▓рд┐рдо рдФрд░ рд╣рд┐рдиреНрджреВ рд╕рдорд╛рдЬ   рд╕рд╣рдирд╢реАрд▓рддрд╛ рдЦреЛ рд░рд╣реЗ рд╣реИ,{'document_tone': {'tones': []}}
ASHU THE TRAVELLER,Rip,{'document_tone': {'tones': []}}
rk roze,рдорд╛рд╡реЛрд╡рд╛рдж рдХреЗ рдЕрдЧреНрд░рдгреА рдиреЗрддрд╛ рдФрд░ рдИрд╕рд╛рдИ рдкреНрд░рдЪрд╛рд░ рдХреЗ рдЕрдЧреНрд░рдгреА рдиреЗрддрд╛ рдорджрд░ рдЯреЗрд░реЗрд╕рд╛ рдХреЗ рд╢рд┐рд╕реНрдп рдереЗ рдЗрдиреНрд╣реЛрдВрдиреЗ рдкрдВрдЬрд╛рдм рдЬ рдХреЗ рдХреЗрд░рд▓ рдЬрд░рдЦрдВрдб рдореЗрдВ рдИрд╕рд╛рдИ рдзрд░реНрдо рдХрд╛ рдкреНрд░рд╕рд╛рд░ рдХрд┐рдпрд╛ рдЙрдиреНрд╣реЛрдВрдиреЗ рд▓рд╛рдЦреЛ рдЧрд░реАрдм рдореБрд╕реНрд▓рд┐рдореЛ рд╣рд┐рдВрджреБрдУрдВ рдФрд░ рд╕рд┐рдЦреЛрдВ рдХреЛ рдИрд╕рд╛рдИ рдзрд░реНрдо рдореЗрдВ рд╢рд╛рдорд┐рд▓ рдХрд┐рдпрд╛ рдИрд╕рд╛рдИ рд╕рдореБрджрд╛рдп рдХреЛ рдЖрд╡рд╛рдЬ рдЙрдард╛рдирд╛ рдЪрд╛рд╣рд┐рдП,{'document_tone': {'tones': []}}
Gerard Tirkey,This is mur,{'document_tone': {'tones': []}}
,,{'document_tone': {'tones': []}}
Ramesh Chandra Jena,"His death is a sorry state of affairs <br>Actually Ravish  kumar is great man,reporter.","{'document_tone': {'tones': [{'score': 0.751512, 'tone_id': 'confident', 'tone_name': 'Confident'}]}}"
narasimha murthy,He was Samy and not Swami. He was a Phillipino priest who was indulging in converting Oria adivasis to Christianity. Why don&#39;t you tell these facts to people? You seem to have only one agenda which is to show the present government in bad taste. I wonder do you see anything good done by this government? I watch your program to get the view of opposition but it seems that you behave like a paid agent of opponents of this country. It&#39;s really unfortunate.,"{'document_tone': {'tones': [{'score': 0.854553, 'tone_id': 'tentative', 'tone_name': 'Tentative'}, {'score': 0.621336, 'tone_id': 'analytical', 'tone_name': 'Analytical'}]}, 'sentences_tone': [{'sentence_id': 0, 'text': 'He was Samy and not Swami.', 'tones': []}, {'sentence_id': 1, 'text': 'He was a Phillipino priest who was indulging in converting Oria adivasis to Christianity.', 'tones': []}, {'sentence_id': 2, 'text': 'Why don&#39;t you tell these facts to people?', 'tones': [{'score': 0.882284, 'tone_id': 'analytical', 'tone_name': 'Analytical'}, {'score': 0.849827, 'tone_id': 'confident', 'tone_name': 'Confident'}]}, {'sentence_id': 3, 'text': 'You seem to have only one agenda which is to show the present government in bad taste.', 'tones': [{'score': 0.58393, 'tone_id': 'tentative', 'tone_name': 'Tentative'}]}, {'sentence_id': 4, 'text': 'I wonder do you see anything good done by this government?', 'tones': [{'score': 0.957828, 'tone_id': 'tentative', 'tone_name': 'Tentative'}]}, {'sentence_id': 5, 'text': 'I watch your program to get the view of opposition but it seems that you behave like a paid agent of opponents of this country.', 'tones': [{'score': 0.594263, 'tone_id': 'tentative', 'tone_name': 'Tentative'}]}, {'sentence_id': 6, 'text': 'It&#39;s really unfortunate.', 'tones': [{'score': 0.882284, 'tone_id': 'analytical', 'tone_name': 'Analytical'}]}]}"
,,{'document_tone': {'tones': []}}
Arpit Sinha,&#39;Hospital me&#39;,"{'document_tone': {'tones': [{'score': 0.931034, 'tone_id': 'fear', 'tone_name': 'Fear'}, {'score': 0.916667, 'tone_id': 'sadness', 'tone_name': 'Sadness'}]}}"
Kalaam Sk,Hasbhi allah nyamal wa kel.satyame jyate,{'document_tone': {'tones': []}}
ravi jani,рдпреЗ рд▓реЛрдЧ рдЖрджрд┐рд╡рд╛рд╕реА рд╡рд┐рд╕реНрддрд╛рд░ рдореЗрдВ рдЬрд╛рдХрд░ рдХрдиреНрд╡рд░реНрд╢рди рдХрд╛ рдХрд╛рдо рдХрд░рддреЗрдВ рд╣реИред,{'document_tone': {'tones': []}}
Kripa Gautam,"Sarkar udhiyog patio ki gulam h.Bharat me Shoshone   is samay pith pr h .Dalito or musalmano me agar koi SanvidhN ke paksh me baat karna janta h .wah Desh ka Dushan Bata deti h Sarkar.or Jailo me dal deti h.Jitne Log chahe Aadi wasio ke bich kaam kr rahe ho,ya koure gawan ka Jashan ho ,sabhi samaj sewak Desh or bjp ghazal Bata kr jail me dal diya jata h.","{'document_tone': {'tones': [{'score': 0.859075, 'tone_id': 'tentative', 'tone_name': 'Tentative'}]}, 'sentences_tone': [{'sentence_id': 0, 'text': 'Sarkar udhiyog patio ki gulam h.Bharat me Shoshone   is samay pith pr h .Dalito or musalmano me agar koi SanvidhN ke paksh me baat karna janta h .wah', 'tones': []}, {'sentence_id': 1, 'text': 'Desh ka Dushan Bata deti h Sarkar.or', 'tones': [{'score': 0.88939, 'tone_id': 'tentative', 'tone_name': 'Tentative'}]}, {'sentence_id': 2, 'text': 'Jailo me dal deti h.Jitne Log chahe Aadi wasio ke bich kaam kr rahe ho,ya koure gawan ka Jashan ho ,sabhi samaj sewak Desh or bjp ghazal Bata kr jail me dal diya jata h.', 'tones': []}]}"
Quamrul Hassan,"Nail/justice mar guys, BJP, RSS jeet giya.",{'document_tone': {'tones': []}}
Roshni Tirkey,India ka  sarkar bhut hi kharab hai sb ke sb gush khor hai eske wajs se father ka death huwaЁЯШИЁЯШИ,{'document_tone': {'tones': []}}
Pappu Singh,рдЗрд╕рдХреЗ рдЦрд┐рд▓рд╛рдл рд╕рд╛рд░реЗ рд╕рдмреВрдд рдереЗ рдРрд╕реЗ рд╣реА рдЬрд┐рд▓реЗ рдореЗрдВ рдирд╣реАрдВ рдерд╛,{'document_tone': {'tones': []}}
sangeeta nelson,This is sheer murder,{'document_tone': {'tones': []}}
sangeeta nelson,Dirtiness personified,{'document_tone': {'tones': []}}
Raj,Gurudware mein ek javan ki Khalistaniyo ne hatya kardi uske upar bhi kuchh bol. ЁЯдм,"{'document_tone': {'tones': []}, 'sentences_tone': [{'sentence_id': 0, 'text': 'Gurudware mein ek javan ki Khalistaniyo ne hatya kardi uske upar bhi kuchh bol.', 'tones': []}, {'sentence_id': 1, 'text': 'ЁЯдм', 'tones': []}]}"
Raushan Kumar,Ravish ji aapko sarm nahi aati hai galat fact dikhate rahte hain,"{'document_tone': {'tones': [{'score': 0.842108, 'tone_id': 'analytical', 'tone_name': 'Analytical'}, {'score': 0.80026, 'tone_id': 'confident', 'tone_name': 'Confident'}]}}"
kapil kumar Jain,"рдЗрд╕рдиреЗ  рдХрд┐рддрдиреЗ рд▓реЛрдЧреЛрдВ рдХрд╛ рдзрд░реНрдо рдкрд░рд┐рд╡рд░реНрддрди рдХрд░рд╛рдпрд╛ рдерд╛, рдЬрдирд╛рдм рдпрд╣ рднреА рддреЛ рдмрддрд╛рдУ ред<br>рдЬрдм рдЕрдиреНрдп рд▓реЛрдЧреЛрдВ рдХреЗ рд╕рд╛рде рдРрд╕рд╛ рд╣реЛрддрд╛ рд╣реИ,  рддрдм рдЖрдк рдХреЗ рдореБрдБрд╣ рдореЗрдВ рджрд╣реА рдЬрдо рдЬрд╛рддрд╛ рд╣реИ,  <br>рдХреГрдкрдпрд╛ рдХрд░рдХреЗ рдХрд╛рдиреВрди рд╡реНрдпрд╡рд╕реНрдерд╛ рдкрд░ рд╕рд╡рд╛рд▓ рдЙрдард╛рдИрдпреЗ ред",{'document_tone': {'tones': []}}
SAGAR WAKDIKAR,рддрдбреАрдкрд╛рд░ рдмрд╛рд╣рд░ рдШреБрдо рд░рд╣рд╛ рд╣реИ рдФрд░ рд╕рдорд╛рдЬрд╕реЗрд╡реА рдЬреЗрд▓ рдореЗрдВ...,{'document_tone': {'tones': []}}
Fathima Nathan,"For a social activist, who fight for 50 long years for the welfare and rights of tribals. It&#39;s unfortunate these BJP will neither fight for upliftment of downtrodden nor allow the people like Fr.Stanswamy. Shame God only save this country from these fascists. ЁЯШнЁЯШнЁЯШн","{'document_tone': {'tones': [{'score': 0.868183, 'tone_id': 'sadness', 'tone_name': 'Sadness'}, {'score': 0.771025, 'tone_id': 'analytical', 'tone_name': 'Analytical'}]}, 'sentences_tone': [{'sentence_id': 0, 'text': 'For a social activist, who fight for 50 long years for the welfare and rights of tribals.', 'tones': []}, {'sentence_id': 1, 'text': 'It&#39;s unfortunate these BJP will neither fight for upliftment of downtrodden nor allow the people like Fr.Stanswamy.', 'tones': [{'score': 0.687768, 'tone_id': 'analytical', 'tone_name': 'Analytical'}]}, {'sentence_id': 2, 'text': 'Shame God only save this country from these fascists.', 'tones': [{'score': 0.623444, 'tone_id': 'sadness', 'tone_name': 'Sadness'}, {'score': 0.842108, 'tone_id': 'analytical', 'tone_name': 'Analytical'}]}, {'sentence_id': 3, 'text': 'ЁЯШнЁЯШнЁЯШн', 'tones': []}]}"
Theresa D'Souza,Father.. intercede for all the poor people you sacrificed your life for.  Let Justice prevail.,"{'document_tone': {'tones': [{'score': 0.776976, 'tone_id': 'sadness', 'tone_name': 'Sadness'}, {'score': 0.957479, 'tone_id': 'confident', 'tone_name': 'Confident'}]}, 'sentences_tone': [{'sentence_id': 0, 'text': 'Father.. intercede for all the poor people you sacrificed your life for.', 'tones': [{'score': 0.803757, 'tone_id': 'sadness', 'tone_name': 'Sadness'}, {'score': 0.80026, 'tone_id': 'confident', 'tone_name': 'Confident'}]}, {'sentence_id': 1, 'text': 'Let Justice prevail.', 'tones': []}]}"
Basingh Hassa,Ravish Kumar aap ko danyabad bahut bahut dhanyawad.,{'document_tone': {'tones': []}}
saleem hassanar,"all those people who spend time in prison due to the inefficient corrupt ,inhumanly persons holding powers , and its misuse, must be compensated adequately by the Govt. also a good share from the official who implicated him in the false case. Until it happens no one is safe in India.","{'document_tone': {'tones': [{'score': 0.692905, 'tone_id': 'sadness', 'tone_name': 'Sadness'}, {'score': 0.848503, 'tone_id': 'analytical', 'tone_name': 'Analytical'}, {'score': 0.879257, 'tone_id': 'confident', 'tone_name': 'Confident'}]}, 'sentences_tone': [{'sentence_id': 0, 'text': 'all those people who spend time in prison due to the inefficient corrupt ,inhumanly persons holding powers , and its misuse, must be compensated adequately by the Govt.', 'tones': [{'score': 0.712758, 'tone_id': 'sadness', 'tone_name': 'Sadness'}, {'score': 0.53644, 'tone_id': 'analytical', 'tone_name': 'Analytical'}, {'score': 0.674728, 'tone_id': 'confident', 'tone_name': 'Confident'}]}, {'sentence_id': 1, 'text': 'also a good share from the official who implicated him in the false case.', 'tones': [{'score': 0.801827, 'tone_id': 'analytical', 'tone_name': 'Analytical'}]}, {'sentence_id': 2, 'text': 'Until it happens no one is safe in India.', 'tones': [{'score': 0.724236, 'tone_id': 'analytical', 'tone_name': 'Analytical'}]}]}"
Naveen Nautiyal,"Rabish babu tum kaise selective patrakaarita krte ho ye sb jante h, aaj iska ek or example tumne de diya, jb sadhu ko mara gya tb tum kuch nhi bole or aaj kya hua, stan swami jo ki ek aaropi h, uske liye tum presan ho rhe ho.",{'document_tone': {'tones': []}}
Maurice D'souza,Worst is waiting for the culprit.karma will  show who is responsible for what happened....,"{'document_tone': {'tones': []}, 'sentences_tone': [{'sentence_id': 0, 'text': 'Worst is waiting for the culprit.karma', 'tones': [{'score': 0.582312, 'tone_id': 'anger', 'tone_name': 'Anger'}]}, {'sentence_id': 1, 'text': 'will  show who is responsible for what happened....', 'tones': []}]}"
Maurice D'souza,Worst is waiting for the culprit.karma will  show who is responsible for what happened....,"{'document_tone': {'tones': []}, 'sentences_tone': [{'sentence_id': 0, 'text': 'Worst is waiting for the culprit.karma', 'tones': [{'score': 0.582312, 'tone_id': 'anger', 'tone_name': 'Anger'}]}, {'sentence_id': 1, 'text': 'will  show who is responsible for what happened....', 'tones': []}]}"
Arka Paul,"According to leftist: BJP k against tha, to sahi hi tha!","{'document_tone': {'tones': [{'score': 0.944551, 'tone_id': 'analytical', 'tone_name': 'Analytical'}]}}"
saleem hassanar,"Utter Shame on all the systems of Govt. police,judiciary,NIA,CBI all , cannot,will not catch the big shark criminal , they only bold enough to persecute poor, innocents.","{'document_tone': {'tones': [{'score': 0.524379, 'tone_id': 'sadness', 'tone_name': 'Sadness'}, {'score': 0.62832, 'tone_id': 'confident', 'tone_name': 'Confident'}]}, 'sentences_tone': [{'sentence_id': 0, 'text': 'Utter Shame on all the systems of Govt.', 'tones': [{'score': 0.745395, 'tone_id': 'sadness', 'tone_name': 'Sadness'}, {'score': 0.898327, 'tone_id': 'confident', 'tone_name': 'Confident'}]}, {'sentence_id': 1, 'text': 'police,judiciary,NIA,CBI all , cannot,will not catch the big shark criminal , they only bold enough to persecute poor, innocents.', 'tones': []}]}"
Star dust,People of Jharkhand wake-up and see what modi govt doing in your state..,"{'document_tone': {'tones': [{'score': 0.806964, 'tone_id': 'sadness', 'tone_name': 'Sadness'}]}}"
Sharib Ali,"If an 84 year old man has to go to court for a sipper to drink water, then understand how much morality and humanity have fallen?","{'document_tone': {'tones': [{'score': 0.687768, 'tone_id': 'analytical', 'tone_name': 'Analytical'}]}}"
Naresh Dev,Humanitarian Light has gone out. Indian State is solely responsible for Father Stain&#39;s custodial brutal killing. A peaceful pious son of Jesus has been calmed down by present-day so-called Jai Shri Ram&#39;s rulers. This is what Lord Ram teaches BJP and RSS to kill innocents who work for humanitarian selfless service of poor. RIP Father Stan Swamy!,"{'document_tone': {'tones': [{'score': 0.599439, 'tone_id': 'sadness', 'tone_name': 'Sadness'}, {'score': 0.527341, 'tone_id': 'confident', 'tone_name': 'Confident'}]}, 'sentences_tone': [{'sentence_id': 0, 'text': 'Humanitarian Light has gone out.', 'tones': []}, {'sentence_id': 1, 'text': 'Indian State is solely responsible for Father Stain&#39;s custodial brutal killing.', 'tones': [{'score': 0.520066, 'tone_id': 'sadness', 'tone_name': 'Sadness'}, {'score': 0.509368, 'tone_id': 'confident', 'tone_name': 'Confident'}]}, {'sentence_id': 2, 'text': 'A peaceful pious son of Jesus has been calmed down by present-day so-called Jai Shri Ram&#39;s rulers.', 'tones': [{'score': 0.670125, 'tone_id': 'joy', 'tone_name': 'Joy'}]}, {'sentence_id': 3, 'text': 'This is what Lord Ram teaches BJP and RSS to kill innocents who work for humanitarian selfless service of poor.', 'tones': []}, {'sentence_id': 4, 'text': 'RIP Father Stan Swamy!', 'tones': [{'score': 0.778163, 'tone_id': 'sadness', 'tone_name': 'Sadness'}]}]}"
ash k,рдХреНрд░реВрд╕реЗрдбрд░ рдлрд╛рд╕реАрд╡рд╛рдж рдХрд╛ рдПрдХ рдзреВрд░реНрдд рд╕рд┐рдкрд╛рд╣реА рдорд╛рд░рд╛ рдЧрдпрд╛..ред<br>рдИрд╕рд╛рдИ рд╣реИ рдЗрд╕рд▓рд┐рдП 100 рдЧреБрдирд╛рд╣ рднреА рдорд╛рдл рд╣реИ<br>рдкрд╛рд▓рдШрд░ рдХрд╛ рд╕рдВрдд рд╣реЛрддрд╛ рддреЛ рдмрдЪреНрдЪрд╛ рдЪреЛрд░ рдмрддрд╛рдХрд░ рд╕реЗрдХреНрдпреБрд▓рд░ рдмрди рдЬрд╛рддрд╛,{'document_tone': {'tones': []}}
ARSHAD BHAI LUCKNOW,Very sad to know about his demise... May God render his soul rest  in peace,"{'document_tone': {'tones': [{'score': 0.875296, 'tone_id': 'sadness', 'tone_name': 'Sadness'}, {'score': 0.635197, 'tone_id': 'analytical', 'tone_name': 'Analytical'}]}}"
Manohar Gidh,Nd tv ko salaam thankyou ravish sir,"{'document_tone': {'tones': [{'score': 0.778026, 'tone_id': 'joy', 'tone_name': 'Joy'}]}}"
ash k,рдЖрдкрдХреА рдЙрдореНрд░ рдЕрдЧрд░ 84 рд╕рд╛рд▓ рд╣реИ рддреЛ рдЖрдк рдЖрддрдВрдХ рдлреИрд▓рд╛рдиреЗ рдХреЗ рд▓рд┐рдП рдЖреЫрд╛рдж рд╣реИ....рдорд╛рдУ рдорд┐рд╕рдирд░реА рдЧрдардЬреЛреЬ рдХрд╛ рдПрдХ рд╡рд┐рд╖реИрд▓рд╛ рд╕рд╛рдореНрдкреНрд░рджрд╛рдпрд┐рдХ рд╕рд╛рдВрдк рдорд░ рдЧрдпрд╛ред рдкрд╛рд▓рдШрд░ рдХреЗ рд╕рд╛рдзреВрдУрдВ рдХреА рд▓реЙрдиреНрдЪрд┐рдВрдЧ рдкрд░ рдЪреБрдк рд░рд╣рдиреЗ рд╡рд╛рд▓рд╛ рджрд▓реНрд▓рд╛ рдФрд░ рдХрдореЗрдВрдЯ рд╕реЗрдХреНрд╢рди рдореЗрдВ рдзрд░реНрдорд╛рдВрддрд░рд┐рдд рд╕рдореБрджрд╛рдп  рдЖрдЬ рдХреИрд╕реЗ рд╡рд┐рд▓рд╛рдк рдХрд░ рд░рд╣рд╛ рд╣реИ...рдХрд▓реЗрдЬрд╛ рдЪрд╛рд╣рд┐рдП рд░рд╡рд┐рд╢ рдЬрд┐рддрдирд╛ рдмрд┐рдХрд╛рдК рджрд▓реНрд▓рд╛ рд╣реЛрдирд╛ рдХреЗ рд▓рд┐рдП..,{'document_tone': {'tones': []}}
Sharib Ali,RIP to Father Stan Swamy.<br>ЁЯТРЁЯТРЁЯТР,{'document_tone': {'tones': []}}
PaGalPanTi,Iska mout zimendaar pura ka pura sarkar and courtt hai . Or  Kitne begunahon ki  рднрд╛рдЬрдкрд╛ рд╕рд░рдХрд╛рд░  jaan legiЁЯШвЁЯШв begunahon ko insaaf or gunehgar ko saza ЁЯШаЁЯШаmilini chahiye,"{'document_tone': {'tones': [{'score': 0.948691, 'tone_id': 'tentative', 'tone_name': 'Tentative'}]}, 'sentences_tone': [{'sentence_id': 0, 'text': 'Iska mout zimendaar pura ka pura sarkar and courtt hai .', 'tones': []}, {'sentence_id': 1, 'text': 'Or  Kitne begunahon ki  рднрд╛рдЬрдкрд╛ рд╕рд░рдХрд╛рд░  jaan legiЁЯШвЁЯШв begunahon ko insaaf or gunehgar ko saza ЁЯШаЁЯШаmilini chahiye', 'tones': [{'score': 0.602632, 'tone_id': 'sadness', 'tone_name': 'Sadness'}, {'score': 0.839577, 'tone_id': 'tentative', 'tone_name': 'Tentative'}]}]}"
Yogi Yogi,Great man stain swami...shayad ab samay aagya hai ki janta in sarkaro ke khilaf khdi ho taki hum logo ko bhi sarkar kahin jail me na dalde or father stain jese logo ki madad ek aandolan hona chaiye kissan aandolan jesa..UAPA kanoon wapis lo,{'document_tone': {'tones': []}}
kainaat ansari,Upar wala sab dekh rha he.. Jab mazloom par zulm hota he to upar wale ka insaaf faisla krta he...,{'document_tone': {'tones': []}}
KATHRYNE HOW,Nia ko fasi ho,{'document_tone': {'tones': []}}
Lijo John Keralite,He was from Tamil Nadu...not Kerala ..<br>RIP,"{'document_tone': {'tones': [{'score': 0.614935, 'tone_id': 'sadness', 'tone_name': 'Sadness'}]}}"
KATHRYNE HOW,Judsri and sarkar gemdar ha,"{'document_tone': {'tones': [{'score': 0.721866, 'tone_id': 'joy', 'tone_name': 'Joy'}]}}"
Pushpalatha B,"When hardcore  criminals gets highest power with the help of hardcore criminals, ordinary, true people have to suffer like this. here not the government but temple of justice is itself is criminal.","{'document_tone': {'tones': [{'score': 0.566622, 'tone_id': 'sadness', 'tone_name': 'Sadness'}, {'score': 0.821862, 'tone_id': 'confident', 'tone_name': 'Confident'}]}, 'sentences_tone': [{'sentence_id': 0, 'text': 'When hardcore  criminals gets highest power with the help of hardcore criminals, ordinary, true people have to suffer like this.', 'tones': [{'score': 0.513002, 'tone_id': 'sadness', 'tone_name': 'Sadness'}, {'score': 0.520338, 'tone_id': 'confident', 'tone_name': 'Confident'}]}, {'sentence_id': 1, 'text': 'here not the government but temple of justice is itself is criminal.', 'tones': [{'score': 0.53405, 'tone_id': 'sadness', 'tone_name': 'Sadness'}]}]}"
Rose Fernandes,May his soul rest in peace Amen ЁЯЩП,"{'document_tone': {'tones': [{'score': 0.556369, 'tone_id': 'joy', 'tone_name': 'Joy'}, {'score': 0.91961, 'tone_id': 'tentative', 'tone_name': 'Tentative'}]}}"
Tina,Salute you sir for your honesty,{'document_tone': {'tones': []}}
dennismurmu sdb,NIA.. BLIND. ANDHE KYA PEHCHANENGE.... KOUN SACCHA AUR KOUN JHUTHA. AUR HAMARE JUDICIARY ME KOUN BISWAS KARTA HAI....? MAHARASHTRA GOVERNMENT WILL PAY FOR SHEDDING THE BLOOD OF AN INNOCENT SOUL... FR. STAN. TILOJA JAIL AUTHORITIES WHO NEGLECTED.. WILL DEFINITELY PAY FOR WITH SOMETHING WORSE... FOR THERE IS IS A GOD.. WHO SEES ALL.,"{'document_tone': {'tones': [{'score': 0.766185, 'tone_id': 'confident', 'tone_name': 'Confident'}]}, 'sentences_tone': [{'sentence_id': 0, 'text': 'NIA.. BLIND.', 'tones': [{'score': 0.743899, 'tone_id': 'sadness', 'tone_name': 'Sadness'}]}, {'sentence_id': 1, 'text': 'ANDHE KYA PEHCHANENGE.... KOUN SACCHA AUR KOUN JHUTHA.', 'tones': []}, {'sentence_id': 2, 'text': 'AUR HAMARE JUDICIARY ME KOUN BISWAS KARTA HAI....? MAHARASHTRA GOVERNMENT WILL PAY FOR SHEDDING THE BLOOD OF AN INNOCENT SOUL... FR.', 'tones': [{'score': 0.676522, 'tone_id': 'anger', 'tone_name': 'Anger'}]}, {'sentence_id': 3, 'text': 'STAN.', 'tones': []}, {'sentence_id': 4, 'text': 'TILOJA JAIL AUTHORITIES WHO NEGLECTED.. WILL DEFINITELY PAY FOR WITH SOMETHING WORSE... FOR THERE IS IS A GOD.. WHO SEES ALL.', 'tones': [{'score': 0.520067, 'tone_id': 'anger', 'tone_name': 'Anger'}, {'score': 0.598602, 'tone_id': 'confident', 'tone_name': 'Confident'}]}]}"
yohan singa,ЁЯЩПЁЯЩПЁЯЩПЁЯЩПjay adivasi ЁЯЩП,"{'document_tone': {'tones': [{'score': 0.56463, 'tone_id': 'joy', 'tone_name': 'Joy'}]}}"
ITsupport D1,This current Indian govt is being insensitive and trying to suppress democracy. Terror accused like Pragya takur becomes MPтАж. So imagine,"{'document_tone': {'tones': [{'score': 0.553774, 'tone_id': 'sadness', 'tone_name': 'Sadness'}, {'score': 0.893364, 'tone_id': 'tentative', 'tone_name': 'Tentative'}, {'score': 0.573521, 'tone_id': 'analytical', 'tone_name': 'Analytical'}]}, 'sentences_tone': [{'sentence_id': 0, 'text': 'This current Indian govt is being insensitive and trying to suppress democracy.', 'tones': [{'score': 0.735578, 'tone_id': 'sadness', 'tone_name': 'Sadness'}, {'score': 0.620279, 'tone_id': 'analytical', 'tone_name': 'Analytical'}]}, {'sentence_id': 1, 'text': 'Terror accused like Pragya takur becomes MPтАж.', 'tones': [{'score': 0.534965, 'tone_id': 'anger', 'tone_name': 'Anger'}, {'score': 0.681699, 'tone_id': 'tentative', 'tone_name': 'Tentative'}]}, {'sentence_id': 2, 'text': 'So imagine', 'tones': []}]}"
Bobin Yohannan,Ravish kumarЁЯЩП,"{'document_tone': {'tones': [{'score': 0.631804, 'tone_id': 'joy', 'tone_name': 'Joy'}]}}"
Irfan Khan,Desh ka beda garg ho chuka hai kya vikas hoga sab bik chuka hai,{'document_tone': {'tones': []}}
Deben Konwar,Sarkar aisa kiu kia ? kisliys kia? kon iskelia jimewar hai ? Forji mukdama mai fasaya kia ? Iska jawab kon dega ?,"{'document_tone': {'tones': []}, 'sentences_tone': [{'sentence_id': 0, 'text': 'Sarkar aisa kiu kia ?', 'tones': []}, {'sentence_id': 1, 'text': 'kisliys kia? kon iskelia jimewar hai ?', 'tones': []}, {'sentence_id': 2, 'text': 'Forji mukdama mai fasaya kia ?', 'tones': []}, {'sentence_id': 3, 'text': 'Iska jawab kon dega ?', 'tones': []}]}"
RANEE RAJ,рддрд╛рдирд╛рд╢рд╛рд╣ рдХрд╛ рдЬрд▓рд╡рд╛ рд╣реИ рдпреЗ,{'document_tone': {'tones': []}}
K Rock,Again and again NIA ....doing wrong,"{'document_tone': {'tones': [{'score': 0.608431, 'tone_id': 'sadness', 'tone_name': 'Sadness'}]}}"
George Koshy,Law despensed without evidence purposely done is when  punishment is Metedout as process. The guilty Will face the reality of justice,"{'document_tone': {'tones': [{'score': 0.658772, 'tone_id': 'sadness', 'tone_name': 'Sadness'}, {'score': 0.690444, 'tone_id': 'analytical', 'tone_name': 'Analytical'}, {'score': 0.939384, 'tone_id': 'confident', 'tone_name': 'Confident'}]}, 'sentences_tone': [{'sentence_id': 0, 'text': 'Law despensed without evidence purposely done is when  punishment is Metedout as process.', 'tones': [{'score': 0.687768, 'tone_id': 'analytical', 'tone_name': 'Analytical'}, {'score': 0.602517, 'tone_id': 'confident', 'tone_name': 'Confident'}]}, {'sentence_id': 1, 'text': 'The guilty Will face the reality of justice', 'tones': [{'score': 0.685995, 'tone_id': 'sadness', 'tone_name': 'Sadness'}, {'score': 0.704642, 'tone_id': 'confident', 'tone_name': 'Confident'}]}]}"
Irfan Khan,Shame on indian justice,"{'document_tone': {'tones': [{'score': 0.800948, 'tone_id': 'sadness', 'tone_name': 'Sadness'}]}}"
