level,id,parent_id,object_id,object_type,object_key,query_status,query_time,query_type,message,created_time,like_count,comment_count,error.message
0,1,None,102527030797_10159348894700798,seed,,,None,None,,,,,
1,2,1,102527030797_10159348894700798,data,data.*,fetched (200),59:29.2,Facebook:/<post-id>/comments,"Sikh community, a symbol of love, kind and affection.",2020-11-27T16:03:48+0000,123,26,
1,3,1,102527030797_10159348894700798,data,data.*,fetched (200),59:29.2,Facebook:/<post-id>/comments,This community really landmarks the symbol of Humanity.,2020-11-28T04:47:30+0000,40,6,
1,4,1,102527030797_10159348894700798,data,data.*,fetched (200),59:29.2,Facebook:/<post-id>/comments,"The government has to understand the plight of both JAWAN and KISHAN....not make both stand against each other like enemies....the JAWANS are sons of some KISHAN only.....none of the JAWANS are sons of any beurocrats,,,, or politicians....industrialists....actors,,,, so, lets support both",2020-11-27T14:39:19+0000,29,4,
1,5,1,102527030797_10159348894700798,data,data.*,fetched (200),59:29.2,Facebook:/<post-id>/comments,Tehseen poonawala bda tumne bdi personality dundi hai jo quote kar rhe ho.  NDTV KA HAL WO HO GYA HAI KI JO MARZI KARLO PURANI HARKATON KE KARAN LGTA to nakli hai....  NDTV   . nakli journalism,2020-11-27T13:53:22+0000,12,25,
1,6,1,102527030797_10159348894700798,data,data.*,fetched (200),59:29.2,Facebook:/<post-id>/comments,"Don’t forget the Sikh Community is in the forefront in providing free langars world over selflessly, here the present govt. is denying them the right to protest against the unjust laws which hurts the farmers most. What a shameful govt. is this which tramples the giver.",2020-11-28T16:20:02+0000,19,0,
1,7,1,102527030797_10159348894700798,data,data.*,fetched (200),59:29.2,Facebook:/<post-id>/comments,"Respect... They are not protesting  against the security personnels , they are protesting against the government. And protest against the government doesn't mean they are against the country India... They knows the police man standing in front of them  with a water cannon is actually one of someone's  relative and he is just doing his duty..  Now think about sahinbag , Kashmir , Bengaluru , Delhi ..  It's not difficult to find the differences between the regional Sanatan dhram and a radicalised arabic Islamic philosophy...",2020-11-27T15:38:20+0000,17,0,
1,8,1,102527030797_10159348894700798,data,data.*,fetched (200),59:29.2,Facebook:/<post-id>/comments,"??? ?? ????????????? ????? 12% ?? ???? 0.6% ??? ???? ??? ?? ??? ?? ??? ????? ?? ??? ??, ????? #?????? ????? ??...",2020-11-27T17:52:51+0000,13,11,
1,9,1,102527030797_10159348894700798,data,data.*,fetched (200),59:29.2,Facebook:/<post-id>/comments,??  ?????  ??  ???????  ??  ??  ?????  ??????  ??  ????  ?????  ?? ????  ???? ????? ?? ?????? ????  ????  ????  ?????? ??? l,2020-11-27T15:05:47+0000,14,2,
1,10,1,102527030797_10159348894700798,data,data.*,fetched (200),59:29.2,Facebook:/<post-id>/comments,??????? ?? ??? ??? it ??? ??? ????  ???? ????? ????? ?????????? ?? ..,2020-11-27T19:42:29+0000,16,3,
1,11,1,102527030797_10159348894700798,data,data.*,fetched (200),59:29.2,Facebook:/<post-id>/comments,??????? ????? ????? ?? ?????? ?? ???? ???? ?? ??????? ???? ????? ??? ???? ??,2020-11-27T15:15:20+0000,13,0,
1,12,1,102527030797_10159348894700798,data,data.*,fetched (200),59:29.2,Facebook:/<post-id>/comments,"Farmers are there so we are... Without them, we're nothing...",2020-11-27T13:11:35+0000,10,0,
1,13,1,102527030797_10159348894700798,data,data.*,fetched (200),59:29.2,Facebook:/<post-id>/comments,"Humne Indira ko Thok diya, Modi ko bhi..."" What kind of #FarmerProtest is this? Who are these Farmers?",2020-11-27T14:24:17+0000,5,95,
1,14,1,102527030797_10159348894700798,data,data.*,fetched (200),59:29.2,Facebook:/<post-id>/comments,????? ?? ???? ???? ????? ??? ?? ???? ?? ????? ?? ???? ???? ??? ??? ?? ?????? ??????? ?? ???? ???? ???? ?? ?????? ?? ??? ??? ???? ?????? ??????? ??? ? ????,2020-11-29T15:51:04+0000,2,8,
1,15,1,102527030797_10159348894700798,data,data.*,fetched (200),59:29.2,Facebook:/<post-id>/comments,This is the love between two worthy son of this country. Farmers knows how to spread love for whole country men.This is the lovely moment form the protest.,2020-11-27T17:58:10+0000,1,0,
1,16,1,102527030797_10159348894700798,data,data.*,fetched (200),59:29.2,Facebook:/<post-id>/comments,This is epic response toward suppression  and I loved it ....very wise action.,2020-11-28T01:22:12+0000,1,0,
1,17,1,102527030797_10159348894700798,data,data.*,fetched (200),59:29.2,Facebook:/<post-id>/comments,Hitler police ko kisaan khana(Langar) khilate hoye.. i salute ????,2020-11-28T05:49:19+0000,6,0,
1,18,1,102527030797_10159348894700798,data,data.*,fetched (200),59:29.2,Facebook:/<post-id>/comments,??????? ????? ?????? ??? ?????????? ?? ?????? ?? ???? ???? ????????? ?? ??? ?????? ?? ?????? ?????? ? ????? ?? ?????? ?? ?? ?? ???????????? ?????? ????????? ?? ?? ?? ????? ?? ??? ???,2020-11-27T19:57:25+0000,1,14,
1,19,1,102527030797_10159348894700798,data,data.*,fetched (200),59:29.2,Facebook:/<post-id>/comments,"???? ????? ?? ??? ??? ???? ???? ??? ?? ??? ???, ?? ?? ????? ?? ???? ?? ??? ??, ???? ??????? ??????? ?? ??????? (??????? ?? ??????) ?????, 2020. ?? ????? ?? ??? ????? ??????? ???? ???? ?????? ????? ????? ?? ???? ?? ???? ?????? ??? ???? ??? ?? ??? ??? ????? ??? ?? ?? ??? ??? ?? ??? ????????? ????? ????? ?? ???? ??????? ?? ??????????? ?? ???? ?? ???? ??? ????? ?? ????? ?????, ?? ????? ?? ??????? ?? ???? ????? ?? ???? ??, ??? ??????????",2020-11-27T13:41:31+0000,0,38,
1,20,1,102527030797_10159348894700798,data,data.*,fetched (200),59:29.2,Facebook:/<post-id>/comments,"Abhi bhi sharam kre sarkar, aur police",2020-11-27T13:13:01+0000,3,0,
1,21,1,102527030797_10159348894700798,data,data.*,fetched (200),59:29.2,Facebook:/<post-id>/comments,"They are farmers, humans not terrorists that's why they behave like this. They only knows how to feed.",2020-11-28T03:35:22+0000,0,0,
1,22,1,102527030797_10159348894700798,data,data.*,fetched (200),59:29.2,Facebook:/<post-id>/comments,Jis ke sath lad rhe hain... usi ko langar v khila rhe hai... ,2020-11-27T13:30:57+0000,11,6,
1,23,1,102527030797_10159348894700798,data,data.*,fetched (200),59:29.2,Facebook:/<post-id>/comments,"Jawan bhee toh bechara Job kar raha hai, these jawans go through  such sufferings and hell only because of unnecessary protests which some bad elements, anti social elements in Politics take advantage of.. Neither Farmer is bad nor Policeman, its just that some farmers are being mislead and some unscrupulous are taking advantage of and the entire Country pays the price.",2020-11-27T14:00:36+0000,10,20,
1,24,1,102527030797_10159348894700798,data,data.*,fetched (200),59:29.2,Facebook:/<post-id>/comments,"??? confus ?? ???... ??? ????? ???? ???? ?????? ??  ???? ??? ?? .. ?? ???? ??????? ,?? ?? ??????? ????? ??? ?? ?? ????? ?? ????? ????? ???? ?? ???? ???? ??? ?? ?? ?? ?? ???? ?? ???? ?????? ???? ?? ??????? viral ?? ??? ?? ????? ???? ??? ?? ?? ?? ?? ??? ???? ????? ???? ?? ??? ???? ???? ???????? ?? ????????? ???? UN ?? ???? ?????? ?? ??? ??? ?? ???? ??? ????? ?? ??? ??",2020-11-28T20:03:54+0000,0,0,
1,25,1,102527030797_10159348894700798,data,data.*,fetched (200),59:29.2,Facebook:/<post-id>/comments,Duty and humanity are too different things who understands the difference between them is the real human...... ????,2020-11-27T19:48:41+0000,1,0,
1,26,1,102527030797_10159348894700798,data,data.*,fetched (200),59:29.2,Facebook:/<post-id>/comments,Kisan or jawan ek hi he dono apna kaam kar rahe he ,2020-11-27T14:15:35+0000,2,0,
1,27,1,102527030797_10159348894700798,offcut,,fetched (200),59:29.2,Facebook:/<post-id>/comments,,,,,
1,28,1,102527030797_10159348894700798,data,data.*,fetched (200),59:29.9,Facebook:/<post-id>/comments,"Jwan bhi to kisano k hi bete h,chatur sarkar ne parivar ko hi aamne samne kr diya",2020-11-27T13:40:40+0000,1,0,
1,29,1,102527030797_10159348894700798,data,data.*,fetched (200),59:29.9,Facebook:/<post-id>/comments,This photo is from 2012,2020-11-27T14:13:50+0000,0,13,
1,30,1,102527030797_10159348894700798,data,data.*,fetched (200),59:29.9,Facebook:/<post-id>/comments,Forces pehlay insaan ha mager in k haath bandhay oor lagam zalimo k haath ma hoti ha,2020-11-28T09:32:24+0000,0,0,
1,31,1,102527030797_10159348894700798,data,data.*,fetched (200),59:29.9,Facebook:/<post-id>/comments,And Nia court doesn't have sipper straw for one undertrial.,2020-11-27T14:49:11+0000,0,0,
1,32,1,102527030797_10159348894700798,data,data.*,fetched (200),59:29.9,Facebook:/<post-id>/comments,"?? ??? ??? ????? ?? ??? ? ???? ?? ?? ?????,???? ?? ????? ???? ?? ??? ?? ????? ??? ?? ???? ??????? ???????? ?? ????? ??????? ??",2020-11-27T13:55:51+0000,0,0,
1,33,1,102527030797_10159348894700798,data,data.*,fetched (200),59:29.9,Facebook:/<post-id>/comments,Haryana police ka jawan Ro ?? rha hai kisaano pr julam dekh kar ????,2020-11-28T05:47:45+0000,6,0,
1,34,1,102527030797_10159348894700798,data,data.*,fetched (200),59:29.9,Facebook:/<post-id>/comments,"Kisan Or Jwan Da Ik Gura Riste, Kisan Pett Ko Barta Hai, Jwan Desh Lai Dusman Se Ladrta Hai, ",2020-11-27T20:19:35+0000,0,0,
1,35,1,102527030797_10159348894700798,data,data.*,fetched (200),59:29.9,Facebook:/<post-id>/comments,?? police ??? ?? ?? RSS BJP VHP BD ?? ??? ???? ?? ??? ??? ?? ??? ?? ????? ???? ????,2020-11-28T06:04:49+0000,0,0,
1,36,1,102527030797_10159348894700798,data,data.*,fetched (200),59:29.9,Facebook:/<post-id>/comments,Police wale bhi kisano ke hi bete hai . Ye bechare to aapni duty kar rhe hai. Galti to sari politian ki hai,2020-12-02T09:13:15+0000,0,0,
1,37,1,102527030797_10159348894700798,data,data.*,fetched (200),59:29.9,Facebook:/<post-id>/comments,Police jo kitna bura salook kar rahi hai use bhi langar khilate hain,2020-11-28T05:24:07+0000,0,0,
1,38,1,102527030797_10159348894700798,data,data.*,fetched (200),59:29.9,Facebook:/<post-id>/comments,Sikh to shuru se hi Hero ka role play karte hai bss congress ne inko use karna shuru kar diya hai,2020-11-28T02:40:23+0000,1,2,
1,39,1,102527030797_10159348894700798,data,data.*,fetched (200),59:29.9,Facebook:/<post-id>/comments,"Mr Ndtv, who is instigating these so called farmers, while the Farm Reforms are beneficial to farmers? Is it your masters Pappu and Italian?",2020-11-29T21:54:55+0000,0,1,
1,40,1,102527030797_10159348894700798,data,data.*,fetched (200),59:29.9,Facebook:/<post-id>/comments,Yahi to khubsurati hai apne desh ki...,2020-11-27T13:25:27+0000,1,0,
1,41,1,102527030797_10159348894700798,data,data.*,fetched (200),59:29.9,Facebook:/<post-id>/comments,???-???? ???? ???? ??????? ?? ??? ?????? ???? ???? ?? ?? ??? ?? ???? ????? ?? ???? ??? ??? ?? ??????? ?? ???? ???? ??? ???? ?? ???? ????? ??????? ???? ???? ????? ??? ?? ???,2020-11-27T19:53:57+0000,0,0,
1,42,1,102527030797_10159348894700798,data,data.*,fetched (200),59:29.9,Facebook:/<post-id>/comments,to dono ko ladwa kon rha hai fir???,2020-11-28T01:57:16+0000,0,0,
1,43,1,102527030797_10159348894700798,data,data.*,fetched (200),59:29.9,Facebook:/<post-id>/comments,"?? ????? ?? ??????? ??? ?? ?????? ?? ??? ???, ???? ?????? ??? ??? ????, ?? ?? ?? ????? ?? ?????? ?????? ?? ?? ????? ????? ?? ??? ??? ?? ,???? ???? ?? ?? ????????? ?????? ?? ?????? ??? ?????? ??? ??? 70 ??? ??? ????? ???? ????????? ?? ??? ???? ??, ???? ?? ?? ??, ????????, ?? ?????? ?? ????? ?? ????? ??? ???? ?? ?????? ??, ?? ?? ???????? ?? ??? ?????? ?? ???? ???????  ?? ?????? jo Naujwaan Shaheed Sukhbir Singh prso Shaheed hua hai..usi k pass k village se hoon",2020-11-29T14:41:31+0000,0,0,
1,44,1,102527030797_10159348894700798,data,data.*,fetched (200),59:29.9,Facebook:/<post-id>/comments,"Indira ko thoka ,ye bolne wale kisaan ko NDTV or Punawala n dekha ki nhi?",2020-11-27T13:46:05+0000,0,0,
1,45,1,102527030797_10159348894700798,data,data.*,fetched (200),59:29.9,Facebook:/<post-id>/comments,In hi ka kisaan ka khate hai oor uss per hi laathi charge kar rahe hai,2020-11-27T15:08:23+0000,0,0,
1,46,1,102527030797_10159348894700798,data,data.*,fetched (200),59:29.9,Facebook:/<post-id>/comments,Industrialists Corporates say laxmi aati hai farmers kya dey saktay hein becharay. Issi liyay un kay liyay qanoon mein koi lachak nahi.,2020-11-27T13:20:29+0000,0,0,
1,47,1,102527030797_10159348894700798,data,data.*,fetched (200),59:29.9,Facebook:/<post-id>/comments,Police ne bhi lathi charge nai kiya.. bs entry allow nai kar rahe hai.m,2020-11-28T02:50:08+0000,0,0,
1,48,1,102527030797_10159348894700798,data,data.*,fetched (200),59:29.9,Facebook:/<post-id>/comments,Ek kisan hai dosra os he kisan ka beta Jay jewan Jay kisan,2020-11-27T14:03:29+0000,0,0,
1,49,1,102527030797_10159348894700798,data,data.*,fetched (200),59:29.9,Facebook:/<post-id>/comments,Abki bar besharmo ki sarkar aur nalayak bhakt...,2020-11-30T15:16:33+0000,0,0,
1,50,1,102527030797_10159348894700798,data,data.*,fetched (200),59:29.9,Facebook:/<post-id>/comments,Yohee hee keessan. Haa.  Joo. Apna. Hak koo pana kaa leeya  lattee. Kaata haa. Onko panee pelata hsa. Ess. Dass  kaa. Keessan haa,2020-11-27T16:47:36+0000,0,0,
1,51,1,102527030797_10159348894700798,data,data.*,fetched (200),59:29.9,Facebook:/<post-id>/comments,MSP. ?? ??? ????? ??? ??? ???? ?? ???? ???? ?? ??????? PM. ?? ??????????? ?? ???? ???? ?? . ?? ???? ?? ???????? ??? ?? . ?? ?????? ??????? ????? ?? ???? ??? ????? . ??????????? ?? ???? ??? ???? ??? EVM. ?????? ?? ???? ???? ?? ??????????? ?? ????? ?? ????? ????? ????? ??? ..,2020-11-30T16:49:03+0000,0,0,
1,52,1,102527030797_10159348894700798,data,data.*,fetched (200),59:29.9,Facebook:/<post-id>/comments,90%???? ????? ?? ???? ??  ????? ?? ??? ???? ??? ???? ??,2020-11-27T15:03:45+0000,4,0,
1,53,1,102527030797_10159348894700798,offcut,,fetched (200),59:29.9,Facebook:/<post-id>/comments,,,,,
1,54,1,102527030797_10159348894700798,data,data.*,fetched (200),59:30.4,Facebook:/<post-id>/comments,Unn kisano ke pass ja ker samjh lijye na,2020-11-27T15:10:14+0000,0,0,
1,55,1,102527030797_10159348894700798,data,data.*,fetched (200),59:30.4,Facebook:/<post-id>/comments,"Very very good people, respect farmers, indian some people Good, some police good,but Indian politics govt not good. ",2020-11-28T01:08:33+0000,1,0,
1,56,1,102527030797_10159348894700798,data,data.*,fetched (200),59:30.4,Facebook:/<post-id>/comments,This is India with humanity.,2020-11-28T01:43:20+0000,1,1,
1,57,1,102527030797_10159348894700798,data,data.*,fetched (200),59:30.4,Facebook:/<post-id>/comments,"????? ????? ??? ?? ???? ?? , ?????? ??? ??? ???? ?? ???? ?? ???? ?? ????? ??????? ??? ????? ???? ???...??",2020-11-28T00:27:25+0000,2,2,
1,58,1,102527030797_10159348894700798,data,data.*,fetched (200),59:30.4,Facebook:/<post-id>/comments,Salute to our farmer ...JAI  HIND,2020-11-27T13:23:33+0000,2,0,
1,59,1,102527030797_10159348894700798,data,data.*,fetched (200),59:30.4,Facebook:/<post-id>/comments,?? ????? ?? ?? ?? ??? ???? ????? ??,2020-11-27T14:12:05+0000,3,0,
1,60,1,102527030797_10159348894700798,data,data.*,fetched (200),59:30.4,Facebook:/<post-id>/comments,???? ?? ??? - ??? ?? ??? ????,2020-11-27T14:25:28+0000,1,0,
1,61,1,102527030797_10159348894700798,data,data.*,fetched (200),59:30.4,Facebook:/<post-id>/comments,This pictures says it all “Jai Jawan Jai Kisaan “  Bass politician Nahin samate hai ????????????,2020-11-28T04:56:40+0000,1,0,
1,62,1,102527030797_10159348894700798,data,data.*,fetched (200),59:30.4,Facebook:/<post-id>/comments,"They feed them and their families and now when they're demanding their legal rights all the officials are against them, snakes are better than humans. #protectfarmer",2020-11-28T02:37:09+0000,0,0,
1,63,1,102527030797_10159348894700798,data,data.*,fetched (200),59:30.4,Facebook:/<post-id>/comments,This is real symbol of humanity... ,2020-11-28T09:44:53+0000,0,0,
1,64,1,102527030797_10159348894700798,data,data.*,fetched (200),59:30.4,Facebook:/<post-id>/comments,?? ???? ?? ????? ??? ??? ????? ??? ?? ??? ???  ????? ?? ?? ??? ??????,2020-11-27T22:11:48+0000,0,0,
1,65,1,102527030797_10159348894700798,data,data.*,fetched (200),59:30.4,Facebook:/<post-id>/comments,Both are doing their duties,2020-11-30T16:08:00+0000,0,0,
1,66,1,102527030797_10159348894700798,data,data.*,fetched (200),59:30.4,Facebook:/<post-id>/comments,?? ?????? ?? ??? ????? ?? ????,2020-11-28T09:18:31+0000,0,0,
1,67,1,102527030797_10159348894700798,data,data.*,fetched (200),59:30.4,Facebook:/<post-id>/comments,"Without our farmers, we all will die without FOOD.",2020-11-28T17:37:00+0000,0,0,
1,68,1,102527030797_10159348894700798,data,data.*,fetched (200),59:30.4,Facebook:/<post-id>/comments,?? ???? ?? ?? ?????  ?? ?? ?????? ????? ????,2020-11-28T00:30:18+0000,1,0,
1,69,1,102527030797_10159348894700798,data,data.*,fetched (200),59:30.4,Facebook:/<post-id>/comments,"???? ??? ???? ?? ???? ????, ???? ????? ?? ?????????? ???? ?? ??? ?? ??, ????? ???????? ??? ???? ??? ???? ???? ???? ??????",2020-11-27T15:23:59+0000,0,6,
1,70,1,102527030797_10159348894700798,data,data.*,fetched (200),59:30.4,Facebook:/<post-id>/comments,???? ?? ???? ????? ?? ???? ??? ????? ?? ???? ???? ???? ???? ??? ?? ?? ???? ???? ?? ?? ????? ?? ?????? ????? ??? ??? ??,2020-11-27T17:49:48+0000,0,0,
1,71,1,102527030797_10159348894700798,data,data.*,fetched (200),59:30.4,Facebook:/<post-id>/comments,They are real heroes.,2020-11-28T08:31:27+0000,0,0,
1,72,1,102527030797_10159348894700798,data,data.*,fetched (200),59:30.4,Facebook:/<post-id>/comments,Kisaan union zindabaad,2020-11-27T13:17:58+0000,1,0,
1,73,1,102527030797_10159348894700798,data,data.*,fetched (200),59:30.4,Facebook:/<post-id>/comments,Let POLITICIANS face Farmers without any police.,2020-11-28T06:01:34+0000,0,0,
1,74,1,102527030797_10159348894700798,data,data.*,fetched (200),59:30.4,Facebook:/<post-id>/comments,?? ????? ???? ?? ??-???? ????? ??? ???? ?????! ??,2020-11-28T01:45:07+0000,0,0,
1,75,1,102527030797_10159348894700798,data,data.*,fetched (200),59:30.4,Facebook:/<post-id>/comments,Bhai kon kon Manta he ki  kisan or javan???????  ko politics me nahi gusedna chahiye   Agar galti se dono ki satak gai tooo badi badi Sarkar gira dete hee...????,2020-11-27T19:52:26+0000,1,0,
1,76,1,102527030797_10159348894700798,data,data.*,fetched (200),59:30.4,Facebook:/<post-id>/comments,Kisaan Zindabad.. Jai jawan jai kisaan,2020-11-29T04:41:12+0000,1,0,
1,77,1,102527030797_10159348894700798,data,data.*,fetched (200),59:30.4,Facebook:/<post-id>/comments,Please help karo bhai log..inki ....request all dehli public,2020-11-28T16:51:05+0000,0,0,
1,78,1,102527030797_10159348894700798,data,data.*,fetched (200),59:30.4,Facebook:/<post-id>/comments,This is real India the people want.,2020-11-28T04:38:24+0000,0,0,
1,79,1,102527030797_10159348894700798,offcut,,fetched (200),59:30.4,Facebook:/<post-id>/comments,,,,,
1,80,1,102527030797_10159348894700798,data,data.*,fetched (200),59:30.9,Facebook:/<post-id>/comments,Asali aur nakali Sharma Ji  Jante Hain aur asali aur nakali Anaaj  bhi  Sharma ji Jante Hain  ,2020-11-30T04:25:33+0000,0,0,
1,81,1,102527030797_10159348894700798,data,data.*,fetched (200),59:30.9,Facebook:/<post-id>/comments,Police jawan kisi kisan ka beta hi to hai,2020-11-28T02:55:10+0000,0,0,
1,82,1,102527030797_10159348894700798,data,data.*,fetched (200),59:30.9,Facebook:/<post-id>/comments,?? ??? ?? ?? ?? ???? ??????????? ?? ?????? ?? ??? ??? ??????? ??,2020-11-28T05:19:46+0000,0,0,
1,83,1,102527030797_10159348894700798,data,data.*,fetched (200),59:30.9,Facebook:/<post-id>/comments,?? ???? ???? ????? ?????? ?????,2020-11-28T16:26:47+0000,0,0,
1,84,1,102527030797_10159348894700798,data,data.*,fetched (200),59:30.9,Facebook:/<post-id>/comments,?? ?? ????? ??? ?? ?? ???? ??? ????? ?????? ???,2020-11-27T15:34:57+0000,0,1,
1,85,1,102527030797_10159348894700798,data,data.*,fetched (200),59:30.9,Facebook:/<post-id>/comments,"Jos me Kahi hi bate,",2020-11-28T03:01:31+0000,0,0,
1,86,1,102527030797_10159348894700798,data,data.*,fetched (200),59:30.9,Facebook:/<post-id>/comments,Yeh hai mere guru Ki shiksha! Humanity first!! ??,2020-11-27T23:02:10+0000,0,0,
1,87,1,102527030797_10159348894700798,data,data.*,fetched (200),59:30.9,Facebook:/<post-id>/comments,Dono apna kaam hi kr rhe hai,2020-11-29T00:30:35+0000,0,0,
1,88,1,102527030797_10159348894700798,data,data.*,fetched (200),59:30.9,Facebook:/<post-id>/comments,Jai Jawaan Jai Kisaan. ??????,2020-11-27T13:19:26+0000,1,1,
1,89,1,102527030797_10159348894700798,data,data.*,fetched (200),59:30.9,Facebook:/<post-id>/comments,??? ?? ????? ??????? ??? ??!,2020-11-27T13:39:11+0000,0,0,
1,90,1,102527030797_10159348894700798,data,data.*,fetched (200),59:30.9,Facebook:/<post-id>/comments,Stop oppressing against farmers,2020-11-27T13:29:28+0000,0,0,
1,91,1,102527030797_10159348894700798,data,data.*,fetched (200),59:30.9,Facebook:/<post-id>/comments,Hahahahaha.... Lovelyyyyyy... Yehhh dekh ke gujjuonnn kii jal gayee hogiii re...???????????????????... Check kar looo... ????????.. Gm.. Jai Hind..!!!????????,2020-11-29T03:22:17+0000,0,0,
1,92,1,102527030797_10159348894700798,data,data.*,fetched (200),59:30.9,Facebook:/<post-id>/comments,Khana bhi khilata hai ??,2020-11-28T16:07:23+0000,0,0,
1,93,1,102527030797_10159348894700798,data,data.*,fetched (200),59:30.9,Facebook:/<post-id>/comments,Sailendra Shailendar Kumar Rajbhar inko bhi terrorism bol do,2020-11-28T08:11:53+0000,0,0,
1,94,1,102527030797_10159348894700798,data,data.*,fetched (200),59:30.9,Facebook:/<post-id>/comments,Old photo...,2020-11-27T14:13:22+0000,0,0,
1,95,1,102527030797_10159348894700798,data,data.*,fetched (200),59:30.9,Facebook:/<post-id>/comments,?????? ??? ?????? ???? ???? ?? ???? ??????? ?? ?????-?????? ??? ??? ???!!,2020-11-27T21:07:51+0000,0,1,
1,96,1,102527030797_10159348894700798,data,data.*,fetched (200),59:30.9,Facebook:/<post-id>/comments,????? ?? ???? ????? ?? ???? ????? ??? ???? ?? ????? ??? ??? ??,2020-11-27T13:14:51+0000,0,12,
1,97,1,102527030797_10159348894700798,data,data.*,fetched (200),59:30.9,Facebook:/<post-id>/comments,Khana to kissan he de rha sab ko,2020-11-27T15:10:36+0000,0,0,
1,98,1,102527030797_10159348894700798,data,data.*,fetched (200),59:30.9,Facebook:/<post-id>/comments,Saap ko dudh pila rhe,2020-11-27T19:13:46+0000,0,0,
1,99,1,102527030797_10159348894700798,data,data.*,fetched (200),59:30.9,Facebook:/<post-id>/comments,????? ??? ??????? ???????,2020-11-28T05:02:37+0000,1,0,
1,100,1,102527030797_10159348894700798,data,data.*,fetched (200),59:30.9,Facebook:/<post-id>/comments,"???????? ????????? ????????,???????? ?????????? ???? ????????? ????? ?????? ????   ?? ??? ????????",2020-11-28T06:39:27+0000,0,0,
1,101,1,102527030797_10159348894700798,data,data.*,fetched (200),59:30.9,Facebook:/<post-id>/comments,Kisaan hai toh desh hai,2020-11-28T02:13:40+0000,0,0,
1,102,1,102527030797_10159348894700798,data,data.*,fetched (200),59:30.9,Facebook:/<post-id>/comments,Chal salya. Tu ta app haram di aulaad,2020-11-27T15:23:38+0000,0,0,
1,103,1,102527030797_10159348894700798,data,data.*,fetched (200),59:30.9,Facebook:/<post-id>/comments,NDTV is puppet of some political parties and acts under their influence.,2020-11-28T10:35:45+0000,0,0,
1,104,1,102527030797_10159348894700798,data,data.*,fetched (200),59:30.9,Facebook:/<post-id>/comments,is photo ke liye hi Pani pila Raha hai,2020-11-27T13:57:29+0000,0,1,
1,105,1,102527030797_10159348894700798,offcut,,fetched (200),59:30.9,Facebook:/<post-id>/comments,,,,,
1,106,1,102527030797_10159348894700798,data,data.*,fetched (200),59:31.5,Facebook:/<post-id>/comments,I am proud that I am the son of a farmer.,2020-11-27T13:44:46+0000,1,0,
1,107,1,102527030797_10159348894700798,data,data.*,fetched (200),59:31.5,Facebook:/<post-id>/comments,,2020-11-27T23:20:12+0000,1,0,
1,108,1,102527030797_10159348894700798,data,data.*,fetched (200),59:31.5,Facebook:/<post-id>/comments,,2020-11-28T05:47:07+0000,0,0,
1,109,1,102527030797_10159348894700798,data,data.*,fetched (200),59:31.5,Facebook:/<post-id>/comments,"????? ????,???? ??? ?? ???? !!  ????? ?????? ?? ?? ??? ??? ????? ?? ????? ?? ????? ??? ?? ??? ??..",2020-11-28T07:08:13+0000,0,0,
1,110,1,102527030797_10159348894700798,data,data.*,fetched (200),59:31.5,Facebook:/<post-id>/comments,,2020-11-28T05:47:01+0000,0,0,
1,111,1,102527030797_10159348894700798,data,data.*,fetched (200),59:31.5,Facebook:/<post-id>/comments,"?? ???? ???????? ????????? ???? ???? ??? ??, ? ?? ??????? ?? ?????? ??? ???? ? ??? ???? #boycottfood",2020-11-27T13:56:16+0000,1,6,
1,112,1,102527030797_10159348894700798,data,data.*,fetched (200),59:31.5,Facebook:/<post-id>/comments,"???? ????? ??????? ?? ??? ???, ???? ???? ?? ???? ?? ??? ????",2020-11-28T07:17:17+0000,0,0,
1,113,1,102527030797_10159348894700798,data,data.*,fetched (200),59:31.5,Facebook:/<post-id>/comments,,2020-11-28T05:47:11+0000,0,0,
1,114,1,102527030797_10159348894700798,data,data.*,fetched (200),59:31.5,Facebook:/<post-id>/comments,Same Shaheenbagh2 model and NDTV is carrying out partners agenda.,2020-11-27T14:20:52+0000,1,2,
1,115,1,102527030797_10159348894700798,data,data.*,fetched (200),59:31.5,Facebook:/<post-id>/comments,???? ???? ???? ???? ?? ???? ??? ?? ??? ??? ??,2020-11-27T14:28:31+0000,0,0,
1,116,1,102527030797_10159348894700798,data,data.*,fetched (200),59:31.5,Facebook:/<post-id>/comments,https://www.facebook.com/1446045565480667/videos/225606292242084/,2020-11-28T05:23:26+0000,0,0,
1,117,1,102527030797_10159348894700798,data,data.*,fetched (200),59:31.5,Facebook:/<post-id>/comments,,2020-11-28T06:38:17+0000,0,0,
1,118,1,102527030797_10159348894700798,data,data.*,fetched (200),59:31.5,Facebook:/<post-id>/comments,Give and take... #FarmersFirst,2020-11-27T21:55:52+0000,0,0,
1,119,1,102527030797_10159348894700798,data,data.*,fetched (200),59:31.5,Facebook:/<post-id>/comments,"Kisan Ka Hi Beta Hoga Jawan Phir Yah Kaisi Harkat? Jai Jawan-Jai Kisan,Kya Yahi Hai Samman Dono Ke Liye?",2020-11-27T14:07:27+0000,0,0,
