Name,Comment,Time,Likes,Reply Count,Reply Author,Reply,Published,Updated
sanjay kumar,рдЧреЛрджреА рдореАрдбрд┐рдпрд╛ рдкреВрдЫ рд░рд╣реЗ рдХреА рдХрд┐рд╕рд╛рдиреЛ рдХреЛ рдХреМрди рднрдбрд╝рдХрд╛ рд░рд╣рд╛ рд╣реИ<br>                 рдХрд┐рд╕рд╛рди рдкреВрдЫ рд░рд╣реЗ рдХрд┐ рддреБрдордХреЛ рд╣рдбреНрдбреА рдХреМрди рджреЗ рд░рд╣рд╛ рд╣реИ,2020-11-28T05:40:54Z,0,0,,,,
cricket with juber,"рдЕрдЧрд░ рд╢реНрд░реАрд░рд╛рдо рдЪрдВрджреНрд░ рдЬреА рдореЛрджреА рд╕рд░рдХрд╛рд░, рдпрд╛, рдореЛрджреА, рдХреА, рдмреБрд░рд╛рдИ, рдХрд░ рджреЗ рддреЛ рднрдХреНрдд рдЙрдирдХреЗ рдКрдкрд░ рднреА рд▓рд╛рдВрдЫрди рд▓рдЧрд╛ рджреЗрдВрдЧреЗред",2020-11-28T05:39:54Z,2,0,,,,
Bhim Rock,рд╕рд░рдХрд╛рд░ рдкреВрд░реА рддрд░рд╣ рд╕реЗ рдкреВрдБрдЬреАрдкрддрд┐ рдХреЗ рд╣рд╛рдереЛрдВ рдмрд┐рдХ рдЪреБрдХреА рд╣реИрдВ,2020-11-28T05:35:22Z,3,0,,,,
Chand Miyan Qureshi,рд╕рдЪ рджрд┐рдЦрд╛рдиреЗ рд╡рд╛рд▓рд╛ <br>рдХрд┐рд╕рд╛рди рдкрд┐рдЫреЬреЗ рдЧрд░реАрдм рдордЬрджреВрд░ рджрд▓рд┐рдд рдЕрд▓реНрдкрд╕рдВрдЦреНрдпрдХ рдкреАрдбрд╝рд┐рдд рд╕рднреА рдХреА рдЖрд╡рд╛реЫ рд░рд╡реАрд╢ рдХреБрдорд╛рд░,2020-11-28T05:34:55Z,0,0,,,,
PRAHALAD PATEL,рдХрд┐рд╕рд╛рди рдПрдХрддрд╛ рдЬрд┐рдВрджрд╛рдмрд╛рдж ЁЯЩПЁЯЩПЁЯЩПЁЯЩПЁЯЩП,2020-11-28T05:27:44Z,1,0,,,,
santosh kumar,Bihar me dhan 1000 rupye  /kiwntle de raha,2020-11-28T05:26:19Z,0,0,,,,
shashank shandilya,Tum ek badwa patrakar ho.communist sale,2020-11-28T05:20:11Z,0,1,,,,
,,,,,rupinder singh,"Tum modi ka chuste ho, gandu sale",2020-11-29T06:15:24Z,2020-11-29T06:15:24Z
vikas,bhaktandu reliance fresh me khana khate hain,2020-11-28T05:09:37Z,0,0,,,,
Durgesh Kumar Yadav,Adani ambani ke liye nahi kuchh karege to electrol bond kaha se aayega.,2020-11-28T05:05:02Z,0,0,,,,
Durgesh Kumar Yadav,PM sahab ki lambi soch ko kisan pahachan gaya hai.,2020-11-28T04:58:04Z,0,0,,,,
Rahul Kumar,Maka ka msp Kitna h koi bataye mare yaha 1200 rupee kar kwintol bik rha h,2020-11-28T04:56:32Z,0,0,,,,
Jagroop singh Jack Sandhu,Thanks Ravish and NDTV india,2020-11-28T04:51:05Z,1,0,,,,
Sudin Mistri,Very very good sir,2020-11-28T04:48:30Z,0,0,,,,
Jaipal Dharnia,рд╕рдмрд╕реЗ рдкрд╣рд▓реЗ рддреЛ рдЗрди рдиреЗрддрд╛рдУрдВ рдХреЗ рджрд▓рд╛рд▓реЛрдВ рдХреЛ рдЦрддреНрдо рдХрд░рдирд╛ рдЪрд╛рд╣рд┐рдП рдЬреЛ рдХрд╛рд░реНрдпрдХрд░реНрддрд╛ рдХреЗ рдирд╛рдо рд╕реЗ рдЬрд╛рдиреЗ рдЬрд╛рддреЗ рд╣реИ рдФрд░ рдЖрдо рдЖрджрдореА рдХреЛ рд▓реВрдЯрддреЗ рд╣реИрдВред рд╕рд░рдХрд╛рд░реА рдХрд░реНрдордЪрд╛рд░рд┐рдпреЛрдВ рдХреЛ рднреА рдпреЗ рд▓реВрдЯрддреЗ рд╣реИрдВ рд╡ рднреГрд╖реНрдЯрд╛рдЪрд╛рд░ рдкрдирдкрд╛рдиреЗ рдХреЗ рдХреЗрдиреНрджреНрд░ рд╣реИред,2020-11-28T04:46:51Z,2,0,,,,
Naveen Khanna,Beautiful reporting! Our country needs reporters like you. Good work.,2020-11-28T04:39:37Z,3,0,,,,
Jagmohan Bedi,"рдХрд┐рддрдиреА рд╕реЛрдЪреА рд╕рдордЭреА рдЪрд╛рд▓ рд╣реИ рдЗрд╕реНрд╕ рд╕рд░рдХрд╛рд░ рдХреАред рдЦреЗрддреА рдХрд░реЗрдВрдЧрд╝реЗ рдкрдВрдЬрд╛рдмреА, рд╣рд░рдпрдирд╡реА, рд╣рд┐рдордЪрд▓реА, рдФрд░ рдкрд╣рд╛рдбрд╝реА, рдкрд░рдиреНрддреБ рдЙрд╕рдХреА рдЦрд╝рд░реАрдж-рдлрд╝рд░реЛрдЦрд╝реНрдд рдФрд░ рд╡реНрдпрд╛рдкрд╛рд░ рдХрд░реЗрдВрдЧрд╝реЗ рдЧреБрдЬрд░рд╛рддреА 1000 рдореАрд▓ рджреВрд░ рд╕реЗ рдЖрдХрд░рее рд╕рдореНрдкреВрд░реНрдг рднрд╛рд░рдд рдХрд╛ рдЦрд╝реНрдпрд╛рд▓ рдЬреИрд╕реЗ рдПрдХ рдорд╛рдБ рдХрд░рддреА рд╣реИ рд╡реИрд╕реЗ рд╣реА рд╣реЛ рддреЛ рдХрд┐рддрдиреА рдЖрд╢реАрд╖ рдорд┐рд▓реЗрдВрдЧреАред",2020-11-28T04:31:29Z,0,0,,,,
Rohit Paul,My salut to ravish jiЁЯЩПЁЯЩПЁЯЩПЁЯЩП<br>jio ustaad ji...jug jug jio...тЭдя╕ПтЭдя╕ПтЭдя╕П,2020-11-28T04:27:42Z,3,0,,,,
Was├иem Shaikh,Sacche admi hain ap,2020-11-28T04:21:38Z,0,0,,,,
Prashant Verma,Ravish Sir Jindabaad,2020-11-28T04:11:20Z,0,0,,,,
Prashant Verma,Or Delo Bjp Ko Vote ЁЯШЕ,2020-11-28T04:11:09Z,0,0,,,,
steel,Absolute truth ЁЯЩП,2020-11-28T04:02:19Z,1,0,,,,
deep kh,"Ravish, our only hope",2020-11-28T03:45:44Z,0,0,,,,
Mustafa mustafa,Ndtv nice,2020-11-28T03:44:36Z,0,0,,,,
SHAH SAOOD,рдпреЗ рдХреИрд╕рд╛ рдХрд╛рдиреВрди рд╣реИ...<br>рдпреЗ рдЕрдВрдзрд╛ рдХрд╛рдиреВрди рд╣реИ....,2020-11-28T03:43:47Z,0,0,,,,
kumar vipin,Saheed-e-azam bhagat singh ne bilkul shi kaha thaa ....<br>Behro ko awaaz sunane k liye dhmaake to krne pdege<br>I support farmers <br>Inquilab zindabad ЁЯСН,2020-11-28T03:37:27Z,1,0,,,,
AMRENDRA PRASAD YADAV,Modi ji is naam pe bahut act change kiya par kya aaj kuchh bhi khatam huaa ulta Janata sadak pe aa gaya.,2020-11-28T03:34:20Z,0,0,,,,
AJIT SINGH,Jo government kissan aur mazdoor ke khilaf kanoon banaye ushse kya umeed ki jaye,2020-11-28T03:32:29Z,0,0,,,,
sandeep pandey,ЁЯСНЁЯП╗,2020-11-28T03:32:08Z,0,0,,,,
vishvender teotia,Western UP ke kisan...??,2020-11-28T03:00:47Z,1,0,,,,
Shamim Akhtar,Jai javan jai kisan,2020-11-28T02:59:44Z,0,0,,,,
SONIT KUMAR,"рд░реЗ рд░рд╡реАрд╢рд╡рд╛ рджреЛрдЧрд▓рд╛,рддреЗрдЧрд▓рд╛ ,рдЪреЛрдЧреНрд▓рд╛ .........рдЕрднреА 5_6 рд╕рд╛рд▓ рд╕реЗ   <br> рддреБрдордХреЛ рдмрдВрдЧрд╛рд▓ рдпрд╛рдж рдирд╣реАрдВ рдЖ рд░рд╣рд╛ рд╣реИ рддреБрдордХреЛ рдЕрднреА рд╡рд╣рд╛рдВ рдирд╛ рддреЛ рдмреЗрд░реЛрдЬрдЧрд╛рд░реА рджрд┐рдЦ рд░рд╣реА, рдирд╛ рддреЛ рдЕрдкрд░рд╛рдз рджрд┐рдЦ рд░рд╣рд╛ рд╣реИ, рд▓реЗрдХрд┐рди рдЬрд┐рд╕ рджрд┐рди рд╡рд╣рд╛рдВ рднрд╛рдЬрдкрд╛ рдХреА рд╕рд░рдХрд╛рд░ рдмрди рдЬрдпрдЧреА, рдЙрд╕ рджрд┐рди рд╕реЗ рддреБрдордХреЛ рдФрд░ рддреБрдореНрд╣рд╛рд░реЗ рдЪреИрдирд▓  рдХреЛ рд╡рд╣рд╛рдВ рдмреЗрд░реЛрдЬрд╝рдЧрд╛рд░реА, рдЕрдкрд░рд╛рдз, рдмрд▓рд╛рддреНрдХрд╛рд░, рдЕрд╕реНрдкрддрд╛рд▓, рд╕реНрдХреВрд▓, рдХреЙрд▓реЗрдЬ............тАж.рдФрд░ рдмрд╣реБрдд рдХреБрдЫ рджрд┐рдЦрдиреЗ рд▓рдЧреЗрдЧрд╛, рдЬреИрд╕реЗ рддреБрдордХреЛ рдЕрднреА рдпреВрдкреА рдореЗрдВ рджрд┐рдЦ рд░рд╣реА рд╣реИ",2020-11-28T02:57:58Z,0,0,,,,
Mohit Choudhary,"Jinhe ye dikkat hai ki ye bade kisan hai Ameer kisan hai, hamarkhoro tmhe to Inka dhanyawad karna chahiye ki ye akele 70 crore gaav kisani ke logo ki ladai lad rhe hai akele.",2020-11-28T02:50:53Z,0,0,,,,
Gulam Sarwar,Hi,2020-11-28T02:36:15Z,0,0,,,,
swarn dhaliwal,Akela ravish kumar nhi vikaЁЯЩПЁЯП╗ЁЯЩПЁЯП╗ЁЯЩПЁЯП╗love u sir,2020-11-28T02:35:26Z,0,0,,,,
Zahid Hussain,Great analysis,2020-11-28T02:24:09Z,0,0,,,,
satyamev jayathey,farmers know that they will have to sweat as per the needs of the private buyers the prices of their produce will be undervalued.,2020-11-28T02:20:37Z,4,0,,,,
ABU GALIB,"рдЬрд┐рдирдХреЗ рдмрдЪреНрдЪреЗ рд╕реАрдорд╛ рдкрд░ рдЧреЛрд▓реА рдЦрд╛рддреЗ рд╣реИрдВ, рдЙрдирдХреЗ рдкрд┐рддрд╛ рдФрд░ рднрд╛рдЗрдпреЛрдВ рдкрд░ рдЗрддрдиреА рдардВрдб рдХреЗ рдореМрд╕рдо рдореЗрдВ рдпреЗ  рд╕рд░рдХрд╛рд░ рд╡реЙрдЯрд░ рдХреЗрдирди рдЪрд▓рд╛ рд░рд╣реА рд╣реИред рдкрд╣рд▓реЗ рдХрд┐рд╕рд╛рдиреЛрдВ- рдордЬрджреВрд░реЛрдВ рдХреЗ рд╣рдХ рдорд╛рд░ рд▓рд┐рдП, рдЕрдм рдЙрдирдХреА рдкреАрда рдкрд░ рд▓рд╛рдареА рдорд╛рд░ рд░рд╣реА рд╣реИред рд╢рд░реНрдо рдЗрдирдХреЛ рдордЧрд░ рдирд╣реАрдВ рдЖрддреАред",2020-11-28T02:18:40Z,0,0,,,,
ChintuG,Sir <br>Bihar paramedical me question tha <br>Ramon magsaysay award kise mila 2019<br>Ans-ravish kumar.,2020-11-28T02:15:01Z,19,0,,,,
Azadbir Singh,рдпрджрд┐ рдмрд╣рд░реЛрдВ рдХреЛ рд╕реБрдирдирд╛ рд╣реИ рддреЛ рдЖрд╡рд╛рдЬрд╝ рдХреЛ рдмрд╣реБрдд рдЬреЛрд░рджрд╛рд░ рд╣реЛрдирд╛ рд╣реЛрдЧрд╛- рднрдЧрдд рд╕рд┐рдВрд╣,2020-11-28T02:04:39Z,9,0,,,,
NAZIR AHMED LASKAR,"All Farmers against Farm bill,this will be headline in history..",2020-11-28T01:59:51Z,14,2,,,,
,,,,,XI Jinping рдЪреАрди рд╡рд╛рд▓реЗ,Sirf Punjab aur haryana ke virodh kar rahe hai Baki kisaan Kyu na kar rahe ЁЯдФЁЯдФЁЯдФЁЯдФЁЯдФ,2020-11-28T17:01:32Z,2020-11-28T17:01:32Z
,,,,,gurwinder singh,@XI Jinping рдЪреАрди рд╡рд╛рд▓реЗ kyu ki haryana aur punjab hi msp lete hai woh hi log hai jo desh ke liye sbse jyada shaheed hue aj b wohi log awaz utha rhe hai,2020-11-29T07:12:23Z,2020-11-29T07:12:23Z
рдЧреЛрдбрд╕реЗSanjay Kumar chawarvanshi,"рдпреЗ рдХрд┐рд╕рд╛рди рдирд╣реАрдВ рд▓реЗрдлреНрдЯ рдФрд░ рдХрд╛рдВрдЧреНрд░реЗрд╕ рдХреЗ рдХрд╛рд░реНрдп рдХрд░рддрд╛ рд╣реИрдВ,,,,,,,",2020-11-28T01:55:38Z,0,3,,,,
,,,,,H D,Aur aap andhbhakt hain jo godi media dekhta hai,2020-11-28T03:38:49Z,2020-11-28T03:38:49Z
,,,,,рдЧреЛрдбрд╕реЗSanjay Kumar chawarvanshi,"@H D рдХрд┐рд╕рд╛рди рдпреВрдирд┐рдпрди рдХрд╛ рдЭрдгреНрдбрд╛, рд╣реИрдВ рдФрд░ рдмрд╛рдХрд┐ CITU, CONGRESS KA рдЭрдгреНрдбрд╛ рд╣реИрдВ рджрд┐рдЦрд╛рдИ рдирд╣реАрдВ рджреЗрддрд╛ рд╣реИрдВ рдЖрдк рдХреЛ",2020-11-28T15:23:10Z,2020-11-28T15:23:10Z
,,,,,H D,@рдЧреЛрдбрд╕реЗSanjay Kumar chawarvanshimujhe dikhta bhi hai sunta bhi hai aur mehsoos bhi hota ... I come from farmers family and all these farmers are my family ..yeh log 20 September se Punjab mein dharne pe baithe the lekin govt ne inke pass koi option nahi chorra but to face all this in this weather kyunki yeh unki jeene aur marne ka sawal hai aur aapko party ke jhande dikhte hain ...agar unka sath nahi de sakte toh kam se kam unke agitation ko badnaam mat karo ..this is the least one can doЁЯЩП,2020-11-28T18:32:23Z,2020-11-28T18:32:23Z
Shiv Kumar,"Kya yeh Kisaan bhi jihaadi ho gaye???<br>Agar koi awaaz uthaye toh<br> jihadi soch, tukde tukde gang, <br>Desh drohi, aatanki, khalistaini jaise word mil jate hain",2020-11-28T01:51:50Z,0,0,,,,
GURPREET SINGH,ЁЯЩП,2020-11-28T01:51:20Z,0,0,,,,
GURPREET SINGH,ЁЯЩП,2020-11-28T01:51:09Z,0,0,,,,
Susanta Deka,"NOTV, make video Roshni Act fraud also. Award wapsi koro!!",2020-11-28T01:50:27Z,0,0,,,,
V V Padmanabhan padmanabhan,HI RAVISH SIR :: FARMERSтАЩ AGITATIONS IN INDIA ARE ALWAYS COMEDY SCENES ::DURING FADNAVIS REGIME MAHARASHTRA HAD,2020-11-28T01:49:43Z,0,4,,,,
,,,,,V V Padmanabhan padmanabhan,.......KISAN AGITATION EVERY SINGLE DAY BY THE NON EXISTENT MARXIST PARTY SPONSORED AND FINANCED BY PAWAR.,2020-11-28T01:51:20Z,2020-11-28T01:51:20Z
,,,,,V V Padmanabhan padmanabhan,.....NOT TO BE OUTDONE THE TAMIL GANG OF DMK HAD THEIR FUNNY COMIC NAKED NUDE AGITATION IN DELHI....,2020-11-28T01:52:53Z,2020-11-28T01:52:53Z
,,,,,V V Padmanabhan padmanabhan,......SPONSORED AND FINANCED BY CONGRESS AND CHIDDU OF TIHAR FRANE LAUNDRYMAN......,2020-11-28T01:54:07Z,2020-11-28T01:54:07Z
,,,,,V V Padmanabhan padmanabhan,......NOW THE PUNJAB SHOW BY BADAL FAMILY  WITH COMEDIN PAPPU MAKING STATEGIC NOISES OFF AND ON,2020-11-28T01:55:43Z,2020-11-28T01:55:43Z
Yasin Pathan,рдЧреЛрджреА рдореАрдбрд┐рдпрд╛ рдХрд╣рддрд╛ рд╣реИ рдХрд┐ рдХрд┐рд╕рд╛рдиреЛрдВ рдХреЛ рднрдбрд╝рдХрд╛рдпрд╛ рдЬрд╛ рд░рд╣рд╛ рд╣реИред рдордЧрд░ рдпреЗ рдмрд┐рдХрд╛ рд╣реБрдЖ рджрд▓рд╛рд▓ рдореАрдбрд┐рдпрд╛ рдЕрдкрдиреЗ рдорд╛рд▓рд┐рдХ рдХреЗ рдЦрд┐рд▓рд╛рдл рдХреИрд╕реЗ рдмреЛрд▓реЗрдЧрд╛ред рд╢рд░реНрдо рдХрд░реЛ рджрд▓рд╛рд▓реЛ !,2020-11-28T01:39:22Z,0,0,,,,
Md Shadab Alam,"A group of farmers from Punjab and Haryana reached the Delhi border at Tikri on Friday morning. They are now facing off with the Delhi Police, who are using tear gas and water cannons in a bid to prevent their entry into the city.<br><br>Tens of thousands of farmers are still on their way to the capital, as part of the тАШDelhi ChaloтАЩ protest against the CentreтАЩs new agricultural reform laws.A group of farmers from Punjab and Haryana reached the Delhi border at Tikri on Friday morning. They are now facing off with the Delhi Police, who are using tear gas and water cannons in a bid to prevent their entry into the city.<br><br>Tens of thousands of farmers are still on their way to the capital, as part of the тАШDelhi ChaloтАЩ protest against the CentreтАЩs new agricultural reform laws.<br><br>Click here for live updates<br><br>The Delhi Police have denied permission for the protest, citing the dangers of public gatherings during the COVID-19 pandemic. Border crossings have been barricaded and equipped with barbed wire, sand-laden trucks, drones, water cannons amid heavy security presence. The Delhi Metro has suspended services from the National Capital Region into the city and also closed a number of stations along the Green Line.<br><br>The Delhi Police have sought permission from the Delhi government to use nine stadiums as temporary jails for farmers expected to be arrested during protests, a senior police officer told The Hindu. AAP national spokesperson Raghav Chadha urged the State government to deny permission to set up the prisons. тАЬThe farmer of our country is neither a criminal nor a terrorist. Right to protest peacefully is enshrined in Indian Constitution - Article 19(1) and protests are the hallmark of a free, democratic society,тАЭ he tweeted.<br><br>Groups of farmers from Uttarakhand, Madhya Pradesh, Maharashtra and Karnataka have been stopped at several points along the Uttar Pradesh border with Rajasthan and Uttarakhand, and they are holding road blockade protests there. Other groups are facing police barricades within Haryana and Uttar Pradesh, and there are reports of protests in Rohtak after one farmer died during a road accident allegedly caused by the barricades.<br><br>Several large convoys, mostly from Punjab and Haryana, are nearing the Delhi border. About 3,000 vehicles with thousands of farmers have crossed Sapla and are heading towards the Tikriwal border point, according to the Samyukt Kisan Morcha, an alliance of the various farmers groups participating in the protest.<br><br>On Friday morning, the alliance wrote to Prime Minister Narendra Modi, appealing for farmers to be given a free and safe passage into the capital and allotted a space like the Ramlila Maidan to gather and hold talks with the government.<br><br>BY MD SHADAB HUSSAIN<br>Student of Jamia Millia Islamia",2020-11-28T01:26:21Z,1,0,,,,
Robi S,Madari pradhan mantri Bna diya Wo Nacha rha h,2020-11-28T01:20:44Z,0,0,,,,
Gulam Sarwar,The farmers are our back bone.,2020-11-28T01:19:41Z,0,0,,,,
Sukhminder Singh,"Jo godi aur godi bhakat bolte hain ki hum jhukte nhi hain ab baat fayde nuksaan ki nhi rhi inki ye khwayish poori krni hai inko jhukane ki,hmaara itihass padho hmne dictators ko jhukaaya hai yhan to phir bhi thoda bahut democracy hai.jai kisan jai jwaan(kisan ka beta).",2020-11-28T01:17:14Z,0,0,,,,
NAFISHA KHATOON,hadd hogaya h apne haq ki baat v sarkar ke samne rakhne nahi dete ЁЯШнЁЯШнЁЯШн,2020-11-28T01:10:04Z,1,0,,,,
Md Ashfaque Alam,Good channel,2020-11-28T01:09:48Z,0,0,,,,
Abdur Rahim,"Sar aap ko aoor NDTV ko salam hain,aap hi hain jo moddhe ki baat karte hain aoor sab news wale bjp ka dalal hain",2020-11-28T01:09:05Z,0,0,,,,
Abdur Rahim,Yah hain hamare hindustan.,2020-11-28T01:01:24Z,0,0,,,,
Pintu Kumar Yadav,I supported you sir,2020-11-28T00:46:32Z,1,0,,,,
montaxxb gg,Aur had to tab ho jati h jab BJP phir jeet jati h,2020-11-28T00:40:07Z,1,0,,,,
Noel Fernandes OFFICIAL,"You broadcasted news against the Congress when  incorrect policies, same going on now, this is an example of real journalism, it is never easy to speak the truth.",2020-11-28T00:24:13Z,29,0,,,,
smruti Ranjan Mishra,This government turns into a demon ....<br>Thank you Mr prime Minister of North india,2020-11-28T00:10:48Z,2,0,,,,
Manjit Singh,God bless to ravish bhai,2020-11-27T22:43:22Z,0,0,,,,
KAUSHAL BHARTI,Sir kisan bhut paresan he,2020-11-27T22:15:24Z,0,0,,,,
aashu aashu,Ravish Babu Aap mahaan hain<br><br><br>Sadar Charan Sparsh!!,2020-11-27T22:06:54Z,1,0,,,,
Jaibir singh Batth,True journalism. Keep it up.,2020-11-27T21:56:17Z,0,0,,,,
KAUSHAL BHARTI,Sir desh bhut kharab daur me he,2020-11-27T21:55:46Z,0,0,,,,
Mo Shavez,ЁЯШвЁЯШвЁЯШвЁЯШвЁЯШнЁЯШнЁЯШнЁЯШнЁЯШеЁЯШе,2020-11-27T21:48:03Z,0,0,,,,
Hemanth Gowda N K,Thanks for coverage of this heart breaking incident for two days ЁЯЩПЁЯЩПЁЯЩП<br>What  godi media lags .<br>They are again being busy by showing farmers as anti-national and Khalistan,2020-11-27T21:39:56Z,0,0,,,,
vijay surendran,finally we will all be forced to eat gmo crops which taste like chemical goop if these &#39;corporates &#39; have their way .. its already happened in &#39;developed&#39; countries like usa and eu ..,2020-11-27T21:32:15Z,1,0,,,,
vijay surendran,farmers in india have some stark choices  .. one they could sell their land to builders as farming is no longer profitable .. two they could  end their lives seeing how their debt situation becomes very bad and precarious thanks to the policies of  central govt .. three they could sell their land to &#39;corporates&#39; or become pawns of corporates .. or better yet migrate to city become part of the urban poor  and slum dwellers .. all thanks to  acche din promised by yours truly ..,2020-11-27T21:29:43Z,1,0,,,,
Sub80,This is an oppressive Government. Listen to the farmers. They have a right to peaceful protest.,2020-11-27T21:27:01Z,15,0,,,,
Imran Paik,Good sir,2020-11-27T21:19:11Z,0,0,,,,
Prashant Singh,"These are not real farmers rallies these are the rich dalals whose business will be lost forever .......now Rubbish kumar will run an alternative on terms of choti hot, badi jor and majholi hot ;););)...I think India should done away with this old Mandi system and middle man&#39;s...the time is now the profit reach directly to farmers by removing this middle man.<br><br>These Pseudo leftist like Rubbish NDTV should be done there reporting from China as there reporting are more communist centric rather then driving national agenda.<br><br>How much false narrative NDTVand Rubbish kumar try eventually the new India will chart its own course and people like Rubbish will keep on doing false propaganda ;););)",2020-11-27T21:01:57Z,1,0,,,,
Raj sidhu,modi ko hatanaaa hogaaa..nahi to we will the poorest country of the world and again slav of any other country or ambani aaadani......plij people come with farmers,2020-11-27T20:58:46Z,0,0,,,,
Raj sidhu,modi sahab ...sahab bolne ki jarurat nahi esko na ye layk h uske ...sahab to aatal ji the ....ye to gaaliyo k layak h...chayewala,2020-11-27T20:56:47Z,0,0,,,,
Vairagya,Jo bole so nihaall ! Sat sri aakaaallll !!,2020-11-27T20:54:06Z,1,1,,,,
,,,,,hafijul Haque,G,2020-12-02T15:10:09Z,2020-12-02T15:10:09Z
Raj sidhu,modi srkar is worts sarkar of the world .........anpad or chaiwalaaa bechnaa hi jantaa h <br>fark itna h pahle chaye bechta tha aaabb desh bech raha h gatiya,2020-11-27T20:53:19Z,0,0,,,,
Aman Sandhu,Finally after months some media attention to this cause,2020-11-27T20:49:17Z,2,0,,,,
SABIR PIYA KALIYAR SHARIF HAQ SABIR YA SABIR,Koi hai sun ne wala ЁЯд▓ЁЯд▓,2020-11-27T20:39:11Z,1,0,,,,
Navjot,Thank you ravish Kumar Thank you ndtv bow down for your bravery against new Hitler of the india,2020-11-27T20:36:33Z,0,0,,,,
rajat jindal,&quot;History will be kinder to me than the contemporary MediA&quot;- Manmohan Singh!,2020-11-27T20:35:25Z,154,11,,,,
,,,,,well wisher,"Pakistan will also be kinder to me than India, as I did not avenge for victims of 26/11- Manmohan Singh",2020-11-30T21:04:00Z,2020-11-30T21:04:00Z
,,,,,harjot singh,@well wisher hume badle se kya lena hai bhai hume to be raat ki aachi tarah se roti aur aache school jaane k liye paisa chayiea...aarthik stithi bhot khrab hai note bandi k baadse hamari aap bhi thoda samjhie,2020-12-04T21:35:59Z,2020-12-04T21:35:59Z
,,,,,well wisher,@harjot singh note bandi se aarthik stithi kaise kharab hui?,2020-12-04T21:50:51Z,2020-12-04T21:50:51Z
,,,,,harjot singh,@well wisher my father is a small scale manufacturer and hum choti torches banate hai and hamara karobar cash me he chlta tha but note bandi k baad se 4 5 mahine hamara maal pada pada khrab hogya aur bhot nuksan hua and fir 1 2 saal market me kisi k orders nahi hai and peeche se plastic k rate bhi bhadd gye to hum dukaandaro ko dete hai 7 rupay per peice but china se unhe same cheej 3 ya 4 rupay me avalaible ho jati hai,2020-12-04T22:14:57Z,2020-12-04T22:14:57Z
,,,,,harjot singh,@well wisher actually note bandi was not a good idea and govt launched GST aaj k time pr koi retailer bina GST bill k maal nhi mangvata aur we are poor and we cannot afford 22% in our every peice of torch so i hope you understood my brother,2020-12-04T22:16:28Z,2020-12-04T22:16:28Z
,,,,,well wisher,"@harjot singh I asked u about note bandi not GST ..... tell me how  note bandi affected u financially?......and what is 22%?......GST is 18%......it was implemented to bring uniformity among all states.....i.e. everybody pays same tax for same product or service all over india ....many foreign companies do want to setup factories in India because of different tax  schemes in every state, it becomes headache for them...hence GST.....until and unless u r tax defaulter note bandi and GST should not affect u at all",2020-12-04T22:41:55Z,2020-12-04T22:41:55Z
,,,,,harjot singh,@well wisher we cannot afford gst otherwise it wouuld be a deal of loss and due to notebandi hamara maal pada pada khrab hogya jiske karan already itna nuksan hua,2020-12-04T22:47:05Z,2020-12-04T22:47:05Z
,,,,,harjot singh,@well wisher bhai dekh mere ander itni knowledge nhi hai ki mai har ek loss ka reason bata saku hn but its our family&#39;s vote and we are going to vote AAP as he gave us 200 units free electricity and free water and my grandma get pensions on time and its our vote and we are gonna vote for AAP,2020-12-04T22:50:25Z,2020-12-04T22:50:25Z
,,,,,well wisher,@harjot singh how did u afford tax before GST?  That means u r a tax defaulter.......note bandi mai maal kyu pada raha?....matlab pura cash se business hota hai?....bank system kyu hai phir?..... Isiliye govt ne yeh sare changes kye hai....taaki log income tax ki chori naa kar paaye....,2020-12-04T22:55:04Z,2020-12-04T22:55:04Z
