Name,Comment,Time,Likes,Reply Count,Reply Author,Reply,Published,Updated
Ankit 08chouhan,Saale dalaal isme corona nhi dikhta tujhe,2021-05-25T05:39:29Z,0,0,,,,
Saddam barbhuiya,chahie please sar kuchh bhi humko bataiye,2021-03-27T18:21:35Z,0,0,,,,
Ismail Hotel,NDTV<br>Good news ЁЯСНЁЯСМЁЯСНЁЯСМЁЯСНЁЯСН,2021-03-12T16:32:49Z,0,0,,,,
Ismail Hotel,Jai jai jai kisan ЁЯЩЛЁЯСкЁЯд╖ЁЯСМЁЯСНЁЯЩПЁЯЩП,2021-03-12T16:31:40Z,0,0,,,,
Wazir Singh,Ravish Kumar Ji aap ko Sat shri Akaal,2021-01-26T08:29:29Z,0,0,,,,
Smart Mom,Thank u NDTV and Ravish Sir.,2021-01-15T22:15:04Z,0,0,,,,
Mohammed Ghouns,╪в┘╛ ┌й╪з ╪┤┌й╪▒█М█Б ╪м┘Ж╪з╪и,2021-01-05T09:09:47Z,0,0,,,,
Mohammed Ghouns,╪╕┘Д┘Е ┌╛█Т ┌й╪│╪з┘Ж ┘╛╪▒ ┌Ж┘Д┘И ╪и┌╛╪з╪ж█М █Б┘Ж╪п┘И╪│╪к╪з┘Ж ┌й█М ╪│█М┘Д┌й╪▒ ┘Ж█Б ╪▒┌╛╪з ┌╛┘Е ╪н┘И╪з┘Д█Б ╪п█М╪к█Т ╪к┌╛█Т ┌й█Б ╪│╪и ╪з┘Е┘Ж ╪│█Т ╪▒█Б╪к█Т █Б█М┌║,2021-01-05T09:09:06Z,0,0,,,,
sajjan kumar,"Suna hai BJP ke IT cell walo ne apne kaam ki speed badha di hai,kyonki 10 paise ki jagah 15 paise per msg milne laga hai FARMERS Protest ko badnaam karne ke liye....ЁЯШВЁЯШВЁЯШВЁЯШВ",2021-01-05T00:39:41Z,0,0,,,,
Jassi Lalpur,Kissen ekta jindabad,2021-01-04T09:58:13Z,0,0,,,,
Kamaljit Singh,Kamaljit USA 559 3695289,2021-01-04T09:10:22Z,0,0,,,,
Kamaljit Singh,Bhaji i proud of u,2021-01-04T09:07:40Z,0,0,,,,
Kamaljit Singh,Veer ji i proud of u Kamaljit USA 559 3y9 526o,2021-01-04T09:04:25Z,0,0,,,,
Kailasben Patel,рдХрд┐рд╕рд╛рдиреЛрдВ рдХрд╛ рдЖрдВрджреЛрд▓рди рдЕрд╣рд┐рдВрд╕рдХ рд╣реИ рддреЛ рдкреЛрд▓рд┐рд╕ рд╣рд┐рдВрд╕рдХ рдХрд░рдиреЗ рд╕реЗ рдордЬрдмреВрд░ рдордд рдХрд░реЛред <br>рдЬрдп рдЬрд╡рд╛рди рдЬрдп рдХрд┐рд╕рд╛рди редредред,2021-01-03T09:16:31Z,0,0,,,,
Kulwinde singh Kinder,Vadia banda rabish,2021-01-02T08:19:27Z,0,0,,,,
Jagtar Jatt,Kisan majdoor ekta jindabaad modi Kisan birody,2021-01-02T05:31:03Z,0,0,,,,
Jonny Singh,Real news,2021-01-01T16:28:44Z,0,0,,,,
Jonny Singh,Good chanal,2021-01-01T16:28:33Z,0,0,,,,
Jonny Singh,ЁЯСН,2021-01-01T16:28:22Z,0,0,,,,
Asim Pasha,Hii,2020-12-30T05:44:47Z,0,0,,,,
Markhibhai Varotariya,Jai jawan jai kishan.,2020-12-30T04:30:05Z,0,0,,,,
Pratik Jagdale,Salo EVM band Karne keliye Kya Karreo medio walo,2020-12-29T17:34:16Z,0,0,,,,
Afnan Mahmud,Modi Jindabad. Beat all Farmers.,2020-12-29T13:14:40Z,0,0,,,,
Debdas Banerjee,Capitalism trying to establish total hagimony over agriculture,2020-12-29T13:03:52Z,0,0,,,,
Ismail Hotel,┌й╪│╪з┘Ж ╪и┌╛╪з█М┘И┌║ ┌й┘И ╪│┘Д╪з┘Е ┘╛█М╪┤ ┌й╪▒╪к╪з █Б┘И┌║ ЁЯЗ╡ЁЯЗ░ ┌Ж┌й ╪п█Т ┘╛┌╛┘╣█Т ┘╛┘Ж╪м╪з╪и ╪п█Т ╪┤█М╪▒ ЁЯжБЁЯжБЁЯЗ╡ЁЯЗ░ЁЯЗ╡ЁЯЗ░ЁЯЗ╡ЁЯЗ░,2020-12-25T16:24:36Z,0,0,,,,
Faqir Khan,Khalistan jindabad KASHMIR zindabad pakistan zindabad china zindabad ameen pak army zindabad ISI zindabad china army zindabad,2020-12-24T11:33:08Z,0,0,,,,
Rafiq Ibrahim,This is ModiтАЩs R.S.S. BJP INDIA killing his ow people . Viralise this video on platforms,2020-12-24T05:50:23Z,0,0,,,,
Ikram Sheikh,Bohot khoob Ji.,2020-12-23T22:49:27Z,0,0,,,,
Help me for first 1 k subscribers pls,Ravish kumar gi aap ko kya lagta aage aane wale 5 salo me ye modi aur shah kya kya karenge,2020-12-22T16:39:05Z,0,0,,,,
S.F.I. JAI HIND,"DESH KE KISAANO KE SAATH YE KYA ZULAM HORAHA HAI. .<br>MUDI SARKAR BJP RSS MURDABAD <br>17,12,2020,",2020-12-17T04:31:35Z,1,0,,,,
azad kashmir  valog,Ksan bio support me,2020-12-14T13:56:25Z,0,0,,,,
Anjum Zaman,now only halistan halistan halistan halistan halistan halistan halistan halistan halistan only halistan halistan halistan halistan,2020-12-11T15:22:41Z,1,0,,,,
Vishnu Reddy,PM need to donate money to farmers from PM care fund due to the loss and punishment the farmers went through,2020-12-10T22:32:52Z,0,0,,,,
Atiq Ahmad,Really appreciated NDTV,2020-12-10T20:12:51Z,0,0,,,,
Atiq Ahmad,Kitna ganda country ka system hai yahan to life janwaro se hai. Ghareeb farmers k sath kyun zulm ker rhy hein ye gandi Govt. Shameless country sari dunia thoo thoo ker rhi ha. Pehly kashmir fir punjab and others farmers,2020-12-10T20:12:05Z,0,0,,,,
Nardosh kumar,рдЖрдЬ рд╣рдо рднреА рддреЛ рджреЗрдЦреЗрдВ рднрд╛рд░рддреАрдп рд▓реЛрдЧ рдХрд┐рддрдиреЗ рдиреЙрд▓реЗрдЬ рд░рдЦрддреЗ рд╣реИрдВ рднрд╛рд░рдд рдХреЗ рдРрд╕реЗ рдкреНрд░рдзрд╛рдирдордВрддреНрд░реА рдХрд╛ рдирд╛рдо рдмрддрд╛рдПрдВ рдЬрд┐рд╕реЗ рд╕рдмрд╕реЗ рдЬреНрдпрд╛рджрд╛ рдЧрд╛рд▓реА рдЦрд╛рдиреЗ рдХреЛ рдорд┐рд▓реА рд╣реЛ????ЁЯШО,2020-12-10T17:24:23Z,0,0,,,,
Hyder Marakkar,Good the government should deal like this only. Government should never accept their conditions... whatever the people of this country is with Modiji and government...,2020-12-09T14:19:56Z,0,0,,,,
vijayawada C,All BS .. could not find even a single provision which is possibly good or appreciative for farmers..,2020-12-08T16:11:21Z,0,0,,,,
Samsher Khan,Ravish kumar g aap bahut Accha jankari dete ho,2020-12-07T07:03:12Z,0,0,,,,
Info Time,It&#39;s happening in Endia with non hindus,2020-12-06T19:50:04Z,0,0,,,,
Manpreet Singh,only channel and person which has courage to show truth,2020-12-06T19:01:54Z,0,0,,,,
Palwinder Sidhu,Thanks ndtv,2020-12-06T17:31:44Z,0,0,,,,
SAMIR SHAIKH,Happy birthday..Ravish Sir...,2020-12-06T16:55:42Z,0,0,,,,
Guddu Singh,Godi media benakab,2020-12-05T15:06:43Z,0,0,,,,
Guddu Singh,Sachchiyay Dikhane wala Duniya ka number Van channel NDTV,2020-12-05T15:05:36Z,1,0,,,,
Guddu Singh,NDTV ka dhanyvad,2020-12-05T15:05:00Z,0,0,,,,
Zeeshan Malik,╪к╪н╪▒█М┌й <br>╪о╪з┘Д╪╡╪к╪з┘Ж ╪┤╪▒┘И╪╣,2020-12-04T19:39:23Z,0,0,,,,
SANCO ENTERPRISES,Shame shame. This is against our farmers.,2020-12-04T16:37:50Z,0,0,,,,
Dr.Jasminder Singh,"Once in your life you need a doctor, a lawyer, a policeman, and a preacher. But every day, three times a day, you need a farmer",2020-12-04T06:20:59Z,0,0,,,,
Gursin Atwal,The only real and responsible channel in india <br>Always show true things on the channel <br>Great job sir,2020-12-04T02:36:40Z,0,0,,,,
SHEIKH GAWHAR,"Farmers are awesome. Farming ranks high on my list of an admired profession as farmers provide most of the food we eat! And I like to eat!<br>When I was younger I was also enjoyed visiting the farm of my family . I loved the animals, the farm land, and even the smells from farm!<br>This is the perfect time to thank a farmer.<br>If you personally know a farmer I suggest thanking them with good gift. If you visit a farmerтАЩs market, take a minute to say тАЬthank youтАЭ to the farmer when making a purchase.",2020-12-03T21:02:17Z,0,0,,,,
Qazi Suhail,Dihtkaar ho aysi sarkaar per jo janta per zulm kara jay kisan,2020-12-03T14:14:51Z,0,0,,,,
juyel khan,ржХрзГрж╖рж┐ ржХрж░рзНржо ржХрж░рж╛ ржХрж╖рзНржЯрж╢рж╛ржжрзНржз ржмрзЗржкрж╛рж░ред<br>рж╕рж░ржХрж╛рж░  ржЧржжрж┐рждрзЗ ржмрж╕рж▓рзЗред ржХрзГрж╖ржХ<br>ржЖрж░ ржХрзЛржи ржжрж╛ржо ржирзЗржЗ  ред ржПрж░ ржирж╛ржо <br>ржХрзНрж╖ржорждрж╛ редред,2020-12-03T04:27:15Z,0,0,,,,
Jakhujakhu 123,ЁЯШбЁЯШЮЁЯШЮ,2020-12-03T01:06:58Z,0,0,,,,
Shado Dado,Khalistan is the solution.,2020-12-02T21:49:35Z,0,0,,,,
SHINDA Shinda virk,Please change your back dp,2020-12-02T19:51:50Z,0,0,,,,
Khiyaram Sharma,CHATUKARO KI JAI HO,2020-12-02T19:46:32Z,0,0,,,,
SHINDA Shinda virk,Love u ndtv,2020-12-02T19:41:22Z,0,0,,,,
SHINDA Shinda virk,We are comingЁЯШаЁЯШаЁЯШаЁЯШа,2020-12-02T19:40:11Z,0,0,,,,
SHINDA Shinda virk,Thanks u sir ji,2020-12-02T19:37:46Z,0,0,,,,
BANSHEE PAYNE,Lol water guns on Punjabi people...bruh...you cant throw water at mountains to move them...if they have come to delhi..they mean business.,2020-12-02T19:17:13Z,0,0,,,,
vikash pandey,рднрд╛рдЬрдкрд╛ рд╕рддреНрддрд╛ рдХреЗ рдирд╢реЗ рдореЗрдВ рдЪреВрд░ рд╣реЛ рдЧрдИ рд╣реИ,2020-12-02T16:55:02Z,1,0,,,,
Lone parvaz,Love you ravish sir love from Kashmir Srinagar,2020-12-02T16:47:15Z,0,0,,,,
Sk Rafiuddin Sk,Very good sir very good job,2020-12-02T15:39:33Z,0,0,,,,
Harsh Mishra,supreme court judge NV Ramana ke corruption charge wale case ka kya hua ?.....please raise this news on your channel.,2020-12-02T08:57:50Z,0,0,,,,
Kris Ea,"Scrap all laws passed by EVM hack elect BJP, during Covid Lockdown period. Ban EVM machines, BJP step down from power, because BJP was not elected by people, they got elected by themselves by hacking EVM. India wants freedom from RSS-BJP terrorist group.",2020-12-02T07:39:01Z,0,0,,,,
Onkardeep Singh,Did we get the freedom or are we still fighting for it?,2020-12-02T05:51:22Z,0,0,,,,
Sf Ali,Ravish kumar <br>PM Material??,2020-12-02T02:33:42Z,0,0,,,,
Khalid Mehmood,modi aur shagkibaandmasi ganna hoigaya,2020-12-01T16:53:47Z,0,0,,,,
Afsar kazi,Police wale Gunde,2020-12-01T16:39:54Z,0,0,,,,
Shahid dar,"Jai jawan Jai kisan slogan died ... Gandhi&#39;s Nehru&#39;s philosophy has been kickedout by this Fascist regime .... Shame on Godi media and Andh bakhts Gobar bakhts . it hurts watching the whole india is becoming kashmir Day by day . <br><br>Kashmir mange azadi is old now ,soon there will be india mange azadi ( Arundhati Roy ).",2020-12-01T15:42:37Z,0,0,,,,
murtaza ali,"BJP ko vote dene ka badla    ,",2020-12-01T15:41:27Z,0,0,,,,
murtaza ali,Yah hai,2020-12-01T15:39:51Z,0,0,,,,
ARY 2 life,Ravish kumar is very honest person <br>And he deserved heartly respect <br>Salute sirЁЯЗоЁЯЗ│,2020-12-01T14:58:08Z,0,0,,,,
Rajkumar Maurya,рддреВ рддреЛ рджреЗрд╢рджреНрд░реЛрд╣ рд╣реА! рдпреЗ рдореЗрд░рд╛ рдЕрднрд┐рд╡реНрдпрдХреНрддрд┐ рдХреА рдЖрдЬрд╝рд╛рджреА рд╣реИ,2020-12-01T14:20:13Z,0,0,,,,
Nature Lover,Modi chutea ko bolo jo phle note bandi ki thi os ke results dekh lea ab Tu ghanta kare ga gandu pm hai abhi tak ka,2020-12-01T13:30:23Z,0,0,,,,
Jaya Karki,Govt. is preparing  another kasmir. This a limitless atrocity against Kisan Majdur sangharsh.,2020-12-01T12:36:53Z,0,0,,,,
Kareem Kareem,rss kutta,2020-12-01T11:37:08Z,0,0,,,,
gaming with lily,Jai jawan jai kisaan kya faida is slogan ka abh,2020-12-01T11:33:03Z,0,0,,,,
Mahendrakumar Patel,рд░рд╡рд┐рд╢рдХреБрдорд╛рд░ рддреБрдореНрд╣рд╛рд░реА рдХреЛрдВрдЧреНрд░реЗрд╕ рд╢рд╛рд╕рдирдореЗрдВ рдЦреАрдЪрдбреА рдкрдХрддреА рдереА рдЕрдм рдХрдЪреНрдЪреА рд╣реА рд░рд╣реЗрдЧреАред,2020-12-01T08:05:50Z,0,0,,,,
Harry gill Harry gill,"punjab me bi aisa he hai sir <br>kisano se 2,4 rupe k hisab se lekar <br>bahar 50,60 rupe kg bikti hai sabjia <br>ye toh poori tarah ki loot hai sir",2020-12-01T07:27:10Z,0,0,,,,
Harry gill Harry gill,NDTV sabse best chenal hai RAVISH  KUMAR ki vajah se,2020-12-01T07:18:58Z,0,0,,,,
Razzak Khan,Kyu nahi kar rahi sarkar in sa baat Kyu nahi diya ja raha inko Dili modi ko or wo woot murda baad,2020-12-01T05:42:15Z,0,0,,,,
Ajit Kumar,Sahinbag part 2 start,2020-12-01T02:23:52Z,0,0,,,,
Shardul Lamba,"Bhai Janata itni bholi nahin rahi, jitni 30 saal pehle thi!! Yeh Sardaar ek jut hai not kisaan!!  Yeh ch**tya News Anchors ko kyun nahin samajh Aati!!!",2020-12-01T01:45:39Z,0,0,,,,
хЗаф╣Оц▓бщЧощвШ,хН░х║жф║║ц░Ся╝Мф╜аф╗мчЬЯх┐ГшзЙщЖТхРзя╝МцЮкцЭЖхнРцЙНшГ╜хЗ║цФ┐цЭГя╝МцЮкцЭЖхнРцЙНшГ╜цННхНлшЗкх╖▒чЪДцЭГхИйя╝МшОлш┐кцФ┐х║Ьц▓бцЬЙч╗Щф╜аф╗мхГПф╕нхЫ╜ф╕Аца╖чЪДщШ╢х▒Вц╡БхКищАЪщБУя╝МхжВцЮЬф╜аф╗мхН░х║жчн╛ч╜▓rcepхп╣х║Хх▒Вц░Сф╝ЧцШпф╕Аф╗╢хе╜ф║Ля╝Мх╜Ух╣┤ф╕нхЫ╜цФ╣щЭйх╝АцФ╛х░▒цШпхЙехд║ф║Жх╛ИхдЪцЧвх╛ЧхИйчЫКшАЕчЪДхИйчЫКя╝МцЙНцИРх░▒ф╕нхЫ╜чЪДф╗Кхдйя╝МхКац▓╣хРзуАВ,2020-12-01T01:17:27Z,0,0,,,,
Shaik mohamed ghouse,Give in tamil telugu <br>Start  prime time news in south indian language as your news are neutral use automatic translation in Google and Windows soff ware,2020-11-30T22:25:48Z,0,0,,,,
sekar chinna,KILL  BLODIE RSS.,2020-11-30T21:08:08Z,0,0,,,,
vinoth kumar,Dare this Lady MODI to attack like this to China???,2020-11-30T20:18:38Z,0,0,,,,
shahid ahmed,ignoring is most powerful tool the ruling party....,2020-11-30T18:31:31Z,0,0,,,,
Shivkaran Singh,Thnx sir,2020-11-30T18:11:04Z,0,0,,,,
Naeem Phone,тЩея╕ПЁЯСН,2020-11-30T18:10:59Z,0,0,,,,
Md Khan,Kisaan union jinda baad,2020-11-30T17:21:18Z,0,0,,,,
Md Khan,Very good job sirЁЯСМ,2020-11-30T17:20:32Z,0,0,,,,
Rajvinder Kour,Ravesh ji aap kisano ka live kyo nhi de rhe,2020-11-30T16:51:16Z,0,0,,,,
Ajinkya Pawar,Jalinwala-2,2020-11-30T16:33:33Z,0,0,,,,
Parmjeet Verma,May god give you more strength to stand with the real issues ... Long live NDTV ... A ray of hope in real journalism....,2020-11-30T16:27:46Z,0,0,,,,
awanish kumar,Where is the biggest farmer Mr. Vadra?,2020-11-30T16:18:19Z,0,0,,,,
anoop tiwari,Good job,2020-11-30T15:54:25Z,0,0,,,,
Gore Pasha,Godi media and there god fathers will be questioned by the divine.  They and they loved ones definitely will face the immoral acts on the poor people,2020-11-30T15:25:16Z,0,0,,,,
Siraj siddiqui,Right,2020-11-30T14:56:29Z,1,0,,,,
GM,рдбреЙ рд░рдмрд┐рд╢ рдХреЛ рдорд╕рд╛рд▓рд╛ рдорд┐рд▓ рдЧрдпрд╛ ЁЯдкЁЯдкЁЯдкЁЯдкЁЯдк,2020-11-30T14:34:55Z,0,0,,,,
Golden retriever sale,Ravish kumar great,2020-11-30T14:11:39Z,0,0,,,,
Rakesh Kumar,Govt desh ka vikas nahi kar rahi hai,2020-11-30T13:41:45Z,0,0,,,,
zanskar THE Paradise,why the innocent farmers are treated like criminal..... shame on Indian government,2020-11-30T13:33:20Z,0,0,,,,
Hn Sharma,рдЕрдм рдиреВрди рд░реЛрдЯреА рдирд╣реАрдВ рдЦрд╛рдУрдЧреЗ  рдЬреЛрдЧрд▓рддреА рдЬрдирддрд╛ рдХрд┐рд╕рд╛рди рдХрд┐ рдУ рдЧрд▓рддреА рдЕрдм рджреБрдмрд╛рд░рд╛ рдирд╣реАрдВ рдХрд░рдирд╛ рд╣реИ рдФрд░ рдЧрд▓рдд рдкреАрдПрдо рдореЛрджреА рдХреЛ рджреЗрд╢ рд╕реЗ рдЙрдЦрд╛рдбрд╝ рдлреЗрдВрдХреЛ рдпрджрд╛ рдХрд░реЛ рдХреА рдХреЛрдИ рджреВрд╕рд░рд╛ рдкреАрдПрдо рджреЗрд╢ рдХрд╛ рд╣реЛ рддреЛ рдЬрдирддрд╛ рдХреЛ рдореВрд░реНрдЦ рдирд╛ рдмрдирд╛рдП  рджреЗрд╢ рд╕рдмрдХрд╛ рд╣реИ рдХрд┐рд╕рд╛рди рд╣реИ рддреЛ рджреЗрд╢ рд╣реИ  рдореЛрджреА рджреЗрд╢ рдирд╣реАрдВ рд╣реИ,2020-11-30T13:23:10Z,0,0,,,,
Bharat Joshi,Kukur ravishva,2020-11-30T13:18:38Z,0,0,,,,
ITS HASHIR,I was solving physics problem when he said... Yeh sawal physics ki tarah mushkil haiЁЯдгЁЯдгЁЯдгЁЯдгЁЯШУЁЯШУЁЯШУ,2020-11-30T11:36:59Z,0,0,,,,
jatinder mukhija,Salute dil se ravish sir g.....,2020-11-30T11:25:57Z,0,0,,,,
Shridhar Mahajan,"рдЗрд╕ рд╕рдордп, рджреЗрд╢ рдХрд╛ рдХрд┐рд╕рд╛рди рдмрд╣реВрдд рднрд╛рд╡реВрдХ, рд╡рд┐рдкрджрд╛рдкреВрдгреЖ рдФрд░ рдХрд╖реНрдЯрджрд╛рдпреШ рджреМрд░ рд╕реЗ рдЧреБрдЬрд░ рд░рд╣рд╛ рд╣реИ, рдЗрд╕ рдкрд░рд┐рд╕реНрдерд┐рддреА рдореЗрдВ рдореЛрджреА рд╕рд░рдХрд╛рд░ рдиреЗ рд╕рдордЭрджрд╛рд░реА, рд╕рдВрд╡реЗрджрдирд╢рд┐рд▓рддрд╛ рдФрд░ рдмрдбрд╛ рдорди рджрд┐рдЦрд╛рдирд╛ рдЪрд╛рд╣рд┐рдП, рд╕рд╛рд░рд╛ рджреЗрд╢ рдЗрд╕ рдХрд┐рд╕рд╛рди рдЖрдВрджреЛрд▓рди рдХреЛ рджреЗрдЦ рд░рд╣рд╛ рд╣реИ, рд╣реЗ рдЗрд╢реНрд╡рд░, рд╣реЗ рдЕрд▓реНрд▓рд╛, рд╣реЗ рд╡рд╛рд╣реЗрдЧреБрд░реВ рдореЛрджреА рд╕рд░рдХрд╛рд░ рдХреЛ рд╕рджреГрдмреБрджреНрдзреА рджреЗ, рд╡рд┐рд╡реЗреШ рдмрдХреНрд╖реЗ.......рднрдЧрд╡рд╛рди рд╕рдмрдХрд╛ рднрд▓рд╛ рдХрд░реЗред",2020-11-30T10:28:36Z,0,0,,,,
Sadiq Bappunavar,Jawan kisan ko Maraha hai  BJP rule,2020-11-30T10:20:39Z,0,0,,,,
JSR JSR,Deshdrohi kisan modiji ko gali de rahe hai.,2020-11-30T10:18:17Z,0,0,,,,
Mohd Gaffar,.,2020-11-30T10:02:56Z,0,0,,,,
CHANDAN KUMAR,Sabi chij ka dam tay ho,2020-11-30T09:52:08Z,0,0,,,,
CHANDAN KUMAR,Kisan se 5kilo tamatar karido or becho 50kilo,2020-11-30T09:51:50Z,0,0,,,,
CHANDAN KUMAR,Bihar me began tamar 80 kilo kisan ubajata hai 20 kilo ho jata hai ab ehi 70 kilo aalu modi baba kab acha din aega mandi band ho,2020-11-30T09:49:56Z,0,0,,,,
Dr.shashi Londhe,Very good analysis,2020-11-30T09:49:17Z,0,0,,,,
CHANDAN KUMAR,Real hero of india ravis kumar,2020-11-30T09:48:23Z,0,0,,,,
CHANDAN KUMAR,"Cong bjp dono gadar hai lakin bjp kuch jayda hai aaj bihar up me kheti jorne ke lie majbur ho raha hai kyu ki unke kamae,sal 5se bhi kam hai",2020-11-30T09:42:43Z,0,0,,,,
CHANDAN KUMAR,Ehi рд╕реБрдХреБрд░рд┐рдЯреА border per lagata modi to desh me рдЪреАрди рдкрд╛рдХрд┐рд╕реНрддрд╛рди or рдЕрдЯрдХрд╡рд╛рджреА nhi ata e рджреЗрд╢ me emergency hai,2020-11-30T09:36:53Z,0,0,,,,
CHANDAN KUMAR,Bjpeke ke pass data nhi kuto raj karne ke lie or parchar kr ke lie bane ho bjp walo,2020-11-30T09:34:23Z,0,0,,,,
Sumaia Imam,"Congress k waqt green revolution  ,white revolution hua or modi ne sirf berozgari revolution ,hindu muslim revolution karaye...",2020-11-30T09:33:43Z,0,0,,,,
CHANDAN KUMAR,Pura bharat ko kisan ko virod karo nhi to pura desh ka kisan marega kya hal hai bihar or up me 13 chabal or рдзрд╛рди pura desh kisan ko sath de birod ohi log kar rahe hsi kisan jo deshdrohi or amir pati log manuwadi log рд╣реИ jo kisan hit me nhi рд╣реИ or,2020-11-30T09:33:30Z,0,0,,,,
Gurpreet Bajwa,"i like this new channel and the their anchors . They are very democratic and shows us тАШrealтАЩ new updates unlike modi funded news channels like zee news . I wanna tell you guys that you are going a good job !! not just Inda ,its the whole world  who is watching this protest . This is real journalism unlike other news channels who arr always favouring modi",2020-11-30T09:32:31Z,0,0,,,,
CHANDAN KUMAR,E police mediya modi government kya kill our constitution democracy this country make koriya and seriya wants netion should this government no our country this law,2020-11-30T09:25:41Z,0,0,,,,
CHANDAN KUMAR,Godi mediya aaj hamare kisan ko atakwadi bataya samjho godi mediya bjp ka kuta hai,2020-11-30T09:23:15Z,0,0,,,,
amrit singh,"shame on modi, shame on him.",2020-11-30T09:01:11Z,0,0,,,,
Shivam yadav,"рдореЗрдВ рднреА рдЪреМрдХреАрджрд╛рд░ рд╣реВрдВ, рд╡рд╛рд▓реЗ рд▓реЛрдЧ рдХрд╣рд╛рдВ рдорд░ рдЧрдП....<br><br>рдореЗрдВ рднреА рдХрд┐рд╕рд╛рди рд╣реВрдВ...",2020-11-30T08:34:41Z,0,0,,,,
Speen Tv,isi Pakistan pr Alzam laga do. k Pakistan in k phechy hai. Moodi,2020-11-30T08:32:52Z,0,0,,,,
Justin Rozema,Ravish kumar you are the best,2020-11-30T07:51:47Z,0,0,,,,
Justin Rozema,Ise kehte hai patarkaari <br>Chutiya godhi medea,2020-11-30T07:51:22Z,0,0,,,,
govind ja,Bjp govt ka aesa hal hoga jo usne kbhi spne me nhi socha hoga,2020-11-30T07:32:05Z,0,0,,,,
Shameem ansari,Ravish sir great journalist,2020-11-30T06:58:17Z,0,0,,,,
Raffak khan,Very good news,2020-11-30T06:47:13Z,0,0,,,,
Sabir Ali,"рдмреАрдЬреЗрдкреА рд╕рд░рдХрд╛рд░ рдФрд░ рдЙрдирдХреЗ рдХрд╛рд░рд┐рдВрджреЛ рдХреЛ рдмреЗрд░реЛреЫрдЧрд╛рд░реА, рдордВрд╣рдЧрд╛рдИ, рдХрд┐рд╕рд╛рди рдореЫрджреВрд░, рд╕реНрдХреВрд▓ рдХреЙрд▓реЗрдЬ, рдЕрд╕реНрдкрддрд╛рд▓ рдкреЗ рдмрд╛рдд рдХрд░рдиреА рдирд╣реАрдВ !!!",2020-11-30T06:30:40Z,0,0,,,,
Ajay Patil,Hats off to the Reporter and Ravishji,2020-11-30T06:17:09Z,0,0,,,,
ARVIND SAHARAN,aaj ke dor me sbse shi or steek media channel..,2020-11-30T06:11:23Z,0,0,,,,
Study Point,Waw ndtv...ALWAYS truth...and Ravish  kumar akways remember for his hard work...i salute sir,2020-11-30T06:10:31Z,0,0,,,,
Parmod Gupta,Criminals hold power in the country in these days. Only chaos will happen in the country.,2020-11-30T05:47:50Z,0,0,,,,
dilkash mallica,True media тЭдя╕П,2020-11-30T05:06:19Z,0,0,,,,
Belal Ali Khan,British sasan agaya bhai kronolaji samajh mein aia desh ko bachana jarure hai EVM ko hatane hai jai kisan Jai jawan jai hind jai bharat jai sangbidhan Satay May jaita vande matram ЁЯЗ│ЁЯЗк тЬЭя╕ПЁЯХЙя╕ПтШкя╕ПЁЯЗ│ЁЯЗкЁЯТЧЁЯЩПЁЯЩПЁЯЩПЁЯЩП,2020-11-30T04:51:24Z,0,0,,,,
KK Sandhu,so sad to see farmers get treated like this.... how can you treat farmers like this....Shame on MODI,2020-11-30T04:28:21Z,0,0,,,,
KK Sandhu,how can you treat farmers like this....Shame on MODI,2020-11-30T04:27:40Z,0,0,,,,
KK Sandhu,how can you treat farmers like this....Shame on MODI,2020-11-30T04:26:06Z,0,0,,,,
KK Sandhu,Modi is being a dictator,2020-11-30T04:25:26Z,0,0,,,,
KK Sandhu,",  I support FarmersЁЯСНЁЯСНЁЯСН",2020-11-30T04:24:45Z,0,0,,,,
Y A T crazy,yawar,2020-11-30T03:56:58Z,1,0,,,,
LALLANTOP CLASSES,Koi bhi national  godi media <br>Is news ko nahi dikha rhi<br>Ravish sir ndtv hi dikhate hai<br>Dhnyawad sir salute you,2020-11-30T03:53:30Z,0,0,,,,
Mhod Aasim,Ravish please call me Itna Main aapko Sunta hun aur aap ek call bhi nahin karte,2020-11-30T03:40:04Z,0,0,,,,
Arjun Singh,Modi hai to mumkin haiЁЯШВ,2020-11-30T03:39:16Z,0,0,,,,
gurwinder singh jhinjer,India s   one and only national media which is not modi puppet<br>Hats off to NDTV INDIA Jai Hind,2020-11-30T03:19:48Z,0,0,,,,
Biswa Ranjan Mishra,Kamaal ka yeh desh ko chalaane wale neta hain. Sharam nahin hai inko,2020-11-30T01:35:26Z,0,0,,,,
Gurpreet Singh,Nice sir ji,2020-11-30T01:09:50Z,0,0,,,,
A - J . s a n d h u,ЁЯТкЁЯП┐jatt  ЁЯТкЁЯП┐ jaat ЁЯЪй22 22,2020-11-30T00:41:33Z,1,0,,,,
Shibabrata Chakraborty,Educated Kishans  in a group can think of establishing their own Mandis  &amp; take control on this system.,2020-11-30T00:38:27Z,0,0,,,,
Nand Kumar,рдЧреБрд░реБ рдЬреА рдХреНрдпрд╛ рдЖрдкрдХреЛ рдирд╣реА рд▓рдЧрддрд╛  рдкреНрд░рд╛рдЗрдо рдЯрд╛рдЗрдо рдХрд╛ рд╕рдордп рдХрдо рд╣реЛрддрд╛ рд╣реИрдВред,2020-11-30T00:35:31Z,1,0,,,,
Narinder Kumar,Modi 16 tmes visit to china/ modi bring chi jiping to gujrat/modi put Ajit doval in a task/ to win Hindu votes/ how many gujratis go on the border?/ or to help a needy person with money/ modi came in as gujrat hero/ to make Gujarat the number#1 on India&#39;s integrity.<br>Ajit doval ji we need your help!!,2020-11-30T00:32:19Z,0,0,,,,
A - J . s a n d h u,ЁЯЪйЁЯТкЁЯП┐ЁЯМкЁЯТкЁЯП┐ЁЯМкЁЯТкЁЯП┐ЁЯМкЁЯТкЁЯП┐ЁЯМк,2020-11-30T00:26:42Z,1,0,,,,
A - J . s a n d h u,ЁЯТкЁЯП┐ЁЯМкЁЯЗ║ЁЯЗ▓ЁЯТкЁЯП┐ЁЯМкЁЯЗиЁЯЗжЁЯТкЁЯП┐ЁЯМкЁЯЗмЁЯЗзЁЯТкЁЯП┐ЁЯМкЁЯЗ│ЁЯЗ┐,2020-11-30T00:26:05Z,1,0,,,,
Kanxa Kanxa,Ravish sir  love you for Nepal ЁЯЗ│ЁЯЗ╡ЁЯЗ│ЁЯЗ╡ЁЯе░ЁЯе░,2020-11-30T00:12:09Z,0,0,,,,
