Name,Comment,Time,Likes,Reply Count,Reply Author,Reply,Published,Updated
Mushtaque Alam,Bhadhuwa hai sala sata,2020-11-29T04:00:07Z,0,0,,,,
Anil Kumar,What is emergency,2020-11-29T03:52:51Z,1,0,,,,
Prabhakaran P K,"Thank you very much, Ravish for the excellent analysis which no one else has done so well. ЁЯСНЁЯСНЁЯСНтЭдя╕П",2020-11-29T03:27:07Z,2,0,,,,
Me and My jaan browny,The only channel I trust,2020-11-29T03:27:04Z,0,0,,,,
Ganesh Banerjee,&#39;рд░рд╛рд╖реНрдЯреНрд░рд╡рд╛рдЧреА&#39; рдорд┐рдбреАрдпрд╛ рдЗрддрдирд╛ рджрд┐рдорд╛рдЧ рдирд╣реАрдВ рд▓рдЧрд╛рддрд╛ !,2020-11-29T03:22:29Z,0,0,,,,
Ganesh Banerjee,Very informative. Thank you,2020-11-29T03:21:29Z,0,0,,,,
Vijay Meena,Dhali me police ne prdhushan jyada kr diya anshu ges ke golo se,2020-11-29T03:20:35Z,0,0,,,,
Me and My jaan browny,One and only true channel.,2020-11-29T03:05:25Z,0,0,,,,
Hemant Dhillon,Jhootha pm,2020-11-29T02:56:08Z,0,0,,,,
Roopa Bee,A mixed economy ensures a stress free economy. Pandering to the private sector at the cost of public systems already in place is foolishness. It reflects the complete incompetency of this government.,2020-11-29T02:49:03Z,0,0,,,,
Saba Saba,Supar,2020-11-29T02:41:58Z,0,0,,,,
jaspreet kaur,Shame on Indian government...  Just for the sake of fulfilling their own bags and benefits... Shame shame shame....,2020-11-29T02:21:03Z,0,0,,,,
BOND 707,INDIA SPRING.,2020-11-29T02:03:44Z,0,0,,,,
sagar fulkari,I am with farmers. They are absolutely right and sensible.,2020-11-29T01:58:11Z,0,0,,,,
Harbans Singh,"Hind Fascism.when donkey rules india they will abuse ethic,principles of demostcrats.chicken dance must end .",2020-11-29T01:41:52Z,0,0,,,,
ajaib singh,Aj bi jio Fire MIL rha ha KiaЁЯЩП,2020-11-29T01:32:32Z,0,0,,,,
Chanakya,Farmers should give ultimatam to the people of India that if Central Govt. do not take back the bills then they will grow only for there family only.,2020-11-29T01:02:22Z,0,0,,,,
anyWhere Hobby,"Ravish ji, aap Bihar prr research kariye Rohtash, Kaimur, Baxur, Bhojpur me mandiyan nhi hai to bhi wha prr Dalal ko hi bechte hai kisan.",2020-11-29T00:45:42Z,0,0,,,,
Nadeem khan Khan,Good morning Rabish sir,2020-11-29T00:26:23Z,0,0,,,,
shinder gill,thank you NDTV JI LOVE YOU,2020-11-29T00:22:32Z,0,0,,,,
Nadeem khan Khan,good morning all my kisan brother Ham sarkar se request kar rahe hain ki sarkar hamare kisan bhaiyon ki baat mane aur,2020-11-29T00:21:50Z,0,0,,,,
"live, Let live.",I am shocked to see these visuals.,2020-11-29T00:17:30Z,0,0,,,,
God's own Country cook Stephen,Kisan Kisan India labour India mothers India women India blind India Ambedkar India all all people help help help,2020-11-29T00:14:24Z,0,0,,,,
A khn,Join us Islam m,2020-11-29T00:05:47Z,0,0,,,,
jovanpreet singh,Khash ravish kumar jaise nek log bhartiye rajniti mein  bhi hon,2020-11-28T23:55:40Z,0,0,,,,
Raja lavlesh yadav,I love this channel,2020-11-28T23:43:48Z,0,0,,,,
Bhagwant Singh Manjpur,Thanks for covering Delhi protest,2020-11-28T23:05:07Z,1,0,,,,
dhillon gulshandeep singh,Very well explained ЁЯЩПЁЯП╜ЁЯСПЁЯП╜ЁЯСПЁЯП╜Great work team. ЁЯСНЁЯП╝,2020-11-28T23:04:04Z,2,0,,,,
ANSHUMAN ANAND,Excellent ravish sir.,2020-11-28T22:51:20Z,0,0,,,,
Yasin Butt,Jo ruck gy vo gadaar 100%Han,2020-11-28T22:32:01Z,0,0,,,,
Balvinder Gill,"Absolutely True: This is a problem of ALL Kissans in India, not just Punjabi, Haranvee and UP. But those 3, especially Punjabis are being used so that Govt. can say the problem is posed by these Punjabis especially .... It is to villify them, and DIVIDE and RULE. <br>ALL Kissans of India are AGAINST this Farming Act!",2020-11-28T21:58:03Z,0,0,,,,
jyotika j7,Arnab and Rebulic Bharat toh BJP ki chatne min laga hai .....farmers ka dukh nai dikhta kisi ko,2020-11-28T21:57:11Z,0,0,,,,
jyotika j7,NDTV thanks for supporting my framers!!!,2020-11-28T21:55:33Z,0,0,,,,
Tarun Panda,........<br><br><br><br><br><br><br><br><br><br><br><br><br><br><br><br><br><br><br><br><br><br><br><br><br><br><br>.,2020-11-28T21:52:03Z,0,0,,,,
Pulkit Raina,All facts are wrong. тЭдя╕ПDay ka journalist.,2020-11-28T21:44:21Z,0,2,,,,
,,,,,TerexGaming,тЭдday ki CENTRAL GOVT and тЭдday k andhbhakt,2020-11-28T22:05:04Z,2020-11-28T22:05:26Z
,,,,,Pulkit Raina,@TerexGaming jao gta khelo wo bhi pirated version kyunki asli waale ki tumhari aukaat nahi hai :) Aur haan. Dhood peena mat bhulna chomu :),2020-11-28T22:10:03Z,2020-11-28T22:10:03Z
Abhinav Gupta,"Taking advantage of COVID-19, Modi and his government has put this country under a pseudo emergency and taken so many hasty decisions without thinking about the impact. Anyone raising voice against the government&#39;s actions is labelled as anti national. What&#39;s even worse is their arrogance. They believe that whatever they&#39;re doing is in the nation&#39;s benefit when they&#39;re actually screwing up with every new policy. <br><br>But the government is not entirely to be blamed. Actually people of this country have become so blind and polarized that they cannot see the wrong doings of this government.",2020-11-28T20:03:16Z,0,0,,,,
Gurpreet Singh,"рдПрдХ рдмрд╛рдд рдФрд░ рднреА,,,,,, рдХрд┐ рдкрдВрдЬрд╛рдм рд╣рд░рд┐рдпрд╛рдгрд╛ рдореЗрдВ рдордВрдбреА рдмреЛрд░реНрдб рдмрдирд╛ рд╣реИ,,,,,, рдЬреЛ rural  development рдХрд╛ рдХрд╛рдо рдХрд░рддрд╛ рд╣реИ, рдЯреИрдХрд╕ рдЗрдХрдЯреНрдард╛ рдХрд░рддрд╛ рд╣реИ рдЖрдбрддреА рд╕реЗ,, рддреЛ рдЗрд╕ рдмрд╛рдд рдкрд░ рд╡реА рдЕрдкрдиреЗ рдмреАрдЪрд╛рд░ рджреЛ",2020-11-28T19:59:14Z,0,0,,,,
Rajeev Kumar,Protest silent aa voilent na karva dio<br>Jatt bund parr den ge,2020-11-28T19:26:57Z,0,0,,,,
Nash Jetmalot,Ravinch is Ch#@u Media,2020-11-28T19:22:18Z,0,0,,,,
Nash Jetmalot,Ravinch Kumar is Sonia&#39;s Pet<br>its all congressi pet<br>Modi is making India gr8,2020-11-28T19:21:59Z,0,1,,,,
,,,,,rupinder singh,"By Demonitisation, Giving 15 lakh, Making statues, kisan bills and many more to come ЁЯШВЁЯШВЁЯШВЁЯдгЁЯдгЁЯдгЁЯдгЁЯдг",2020-11-29T06:21:34Z,2020-11-29T06:21:34Z
bethevoice,Bina Bjp ko gaali diye kabhi neend aayi hai kya Ravish ji ЁЯШЕ,2020-11-28T19:21:27Z,1,1,,,,
,,,,,rupinder singh,Tuje modi ki chate bina nahi aatiЁЯШЫЁЯШВЁЯШВЁЯШВЁЯШВЁЯШВ,2020-11-29T06:07:32Z,2020-11-29T06:07:32Z
Puja Ravikumar,Are these shows available with English subtitles?,2020-11-28T18:56:52Z,0,0,,,,
Puja Ravikumar,Thanks very much Ravish sir. Your facts filled shows are enlightening.,2020-11-28T18:56:04Z,0,0,,,,
Ahtisham Khan,Ravish sir ki speech bohot influence karti h.,2020-11-28T18:45:13Z,0,0,,,,
Malik Sahab,Soon This Government Will Change The Name Of This Country From Hindustan To Modistan....ЁЯШВЁЯШВ,2020-11-28T18:36:55Z,0,0,,,,
Malik Sahab,Feel The Pain Of Kashmiri People Where All This Is A Daily Routine...,2020-11-28T18:35:42Z,20,1,,,,
,,,,,Amandeep Singh,They should stand for their rights ..no one will come for help them ..todayтАЩs only punjab is stand for their ri8 ..whole government is against us ..,2020-12-01T01:17:34Z,2020-12-01T01:17:34Z
gurdit josan,Kisaan majdoor ekta zindabaad ЁЯФеЁЯФеЁЯФеЁЯФеЁЯФе,2020-11-28T18:25:40Z,0,0,,,,
gurdit josan,"By lya kill midia kall ravish kumaar nhi vikea ,ЁЯЩПЁЯЩПЁЯЩП",2020-11-28T18:25:33Z,0,0,,,,
HARSHA B S,"If something congress would have done.... . .......Mere pyaare Desh wasiyon..... Sadakh, Sadakh me kisaanonko maare ja rahe hai..... Hey ma betheka  congress sarkar ko..... Bla bla bla",2020-11-28T18:12:08Z,0,0,,,,
Mohan Akela,Kisan hi jitega neta harega 5 mah agar kisan anaj sabji neta or polis ko bechna band kar de.. <br>Jai kisan jai kisan <br>Mai v kisan,2020-11-28T18:00:45Z,0,0,,,,
mustafa shakir,рдЪреБрдирд╛рд╡ рдЖрддреЗ рдЖрддреЗ рдорд╛рд╣реЛрд▓ рдлрд┐рд░ рд░рд╛рдо рдордВрджрд┐рд░ рдХрд╛ рд╣реЛрдЧрд╛ рд╕рдЪреНрдЪреЗ рдореБрджреНрджреЗ рдкреАрдЫреЗ рдЫреВрдЯ рдЬрд╛рдПрдБрдЧреЗ рдФрд░ рдлреЗрдВрдХреВ рдлрд┐рд░ рдкреНрд░рдзрд╛рдирдордВрддреНрд░реА рдмрди рдЬрд╛рдПрдЧрд╛... рдЕрд╕рд▓ рдореЗрдВ рд╣рд┐рдВрджреБрд╕реНрддрд╛рди рдореЗрдВ рд╣рд┐рдВрджреВ рдореБрд╕реНрд▓рд┐рдо рдХреА рддрд╛рджрд╛рдж рдЗрддрдиреА рдЬрд╝реНрдпрд╛рджрд╛ рдмрдврд╝ рдЧрдИ рд╣реЗ рдХрд┐ рд╣рд┐рдВрджреБрд╕реНрддрд╛рдиреА рдЕрд▓реНрдкрд╕рдВрдЦреНрдпрдХ рдореЗрдВ рдЖ рдЪреБрдХреЗ рд╣реЗ... рдЕрдм рддреЛ рдЬрд╛рдЧ рдЬрд╛рдУ,2020-11-28T17:55:45Z,0,0,,,,
amardeep alhan,"рдХреЗрд╕рд░реА рд╕рд╛рдлрд╛ рдмрд╛рдВрдзрдХрд░ рдХрд┐рд╕рд╛рди рд╕рд░рдХрд╛рд░ рдХреЗ рд╕рд╛рдордиреЗ рдЦрдбрд╝рд╛ рд╣реИ, рдХрд╣рд╛рдВ рдЧрдпрд╛ рд╡реЛ рдирдХрд▓реА рдЕрдХреНрд╖рдп рдХреБрдорд╛рд░ рдЬреЛ рдлрд░реНрдЬреА рдХреЗрд╕рд░реА рдкрд╣рди рдХреЗ рдЕрдкрдиреА рдлрд┐рд▓реНрдо &quot;рдХреЗрд╕рд░реА&quot; рд╣рд┐рдЯ рдХрд░рд╡рд╛ рдЧрдпрд╛ред",2020-11-28T17:53:53Z,2,0,,,,
Anshul joshi - khudrang music studio,I am amazed that you have put your reporters in places like dewas and badwani.... Nobody knows these places even exist. Kudos ЁЯСН,2020-11-28T17:53:11Z,1,0,,,,
Jabir Shaikh,Ndtv dekhne se gyan bhi badhta hi. Par bhakto ko kaha samjh. Jab dudh our moot m fark nahi kar pate.,2020-11-28T17:50:34Z,0,0,,,,
NCERT Point,Another reason I don&#39;t vote for him....,2020-11-28T17:49:30Z,1,0,,,,
Bimlesh singh,Andhbhakt log app thoda haha bhi apne logic se samarthan karo. Country is under emergency.,2020-11-28T17:48:54Z,0,0,,,,
angels 11,79 % Food is only comes from Punjab.what will happen if they only one year dont grow? Or dont sell?,2020-11-28T17:48:41Z,4,0,,,,
Jabir Shaikh,Not a police ye RSS K gunde bhare hi police k bhesh m,2020-11-28T17:35:49Z,0,0,,,,
BAPINA KUMAR BARAD,Aa gaya ghatia aadmi fake news dikhane or failane.,2020-11-28T17:33:57Z,0,0,,,,
Sital Das,Love u sir,2020-11-28T17:26:55Z,0,0,,,,
Raj Kumar,"Ravish ji , Lakin is trh pappu khan P.M. kaise banega ?",2020-11-28T17:26:31Z,0,1,,,,
,,,,,rupinder singh,Jaise Gappu Modi bn gyaЁЯШВЁЯШВЁЯШВЁЯШВЁЯШВ,2020-11-29T05:57:45Z,2020-11-29T05:57:45Z
Kanaka lata Hembram,"Modi: &quot;Na khud khaaoonga, na kisi ko khaane doonga.&quot;<br><br>Matlab, na khud khaana khaaoonga, na kisi aur ko khaana khaane doonga.",2020-11-28T17:20:39Z,1,0,,,,
HiMangla Sai,Kuch nhi yh sb political drama h,2020-11-28T17:19:31Z,0,0,,,,
mdansari kalim,Ye bjp rss sarkar Aatnkwadi sarkar hai,2020-11-28T17:19:31Z,0,0,,,,
Rajkumar Parida,Saheenbag two ki sazish.ЁЯдгЁЯШВ. CAA mein bola Muslim ka nagrikata Chala jayega detention camp mein dal diya jayega. Ab bola kisan ki zamin chala jayega MSP aur Mandi band ho jayega. Pahle se MSP par koi bill tha kya hoga. Logo ko Chutiya banana tou koi aap se sikheЁЯдгЁЯШВЁЯдг. <br>Ab  koi danga khalistani walo se nehi ho payega. ЁЯШб,2020-11-28T17:17:18Z,0,0,,,,
mdansari kalim,Ravish sir tushi garet ho super news jai hind jai kisan jai jawan jai kishan,2020-11-28T17:15:40Z,0,0,,,,
Jai Mrunal,Puri delhi ko bandhak bnana chahte hai tumhare so called kisan. Koi dikkat nhi hai hum kisano ko tum chutiya bna rhe ho.  Kahi bhi saman bech skte hai keval mandi me bechne ki jarurat nhi,2020-11-28T17:15:31Z,0,0,,,,
masuma hasan,Salaam from Karachi,2020-11-28T17:12:09Z,1,0,,,,
DMX,I am just finding andhbhakt<br>Now anyone want to argue,2020-11-28T17:10:40Z,4,0,,,,
Majid Mehmood,Ap bot achi reporting krty ha ma Pakistan sy ho or ma ap ke bato sy bot matasar hota ho ap jesy insano ke bot zayda zarorat ha is dunia ma,2020-11-28T17:06:37Z,1,0,,,,
Mr Manoj @manpreet,Good,2020-11-28T17:02:26Z,0,0,,,,
aarifboy,Modi is Gorbachev of India  lol,2020-11-28T17:00:21Z,0,0,,,,
Saurabh Sachan,рд╢рд╛рдирджрд╛рд░ рд╡рд┐рд╢реНрд▓реЗрд╖рдг рд░рд╡реАрд╢ рдЬреА,2020-11-28T16:56:13Z,0,0,,,,
ankur kundu,Real journalism,2020-11-28T16:50:28Z,0,0,,,,
Soumya Bhattacharya,Very sorry state of affairs. Modi sarkar is a complete failure on the economic front....,2020-11-28T16:39:48Z,0,0,,,,
Shashikant Chandel,Kisan andolan se sarkar ki antim yatra shoru hogaye,2020-11-28T16:33:45Z,0,0,,,,
Beena Patel,Farmers are hardworking  people but not rich and living<br>Very ordinary life .Industrialist are making heavy profits and living very lavish life at the cost of labours .many farmers and labours do not<br> have even enough food for their children! What kind of administration our country<br>Is having?why politicians are having very lavish life who are paid by our taxes?,2020-11-28T16:32:01Z,0,0,,,,
Kapil dev,there is no laathi charge,2020-11-28T16:29:59Z,0,0,,,,
Royal Creation,Modiji k raj me sirf 2 log ka saath aur 2 log ka vikas hua hy....,2020-11-28T16:22:04Z,0,0,,,,
CraneBox,Violence against non-violence... Shame on d current govt...,2020-11-28T16:12:33Z,0,0,,,,
Hira singh Hira Singh,ринри╛ри░рид риХри╛ ри╕рй▒риЪ риЪрйИриири▓ ри░ри╡рйАри╕ри╝ риХрйБриори╛ри░ римри╣рйБрид ри╣рйА ри╡ризрйАриЖ рикрй▒ридри░риХри╛ри░,2020-11-28T16:12:26Z,0,0,,,,
CraneBox,FARMERS HAVE SNATCHED THEIR RIGHTS BACK.... HATS OFF...,2020-11-28T16:10:20Z,0,0,,,,
ЁЭЧЬ ЁЯУЪ ЁЭЧжЁЭШБЁЭШВЁЭЧ▒ЁЭШЖ,Jab Netaaon log Election Time Parchaar kerti hai us samay.... Uski paas tear gas ka bomb ЁЯТг nahi.... Cylinder heen khol do... ЁЯШТЁЯШТЁЯШТЁЯШТЁЯШТ,2020-11-28T16:10:07Z,1,0,,,,
Suriya Kumar,"Middle man is also an important link between farmers and market. By vilifying middle man govt. is trying to favour corpoates! Is it a wise step? If there are issues with middle man system, that must be addressed. Instead govt. is trying to eliminate the entire system. Even the Corporates will be the new middle man in the new system but with a stronger hand where small farmer will have no say. Farmers will be at the mercy of corporates. What has happened to US farmers is a clear example! Govt&#39;s intent is also highly questionable especially when we look at  past statements of FM &amp; PM and the way these laws were passed in the Parliament, agri minister not even bothering to meet farmers during last meeting, treatment meted out to the TN farmers when they were in capital earlier and the treatment that Punjab farmers are receiving now strengthens the argument that this govt. is working in the interest of corporates. Is this the Sabke Saath Sabka Vikas of Mr. Modi?",2020-11-28T15:54:31Z,0,0,,,,
Khalsa Spartan,A 22 yr old soldier son from Punjab martyred on LOC while his farmer father is fighting just battle in delhi....may god bless these brave hearts....RIP salute,2020-11-28T15:50:47Z,4,0,,,,
Chanda Devi,"The farmers deserve the love and respect.<br>Without the farmers, there will be nothing to eat and drink",2020-11-28T15:44:58Z,1,1,,,,
,,,,,Smilling Budhha,"@Abhi the traveler┬а Ye kya logic hai?? Fir Punjab ke kisan kisi aur state me bani pumping set, fertilizer,seeds, pesticides ka use kare bina kheti kare. Aur kisaan bhi ek business man hai baaki business ki tarah. Koi ehsaan nahi karte hai kheti karke. Free me anaaj nahi bechte , jaise baaki business apna product bechte hai waise ye kisaan bhi bechte hai. Koi desh seva ke liye kaam nahi kar rahe ye. Aur government aur tax payer ne inhe bht facilities di hai, no income tax on farm income, subsidised electricity, subsidised irrigation system, subsidised fertilizer and seeds. Har saal hazaro caroro ka loan maaf hota hai inka. Kuchh jyada hi sar chadha rakha hai in kisaano ko.",2020-11-29T17:40:34Z,2020-11-29T17:40:34Z
Journey by,@bbcnews,2020-11-28T15:36:41Z,0,0,,,,
POKEMON UNIVERSE,Lekin vote hindu muslim card<br>Mandir masjid card kar hi dega<br>To ye to hoga hi na,2020-11-28T15:34:44Z,0,0,,,,
Suriya Kumar,This is the Achche Din of PM Modi and Sabka Saath Sabka Vikas! He will once again come to Punjab and Haryana asking for their votes!,2020-11-28T15:31:43Z,0,0,,,,
Lalatendu Samantasinghar,"Ye modi ko - ganit malum he?....sab ko faiyda he to (farmer,  agent, broker).... Nuksan kis ko  ?  Sab ko fayda  ta mathematically impossible....?  Modi will be next nobel winner for new mathematical firmula.... Sab ko fayada.....",2020-11-28T15:30:34Z,0,0,,,,
vivek3411,"if comments are real, who votes for BJP",2020-11-28T15:00:04Z,0,0,,,,
Sarbjeet Singh,ЁЯСНЁЯСН,2020-11-28T14:46:06Z,0,0,,,,
dpremi1126,рджреЗрд╢ рдХреЗ 40 рдмрд┐рдХреЗ рд╣реБрдП рдЪреИрдирд▓ рд░реЛрдЬрд╛рдирд╛ 24 рдШрдВрдЯреЗ рдЬреБрдорд▓реЗрдмрд╛рдЬ рдЭреВрдареЗ рдордХреНрдХрд╛рд░  рдФрд░ рдкрд╛рдЦрдВрдбреА рдореЛрджреА рдХреА рджрд▓рд╛рд▓реА рдХрд░рддреЗ рд╣реЛ рдЙрд╕ рджреЗрд╢ рдХреА рдЬрдирддрд╛ рдХреЛ рд╕рдЪ рдХрд╣рд╛ рд╕реБрдирд╛рдПрдВрдЧреЗ рдпрд╣ рд▓реЛрдЧ рдХрд┐рд╕рд╛рдиреЛрдВ рдХреЛ рднреА рдмрджрдирд╛рдо рдХрд░ рд░рд╣реЗ рд╣реИрдВ рдХрд┐рд╕рд╛рдиреЛрдВ рдХреЛ рдЖрддрдВрдХрд╡рд╛рджреА рдХрд╣рдиреЗ рд╡рд╛рд▓реЗ рдЗрди рдЭреВрдареЗ рдмрджрдорд╛рд╢ рдЪреИрдирд▓ рд╡рд╛рд▓реЛрдВ рдХреЛ рд╣реА рдЬрдирддрд╛ рдЬрдирддрд╛ рдзреБрд▓рд╛рдИ рдХрд░ рджреЗ рдХреВрдЯ рджреЗ рддрднреА рдпрд╣ рд╕реБрдзрд░реЗрдВрдЧреЗ рдЕрдм рд╣рдж рд╕реЗ рдЬреНрдпрд╛рджрд╛ рд╣реЛ рдЪреБрдХрд╛,2020-11-28T14:44:24Z,0,0,,,,
Gurmeet Singh,Ravish sar 100yarsh g,2020-11-28T14:30:55Z,0,0,,,,
MR. INDIA,"Jai jawan, jai kisan",2020-11-28T14:27:18Z,0,0,,,,
Harmandeep Singh,Despite all this how bjp is winning constantly??,2020-11-28T14:23:39Z,0,1,,,,
,,,,,Baidurjya Duarah,Poverty of brain,2020-11-30T05:18:01Z,2020-11-30T05:18:01Z
Exam World,Jab bsnl tha jio ka rate 299 that<br>Bsnl khatam jio ka rate 599<br>Maja lo private ka,2020-11-28T14:21:21Z,1,0,,,,
Exam World,Are haidrabad me election ba,2020-11-28T14:20:20Z,0,1,,,,
,,,,,Misbah Shaikh,рдпреЛрдЧрд┐рдпрд╛ рдирд╛рдо рдЪреЗрдВрдЬ рдХрд░рдиреЗ рдЧрдпрд╛ рд╣реИ рд╣реИрджрд░рд╛рдмрд╛рдж рдмрдЪрд╛рдУЁЯШЬЁЯШЬЁЯШЫ,2020-11-29T19:03:24Z,2020-11-29T19:03:24Z
Amarjit Singh Dhesi,"Salute Sir, I wish another channel were also transparent like your news.  Jai Kisan,",2020-11-28T13:28:57Z,0,0,,,,
Sabir Ali,I don&#39;t think why government ignore farmers major issue ? remember...<br>&quot;Jai Jawan Jai Kisan&quot;,2020-11-28T13:14:56Z,1,0,,,,
Prabhjot Waraich,ризрй░риири╡ри╛риж ри╕ри╛рибрйАриЕри╛ риорйБри╢риХри┐ри▓ри╛риВ ри▓рйЛриХри╛риВ риЕрй▒риЧрйЗ ри░рй▒риЦриг ри▓риИ,2020-11-28T13:01:38Z,0,0,,,,
Shashikant Sarate,"рдирд┐рдЬреА рдордВрдбрд┐рдпрд╛ рд╕реЗ ,  1- 2 рд╕рд╛рд▓ рдХреЗ рдмрд╛рдж рдирдЬрд░ рдЖрдиреЗ рд╡рд╛рд▓реА рдмрд░рдмрд╛рджреА рдХреЛ рдпрд╛рдиреЗ рд╕реНрд▓реЛ рдкреЙрдпрдЬрди рдХреЛ рд░реЛрдХрдирд╛ рдЪрд╛рд╣рд┐рдПред",2020-11-28T11:57:48Z,1,0,,,,
RAMESH YADAV,рдХреЛрд░реЛрдирд╛ рднреА рдПрдХ рдЬреБрдорд▓рд╛ рд╣реИ рдЬрдп рдЬрд╡рд╛рди рдЬрдп рдХрд┐рд╕рд╛рди рдЬрд╛рдЧрд░реВрдХ рдЧреНрд░рд╛рдореАрдг рдЬрд╛рдЧреЛ рднрд╛рд░рддрд╡рд╛рд╕рд┐рдпреЛрдВ рдЬрд╛рдЧреЛ рдПрдХрддрд╛ рдЬрд╛рдЧрд░реВрдХ рдЧреНрд░рд╛рдореАрдг рдЬрд╛рдЧреЛ рдХ,2020-11-28T11:11:42Z,2,0,,,,
larev khan,"Baat to sahi he esliye Kerala, Karnataka or maharashtra ke kisan Delhi nhi aae ЁЯШБЁЯРТЁЯШБ",2020-11-28T10:54:54Z,0,0,,,,
Abdur Rahim,Khushboo ko phalne ka bada shauk hay magar.                       Mumkin nahi hayhawaon se rishta key bagaer.,2020-11-28T10:44:03Z,0,0,,,,
A. H Sait,Kissan bhaiya ko rasthe pe chod kar   vaccine lene  nata log Hydrabad bhage hai kam se kam Eshwar se tho daro.<br>Eshwar ki laddi koi rok nahi sakta. <br>Too sad nothing to say more than tears my self for kissan brothers.<br>Today thay are nowhere,2020-11-28T10:10:37Z,0,0,,,,
A. H Sait,Kissan ayatho corona ayega. Abhi e jo bheed Telungana me jami hui hai ise corona nahi ayega ?<br>Kya sab log farishtge hai ?,2020-11-28T10:06:08Z,0,0,,,,
Amjad Ali,рдордереБрд░рд╛ рдореЗрдВ рдХрд┐рд╕рд╛рдиреЛрдВ рдХрд╛ рдлрд╝рд╕рд▓ рдХрд╛рдЯрдиреЗ рд╡рд╛рд▓реА рд╣реЗрдорд╛ рдорд╛рд▓рд┐рди рдЖрдЬ рдХрд┐рд╕рд╛рдиреЛрдВ рдХреЗ рд╕рд╛рде рдХреНрдпреВрдВ рдирд╣реАрдВ рд╣реИ?,2020-11-28T09:52:24Z,1,0,,,,
Nps Ichhpurani,Kya Dukaandar MRP nahi bechade,2020-11-28T09:32:29Z,0,0,,,,
Amit yadav rajgir Rajgir,рд╕рдЪреНрдЪреА рдкрддреНрд░рдХрд╛рд░рд┐рддрд╛,2020-11-28T08:00:37Z,0,0,,,,
Ravi sharma,рдмрдХрдЪреЛрджреА рд░рд╡рд┐рд╢,2020-11-28T07:56:02Z,1,0,,,,
Sarfaraznawaz Naikodi,Jo sabko  khana khilate hein.kisano ki yeh halat.modi murdabad.,2020-11-28T07:55:39Z,0,0,,,,
Prince Khan,"Ravish Bhai, BJP ka antt kab hoga?",2020-11-28T07:55:04Z,0,0,,,,
kisan. kisan zindabad,Bawcharon k sangh tufan arrahey hain..<br>Aie Delhi zara himmat zuta..<br>Apna haq leyne kisan aarahein hain. <br>Jai  ho anney data ki,2020-11-28T07:50:01Z,0,0,,,,
MD TAHIR,Bahut chutiya modi hai,2020-11-28T06:08:06Z,0,0,,,,
cricket with juber,"рдпреЗ рдЬреЛ рдХрд╛рдиреВрди рдмрдирд╛ рд╣реИ рдирдпрд╛ рдХреГрд╖рд┐ рд╡рд╛рд▓рд╛ рд╣реИред рдпреЗ рдореЛрджреА рдЕрдкрдиреЗ рдХреЙрд░реНрдкреЛрд░реЗрдЯ рджреЛрд╕реНрддреЛрдВ рдХреЛ рдлрд╛рдпрджрд╛ рдкрд╣реБрдБрдЪрд╛рдиреЗ рдХреЗ рд▓рд┐рдП рдмрдирд╛рдпрд╛ред рд╣реИ рдХреНрдпреЛрдВрдХрд┐ рдореЛрджреА, рдФрд░, рднрд╛рдЬрдкрд╛, рдХреЛ, рдлрдВрдбрд┐рдВрдЧ рдХреМрди рдХрд░рддрд╛, рд╣реИред рдпрд╣реА рдмрдбрд╝реЗ рдмрдбрд╝реЗ рдЙрджреНрдпреЛрдЧрдкрддрд┐ рдХрд░рддреЗ рд╣реИрдВ рдФрд░, рдпреЗ рдЙрд╕реА рддрд░реАрдХрд╛, рд╕реЗ, рд╣реИ рдЬреИрд╕реЗ рдУрд▓рд╛ рдФрд░ рдЙрдмрд░, рдиреЗ, рд▓реЛрдЧреЛрдВ, рдХреЛ рдардЧрд╛ред рдкрд╣рд▓реЗ рддреЛ рдбреНрд░рд╛рдЗрд╡рд░реЛрдВ, рдХреЛ, рд▓рд▓рдЪрд╛рдИ рдмрд╣реБрдд рдкреИрд╕рд╛, рджрд┐рдпрд╛, рдЕрдЬрдм рдбреНрд░рд╛рдЗрд╡рд░ рдЕрдкрдиреА рдЧрд╛рдбрд╝рд┐рдпрд╛рдВ рд▓реЗрдХреЗ рдЖ рдЧрдП рд░реЛрдб рдкрд░ рддрдм рдЖрдЬ рднреВрдЦреЗ рдорд░ рд░рд╣реЗред рд╣реИрдВред рдЗрд╕реА рддрд░рд╣ рдХрд┐рд╕рд╛рдиреЛрдВ, рдХреЗ, рд╕рд╛рде, рднреА, рд╣реИ, рдмрдбрд╝реА рдмрдбрд╝реА рдХрдмрд░реЗрдЯ рдХрдореНрдкрдирд┐рдпрд╛рдБ рдХрд░реЗрдВрдЧреАред",2020-11-28T05:58:49Z,1,0,,,,
Jhon,God bless you ravish bhai...100 sal jiyo,2020-11-28T05:49:11Z,0,0,,,,
