Name,Comment,Time,Likes,Reply Count,Reply Author,Reply,Published,Updated
,,,,,harjot singh,@well wisher hn bhai hum chor hai saal ka 60 70 hajar chori krke bana lete the mehnat se isme se bhi government ko dete to bhi bhuke marna tha ab bhi marr rahe hai...hum chor anti nationals k sath to sahi ho rha hai? maante hai aap?,2020-12-04T23:03:10Z,2020-12-04T23:06:32Z
,,,,,harjot singh,@well wisher modi promised us new jobs and we are not seeing any jobs bro instead our jobs been taken away from us and everything is privatised. i hope modi ji will do something for us,2020-12-04T23:34:00Z,2020-12-04T23:34:00Z
Shyam Menawat,рдЖрдЬ рджреЗрд╢ рдХреЛ рдХрд┐рд╕ рд╣рд╛рд▓рдд рдореЗрдВ рдкрд╣реБрдЪрд╛ рджрд┐рдпрд╛ рд╣реИ рдХрд┐рд╕рд╛рдиреЛрдВ рдХреЗ рдмреЗрдЯреЗ рд╣реА рдХрд┐рд╕рд╛рдиреЛрдВ рдХреЛ рдорд╛рд░ рд░рд╣реЗ рд╣реИрдВ рдХреБрдЫ рд╕реЛрдЪрд╛ рд╕рдордЭрд╛рдпрд╛ рдирд╣реАрдВ рдЬрд╛ рд░рд╣рд╛ рд╣реИ рджреЗрд╢ рдореЗрдВ рд╕рд░рдХрд╛рд░ рдирд╣реАрдВ рдРрд╕рд╛ рд▓рдЧрддрд╛ рд╣реИ рдЧреБрдВрдбреЛрдВ рдХрд╛ рд░рд╛рдЬ рд╣реЛ рдЧрдпрд╛ рд╣реИ рдЕрдм рджреЗрд╢ рдореЗ рдлрд┐рд░ рд╕реЗ рднрдЧрдд рд╕рд┐рдВрд╣ рдЬреЗрд╕реЗ рд╢реЗрд░реЛрдВ рдХреЛ рдЬрдЧрд╛рдирд╛ рд╣реЛрдЧрд╛ рдЬреЛ рдЧреБрдВрдбреЛрдВ рдХреЛ рдмреЛрд▓реА рдХреА рдирд╣реАрдВ рдЧреЛрд▓реА рдХреА рднрд╛рд╖рд╛ рд╕рдордЭрд╛рдП рдЬрдп рд╣рд┐рдВрдж рдЬрдп рдХрд┐рд╕рд╛рди,2020-11-27T20:33:51Z,0,0,,,,
kumar fotographer,рдХрд╣рд╛рдВ рд╣реИ рдЖрдЬ рдирдХрд▓реА рдкрдВрдЬрд╛рдмреА рдзрд░реНрдореЗрдВрджреНрд░ рдЕрдХреНрд╖рдп рдХреБрдорд╛рд░ рд╕рдиреА рджреЗрдУрд▓ред<br>рдЬрд┐рдиреНрд╣реЛрдВрдиреЗ рдЕрдЪреНрдЫрд╛ рдЦрд╛рд╕рд╛ рдкрдВрдЬрд╛рдмреА рд▓реЛрдЧреЛрдВ рдХреЛ рдмреЗрд╡рдХреВрдл рдмрдирд╛рдпрд╛ред рдЕрдХреНрд╖рдп рдХреБрдорд╛рд░ рдХреЛ рдпрд╣ рдирд╣реАрдВ рдкрддрд╛ рдХрд┐ рдЖрдо рдХреИрд╕реЗ рдЦрд╛рдП рдЬрд╛рддреЗ рд╣реИрдВ? рдФрд░ рд╕рдиреА рджреЗрдУрд▓ рдХрд╛ рдврд╛рдИ рдХрд┐рд▓реЛ рдХрд╛ рд╣рд╛рде рд╕рд┐рд░реНрдл рдкрд┐рдЫрд╡рд╛рдбрд╝рд╛ рдзреЛрдиреЗ рдХреЗ рд▓рд┐рдП рд╣реИред<br>рдФрд░ рдзрд░реНрдореЗрдВрджреНрд░ рдХрд╛ рддреЛ рдЖрдЬ рддрдХ рдкрддрд╛ рдирд╣реАрдВ рдЪрд▓рд╛ рдХрд┐ рдЙрдиреНрд╣реЛрдВрдиреЗ рдкрдВрдЬрд╛рдм рдХреЗ рд▓рд┐рдП рдХреНрдпрд╛ рдХрд┐рдпрд╛ рд╣реИ?,2020-11-27T20:28:06Z,0,0,,,,
Manilal Shah,"Why should only Farmers have to Protest, why not whole country. You are divided country, if it dos not concern we, I do not have to care. If Goernment deicde to privatise the Railways,<br>there is no opposition except  from people who are working in Railways they protest. but not general public as it does not concern them as if they are living in different country. Whe it is pravitised<br>and fares are increased every year  far more above inflation, then they will complain. Complain to whom, Government does not own it, and private companies ill not listen. People are digging their own grave..<br><br>Manilal Shah",2020-11-27T20:20:16Z,1,0,,,,
Mohd raza,Jai kisan des ki janta kisan ki maded karna chahiye modi chor atankwadi h ye des ko gulam bana raha h ye kisan jo delhi ana chahite h kai ye pakistan se h jo police dalal ye lathi water asuges chala rahi h,2020-11-27T20:18:14Z,0,0,,,,
rajesh kumar gupta,My favourite channel because this channel always truth,2020-11-27T20:11:54Z,0,0,,,,
Priyanshu Agarwal,In sab k bachhe canada Australia mein corporates mein hi job krte h pr yaha corporate nahi chaiyye,2020-11-27T20:09:29Z,1,0,,,,
Jaya Raveendran,Sarkaar ka dimaag ghamand se kharaab ho gaya hai....waqt badalte der nahi lagti...,2020-11-27T20:00:46Z,2,0,,,,
Nikhil Pant,who all used to abuse ravish before and now they think  think heтАЩs the only real journalist in india??,2020-11-27T19:56:42Z,47,0,,,,
s Y,Sala sab log virodh karta farmer   Student poor phir bhi chunaw me jit jata hai madhar chod kuch to desh me lafra chal raha,2020-11-27T19:56:14Z,1,0,,,,
Zayda Parween,Nic rawis sir,2020-11-27T19:55:35Z,1,0,,,,
s Y,Sala sab field me private kar cruption ke aag me dal diya hai,2020-11-27T19:54:11Z,1,0,,,,
s Y,Sahi mudda par bat nahi kart modi aur sar Yogi sar amit shah aur love jihad Khali khata,2020-11-27T19:52:39Z,1,0,,,,
MAHASIN RAHAMAN,Karte raho Hindu Musalman!!,2020-11-27T19:50:37Z,0,0,,,,
s Y,Sala hum aalu upjate hai to 4-5kg bechte hai aaj ghar me aalu nahi to mandi se 50 rupees khardit hai hum puchhte modi madher chode se ye kya chal raha raha desh me,2020-11-27T19:50:13Z,1,0,,,,
Hasi Mazak,"Please all stand for EVM Ban,save our democratic ,so that this cowdung never win again",2020-11-27T19:48:23Z,1,0,,,,
Mohammad Imran,Yeh kisan nhi h yeh haal pore desh ka hoga ane wale samy m,2020-11-27T19:45:08Z,0,0,,,,
NAUSHAD KHAN,Right sir,2020-11-27T19:42:13Z,0,0,,,,
The Mahesh,Shame on government...,2020-11-27T19:41:38Z,0,0,,,,
Yogi Jian,Where is Anna Hazare now?,2020-11-27T19:41:19Z,7,0,,,,
Kiritkumar Padhiar,"Namaskar Ravish Kumar ji, ....Ye,,, Kya  JINDGI  Hai ....Ye...Kaisa  Jaha.....Hai..Jidhar  Dekhiye JULM  Ki DASTA.....Hai.XXXHuch  Chand Bade  Udiyog Patiyo  ke  hatho  meKishano  ki  MEHNAT  OWNE-<del>-POWNE ya AADHE Damo me AARAM  Se  Mil  jay Ye Muhim BJP,Sarkar  chala  Rahi  hai.Aisa  Ravish ji ki bato  ka  es  Aaj ke prime Time  sho me  Dikhaya  hai. Jo 100%  Satya  Hai.DESH  KE  KISHANO KA, OUR MEHNATI  KHETI VADI Kar ne  vaale  logo  ka GAMBHIR  MUDDA  Hai XXXXX.Muthi Bhar  Chand  Udyog Ptiyo  Ke Bhale  Ke Liye BJP SarkarHajaro</del> Lakho  Rupyo  ka Pani ker ke Sena,our Police Ki BarBarta our Damanatmak Karvai Kishano ko KHADED Ne  ke Liye ho rahi  hai  jo Ati NINDA Ki  Bat  hai,XXXX Sarkar Lok sabha me jyda  BAHUMAT Me  hai To  kya Apne Desh  ke kishano ko Dushman samaj rahi hai  KYA????GODI MEDIAS To  Sarkar Ke Hath SALE  Biki Hui  Hai.xxxxx.DESH  KA Naseeb Thoda  Achha  hai. ki ND TV. Jaisa Strong  News Channel  Abhi  Tak to  Hai*****Dhanyavad  Pragat  Karta Hu..Jai Dree Krishna. JAIHIND.",2020-11-27T19:39:19Z,0,0,,,,
Ayub Khan,Jai kissan jai bhim jai hind ЁЯЗоЁЯЗ│,2020-11-27T19:37:33Z,2,0,,,,
Nawal kishore Mundra,Ravishkumar aaj tera aana ka beta ko nitish na bahut thukai ki vidhan sabha ma kisan ko tyagkar tejaswi ka dhyan rakhi nahi to retirement ka baad Mic ya rajyasabha nahi milagi,2020-11-27T19:37:16Z,1,0,,,,
mice thethaidmc,Ravish Sir тЭдя╕П,2020-11-27T19:35:30Z,3,0,,,,
Nawal kishore Mundra,This clip file is working overtime todayhowever will go waste as communist channel will not give overtime and he cannot make programme on this in desh ka baat to survive,2020-11-27T19:33:29Z,0,0,,,,
Zaba Omer,best report but Pls don&#39;t use words like other Chanel use (hamara chanal par sab say pahala),2020-11-27T19:32:41Z,1,0,,,,
Yunus Sareshwala,This is called true reporting <br>Salute you and your team<br>Well done sir ji <br>Keep it up,2020-11-27T19:31:15Z,21,0,,,,
Bikash Ngurang,Laro murderchot MODI tora to saram karo kisan ka taklip tume dekai nahe deraha. Bihar ki bihari log bi kam nahe Aur jitao BJP ko maja aaraha hoga abto aur b ajche din aane bala hai. Abi tho jak jao desh Baseo. Thank you Ravish sir for the truth may god bless you.         <br> ! Long live India ! Jai hind !,2020-11-27T19:30:30Z,0,0,,,,
M I J,2014 рд╕реЗ рджреЗрд╢ рдХреЛ рдкрдиреЛрддреА рд▓рдЧреА рд╣ рдЕрдм рдкреБрд░рд╛ рджреЗрд╢ рдкреНрд░реЗрд╢рд╛рди рд╣ рдЬрдп рднрд╛рд░рдд,2020-11-27T19:30:07Z,10,0,,,,
Simar Chhoker,Ye punjabi hai Twitter pe hastag trend krne wale nahi hai,2020-11-27T19:29:26Z,2,0,,,,
Anil Chouhan,ЁЯМ╖ЁЯМ╖ЁЯМ╖ЁЯМ╖ЁЯМ╖ЁЯМ╖ЁЯЩПЁЯЩПЁЯЩПЁЯЩПЁЯЩПЁЯЩПЁЯЩПЁЯЩПЁЯЩПЁЯЩП,2020-11-27T19:28:48Z,0,0,,,,
SUBHASH CHAND,"<b>рдпрд╣рд╛рдВ рддреЛ POK, LOC рдУрд░ LAC рд╕реЗ рдЬрд╛рдпрджрд╛ рд╕рд┐рдХреНрдпреЛрд░рд┐рдЯреА рджрд┐рд▓реНрд▓реА рдореЗрдВ рд▓рдЧрд╛ рджрд┐рдпрд╛ рдЧрдпрд╛ рд╣реИ ред рд╕рд░рдХрд╛рд░ рддрд╛рдирд╛рд╢рд╛рд╣реА рдореЗрдВ рддреЛ рдЕрдВрдЧреНрд░реЗрдЬреЛ рдХреА рдмрд╛рдк рдирд┐рдХрд▓реА....</b>",2020-11-27T19:25:44Z,19,0,,,,
karan prashar,Kerala govt is best,2020-11-27T19:24:31Z,0,0,,,,
Yunus Sareshwala,Kill them they are khalistani anti nationalists <br>RSS and BJP people thinking about this<br>Don&#39;t worry we are living in democratic country,2020-11-27T19:23:42Z,0,0,,,,
nimar deep,Asi tan London ja k gora marta c.. eh tan fr v apna hakk lena hai..,2020-11-27T19:23:11Z,0,0,,,,
Rashedur Rahman Javed,Real journalist Ravish Kumar. proud of Indian people&#39;s,2020-11-27T19:21:27Z,0,0,,,,
Samarjot Singh,I think the word &#39;allowed to enter&#39; is not appropriate. The farmers have forcibly entered and now government is acting as if they are doing a favor to farmers by allowing them to enter.,2020-11-27T19:20:33Z,2,0,,,,
aamir,Only anchor who cares to correct his facts tho it doesn&#39;t change much still he cares to correct,2020-11-27T19:19:57Z,0,0,,,,
Shubham Singh,Being a residence of Burari I will be very proud to welcome farmers on our land and I support them,2020-11-27T19:19:47Z,18,3,,,,
,,,,,Gurnoor Singh,Thanks bro,2020-11-28T04:04:24Z,2020-11-28T04:04:24Z
,,,,,Gurwinder Kaur,Thank you,2020-11-29T00:58:49Z,2020-11-29T00:58:49Z
,,,,,Parvinder Mann,Thanks bhai,2020-11-30T14:31:47Z,2020-11-30T14:31:47Z
Mukeem Masoori,Kisan Bhai hamare desh ka Hero hai ЁЯЗоЁЯЗ│<br>Kisan Bhaiyo ka  Waje se kitna Gareeb saste mein khana khata hai ЁЯШн,2020-11-27T19:19:31Z,0,0,,,,
5JSG,"Modi thinks he is a dictator or has no idea what a constitution is. In a democracy, Protesting is allowed. He could not do anything to Pakistan or China, Now he is attacking his own people. Just by growing a long beard does not make you a man LOL.",2020-11-27T19:17:21Z,1,0,,,,
Kaleem Ansari,Great Ravish Kumar sir,2020-11-27T19:16:33Z,0,0,,,,
Shaswat Agarwal,Abe yar COST ko MSP bana do no one can buy below cost for all private ko par koi solution nahi dega sab bakchodi krege,2020-11-27T19:16:31Z,0,0,,,,
Phurpa Tsering,KyAe haal kardiyee bjp ke sasaan mae,2020-11-27T19:16:21Z,0,0,,,,
Mehnu Revolution.,"Imagine if the students, farmers, labourers, intellectuals, activists, women and minorities join hands in this protest.... That would be the strongest тЭдя╕П",2020-11-27T19:13:55Z,59,18,,,,
,,,,,Praful Padlamwar,"Kitni bhee koshish kar lo,par tumse na ho payega.",2020-11-28T02:51:06Z,2020-11-28T02:51:06Z
,,,,,Harwinder singh,@Praful Padlamwar modi bhakt chultiyaЁЯдг,2020-11-28T13:42:52Z,2020-11-28T13:42:52Z
,,,,,Praful Padlamwar,"@Harwinder singh lagta hai,tum log same comment copy paste kar deto ho.kabhi to apne dimag ka estemal kar ke comment karne ki koshish karo.",2020-11-28T13:49:21Z,2020-11-28T13:49:21Z
,,,,,Jai Mrunal,Desh todo tum sab kamino,2020-11-28T17:13:13Z,2020-11-28T17:13:13Z
,,,,,Harwinder singh,@Praful Padlamwar chutiya is chutiya,2020-11-28T17:39:16Z,2020-11-28T17:39:16Z
,,,,,Praful Padlamwar,@Harwinder singh koun tu.bilkul sahi pahachana apne aap ko.,2020-11-28T17:43:06Z,2020-11-28T17:43:06Z
,,,,,Harwinder singh,@Praful Padlamwar hahahaha modi bhakt ЁЯдгЁЯдг<br>15 lakh aaye aacount mein,2020-11-28T17:49:19Z,2020-11-28T17:50:25Z
,,,,,Harwinder singh,22 tere pe dya aati hai<br>Tera bhi chutiya kt raha hai lekin<br>Tu fr bhi sath de raha hai modi ka,2020-11-28T17:49:52Z,2020-11-28T17:50:15Z
,,,,,Praful Padlamwar,@Harwinder singh kyunn kaise lagta hai tera chutiya cut chuka hai.,2020-11-28T17:53:44Z,2020-11-28T17:53:44Z
,,,,,Harwinder singh,@Praful Padlamwar haha tere ko bura kyo lgta<br>Mere ko to lga bhai <br>Tu insaan ni kya,2020-11-28T17:59:19Z,2020-11-28T17:59:19Z
,,,,,Gaming All the time,@Praful Padlamwar andh bhakt spotted,2020-11-28T18:11:17Z,2020-11-28T18:11:17Z
,,,,,Praful Padlamwar,@Gaming All the time bas copy paste karte raho.kabhi to apna dimag laga kar comment kiya karo.,2020-11-28T18:13:57Z,2020-11-28T18:13:57Z
,,,,,Gaming All the time,@Praful Padlamwar bhak ko kitna bhi bataiye faida to kuch hoga nahi atleast dusre log to bach jayege pagalo ko reply karnese,2020-11-28T18:19:36Z,2020-11-28T18:19:36Z
,,,,,Sukhdeep Singh,@Praful Padlamwar take your pills bro otherwise you will be braindead,2020-11-29T07:57:14Z,2020-11-29T07:57:14Z
,,,,,Praful Padlamwar,@Sukhdeep Singh borrow someone&#39;s mind because you have no mind.,2020-11-29T08:23:13Z,2020-11-29T08:23:13Z
,,,,,Toronto Guy,"@Praful Padlamwar use your mind. These bills had been passed in bihar. Look at them, they are doing labor work in most of other states. They were promised for Msp too but they were never paid. Same thing will happen to other states. They would have to work as slaves too.",2020-11-29T11:10:20Z,2020-11-29T11:10:20Z
,,,,,Merriam Webster,"@Praful Padlamwar itihaas badlingay,,",2020-11-29T17:04:26Z,2020-11-29T17:04:26Z
,,,,,Syed Murtaza,Good yar,2020-11-29T21:51:53Z,2020-11-29T21:51:53Z
Mazhar zamir Rabbani,"No employment no business n trade in pause mode.  GDP down in minus,  farmers r suffering n many hav commited suicide. govt cannot handle Corrona pandemic. People of india r worried what next. But who is voting bjp?.",2020-11-27T19:11:32Z,2,0,,,,
Vishal Vyas,Thank you sirЁЯЩП,2020-11-27T19:11:14Z,0,0,,,,
TAKE CARE 10,ЁЯЩПЁЯЩПЁЯЩП,2020-11-27T19:10:33Z,0,0,,,,
Pratham News,"Sir , good job, keep it up till all bhakts get some sensibility...",2020-11-27T19:07:02Z,5,0,,,,
sharib khan khan,great Prime Time news,2020-11-27T19:05:41Z,1,0,,,,
Pratyaksh Bhatt,"If we are so much about this farmers by just tweeting and sharing our thoughts,the  real work we need to do is we have to come up and protest but sadly we will never do it.... <br>Why ??????<br>Coz our rights of opinions and speech is been crushed by the governing bodies and that is too sad <br>I would say why not we can use hongkong model for protest?????",2020-11-27T19:05:15Z,1,0,,,,
Vikky Sahota,Thank you ndtv and thank ravish ji and all reporters who cover farmers protest thank you again ЁЯЩПЁЯЩП,2020-11-27T19:05:09Z,17,0,,,,
Jack and hug OR val OR M OR gulis,Ye naya kanoon jio sim card jaise suruvaat mein free mein baat rahe the usi tarah hai baki samajhdaar ko ishara kafi hai...,2020-11-27T19:03:29Z,7,1,,,,
,,,,,Abdullah Al Faruque Mullick,Sehi pakda,2020-11-27T19:38:04Z,2020-11-27T19:38:04Z
Pratham News,Aisa vishwaguru Bharat to humne kabhibhi Nahi chaha tha...,2020-11-27T19:02:41Z,1,0,,,,
Sarfraz Ahmad,Jio kishano tum sher hoЁЯРЕЁЯРЕЁЯРЕтЭгя╕ПтЭгя╕ПтЭгя╕ПЁЯТкЁЯТкЁЯТкЁЯСМЁЯСМЁЯСМ,2020-11-27T19:01:57Z,8,0,,,,
ruben chang,long live Panjabi free Panjabi,2020-11-27T19:01:01Z,1,0,,,,
R T,Govt should talk with kisan ....and resolve the problem ......yr unko sunn kr clear kro ....what is basically prblm and resolve that problem .......and unko smjhao Corno apke liya bhi khtra h or sb l liya ......kisan k topic imp h bhauth pr unki health bhi,2020-11-27T19:00:53Z,0,0,,,,
I am Berojgar,Ravish sir desh ko vishwa guru new India aur akhand Bharat banane wale Desh mein 2014 se acche din aur sabka sath sabka vikas aur sabka vishwas vada Karne wale sarkar har bar piche darwaje se har baat mein Kala kanoon late Hain<br>Delhi mein har bar jaane wale desh ka janata ko mera ek sujhau hi Delhi se sarkar badal dalo Jai kisan Jay berojgari yuvaтЬКЁЯЩПЁЯЩП<br>Very good prime Time news ravish Kumar sirЁЯТпЁЯЩПЁЯЩП,2020-11-27T19:00:38Z,0,0,,,,
Narsingh Yadav,Rajsthan cg kaha hai ye kya Bharat ke hisse nhi hai kya rabbis chutiye,2020-11-27T19:00:23Z,0,0,,,,
Ajay Sikarwar,"Ye saale khalistani aatankwaadi hain congress Sponsored, ndtv congress ki dalaali khata hai",2020-11-27T19:00:17Z,0,0,,,,
S. shah,Ravish sir ko Salam.,2020-11-27T18:59:41Z,1,0,,,,
Ranjay Kumar,"рдЖрдЬ рджреЗрд╢ рдХрд╛ рд╕рдмрд╕реЗ рдмреЬрд╛ рдХрд┐рд╕рд╛рди рдкрдкреНрдкреВ рдЧрд╛рдБрдзреА рдХрд╣реА рдирд╣реАрдВ рджрд┐рдЦрд╛,рдорд╛рдирд╛ рдардгреНрдб рдХрд╛ рдореМрд╕рдо рд╣реИ рдЕрд░реЗ рд░реЗрди рдХреЛрдЯ рд╣реА рдкрд╣рди рдХрд░ рдЖ рдЬрд╛рддреЗ",2020-11-27T18:57:28Z,0,0,,,,
Narsingh Yadav,Msp hoga kaha to ja rha hai fir bhi in jaise patalkar ko kuan samjhayega,2020-11-27T18:57:23Z,0,1,,,,
,,,,,rupinder singh,15 lakh milega woh bhi kaha thaЁЯШВЁЯШВЁЯШВ,2020-11-29T06:05:54Z,2020-11-29T06:05:54Z
Harsh Verma,Eak baat bata Jo kisan khalistaan zindabaad Kar rahe Hain unko bhe dikha ravish kumar,2020-11-27T18:56:32Z,1,0,,,,
amandeep singh,рдЖ рд░рд╣реЗ рд╣реИ рдкрдВрдЬрд╛рдмреА  рдЕрдЧрд░ рд░реЛрдХ рд╕рдХрддреЗ рд╣реЛ рддреЛ рд░реЛрдХ рд▓реЛ ЁЯжБ,2020-11-27T18:56:10Z,38,0,,,,
Rukhsana Khan,Prime minister ji kisano ki man ki bat sunlo ji .apne man ki to bahut sunai.,2020-11-27T18:55:14Z,0,0,,,,
pawanpreet singh,Demonetization<br>GST<br>Farmer bill<br>CAA<br>Made in india <br>all flop,2020-11-27T18:50:50Z,53,9,,,,
,,,,,Mukeem Masoori,Sahi bola aapne Bhai тЭдя╕П,2020-11-27T19:21:56Z,2020-11-27T19:21:56Z
,,,,,Rohit Manoj,also Statue Of Unity,2020-11-28T13:10:00Z,2020-11-28T13:10:00Z
,,,,,pawanpreet singh,@Rohit Manoj toh fir modi ka new aeroplane bhi list mein add kro worth 10000 crore only.,2020-11-28T13:12:17Z,2020-11-28T13:12:17Z
,,,,,рд╡рд┐рд╡реЗрдХ рд╕рд┐рдВрд╣,@pawanpreet singh make in india hai yaara,2020-11-29T01:03:03Z,2020-11-29T01:03:03Z
,,,,,pawanpreet singh,@рд╡рд┐рд╡реЗрдХ рд╕рд┐рдВрд╣ ok ЁЯШМ typo mistake,2020-11-29T01:17:54Z,2020-11-29T01:17:54Z
,,,,,King's Sunny,Chl oye nikal <br>Farmer bill me nh khnda shi aa<br>Baki sare bill top de aa shi aa<br>Kde gst portal te gya vi .. gst rate pta ki ne .. ITC ki hundi aa<br>Made in India.. full support to indigenous <br>And others,2020-11-30T18:50:27Z,2020-11-30T18:50:27Z
,,,,,pawanpreet singh,@King&#39;s Sunny bhakt ji welcome,2020-11-30T18:56:20Z,2020-11-30T18:56:20Z
,,,,,King's Sunny,@pawanpreet singh oh ja oye Congress da chamcha tu aa me nh jo <br>Menu pta si ae likhe ga jwab tere kol hega nh ЁЯШВЁЯШВЁЯШВЁЯШВ,2020-11-30T19:01:55Z,2020-11-30T19:01:55Z
,,,,,pawanpreet singh,@King&#39;s Sunny a sahi bhakt bande da mtlb jhra BJP nu nei support krda ya o anti national ya congress supporter ЁЯЩП,2020-11-30T19:07:50Z,2020-11-30T19:07:50Z
Rofiqul Hoque,Good news R kumar sar,2020-11-27T18:50:28Z,1,0,,,,
Rofiqul Hoque,ЁЯШнЁЯШнЁЯШн,2020-11-27T18:50:20Z,0,0,,,,
Ashish Yadav,рдпреЗ рд╕рднреА рдХрд┐рд╕рд╛рди рд╣рдорд╛рд░реЗ рджреЗрд╢ рдХреЗ рд╣реИ ! рдЕрдкрдиреА рдмрд╛рдд рд░рдЦрдиреЗ рджрд┐рд▓реНрд▓реА рди рдЖрдП рддреЛ рдХреНрдпрд╛ рдЬреЛ рдмрд╛рдЗрдбреЗрди рдХреЗ рдкрд╛рд╕ рдЬрд╛рдП ?,2020-11-27T18:48:07Z,110,0,,,,
Gurdev Singh,Sir punjabi.. Big problem.. Support all india,2020-11-27T18:46:38Z,0,0,,,,
Badruddin Mallick,Anna jee mar gae Kia?,2020-11-27T18:46:19Z,4,0,,,,
ABHISHEK KALYAN,ЁЯСЙЁЯСЙЁЯСЙCorona ke pahle faze me Delhi mumbai se bahar ja rahe te log ЁЯШВЁЯШВЁЯШВ ab ye kejriwaal jane ya sav sena Congress jane lakin ab faze 2 corona kaal me delhi me kisan aa rahe h punjab se ye kown janeЁЯШВЁЯШВЁЯШВ Congress hi jane...ye maha dogla party h Congress isko desh se koi matlab nahi,2020-11-27T18:45:24Z,0,0,,,,
Asim Ansari,Kuch bada jhol h grmnt k dwara,2020-11-27T18:45:10Z,0,0,,,,
Harjeet Singh Khangura,Kisan jindanad. Modi aur police kute murdabad,2020-11-27T18:44:39Z,0,0,,,,
sumeet kumar,18 andh bhakton ko namaskar ЁЯЩПЁЯП╗,2020-11-27T18:42:33Z,5,0,,,,
Kunal Singh,Ye dulhan ki vidai ke patake haiЁЯШВЁЯШВ,2020-11-27T18:41:27Z,2,0,,,,
Aaquib Ahmed,Abhi bhi 20 dislikes hain.  Inko Oscar do,2020-11-27T18:40:21Z,0,0,,,,
mr D sixso,Bjp pagala gya ha,2020-11-27T18:37:28Z,0,0,,,,
GS incubator Maharashtra,рдПрдирдбреА рдЯреАрд╡реА рд╕рдЪреНрдЪрд╛рдИ рдХрд╛ рдЖрдИрдирд╛ рд╣реИ,2020-11-27T18:37:20Z,0,0,,,,
Saumya Dubey,Gh,2020-11-27T18:37:01Z,0,0,,,,
Manraj Singh,Only channel which gives right information of farmers   JAI JWAAN <br>JAI KISAAN,2020-11-27T18:36:24Z,53,1,,,,
,,,,,Swami Nath Shukla,Now other country also  see india  leadar and farmer action,2020-11-29T08:48:04Z,2020-11-29T08:48:04Z
noor mohamed,Modi is royal pimp of india,2020-11-27T18:34:37Z,0,0,,,,
narendra meena,"Jub farmers ko jarurat hi nahi hai kissi b bill ki  tho jabrdasti kyo thopa ja rha hai ,bjp walo ko gamand kuch jyada hi ho gya h",2020-11-27T18:34:03Z,0,0,,,,
Prakash Bhagat,Modiji ki oppose me sab khel fail huva hai.. Har mahine naya khel karte raho.. Kuch nahi hone wala.. Faltu kutto se ЁЯС║ЁЯС║ЁЯШнЁЯШнЁЯШнЁЯШйЁЯШй,2020-11-27T18:32:13Z,0,0,,,,
A company,Evm ban hoga tab hi Kuch accha hoga,2020-11-27T18:32:02Z,0,0,,,,
DOTтАвiN,Mr RAVISH KUMAR  up to the mark in the book of journalism history time remember you contribution every for every <br>   Thank you .....KISAAN  me and I am India,2020-11-27T18:31:37Z,19,0,,,,
Rahat Ali,ham pahle hi kah rahe the ki Bhajpa sarkar sirf muslim birodhi hi nahi balki har gareeb mazdoor kisan birodhi h,2020-11-27T18:31:22Z,0,0,,,,
Prakash Bhagat,Feku..ЁЯС║ЁЯС║ bhadka karna bandh kar..,2020-11-27T18:30:25Z,1,0,,,,
Sunilkumar Chaturvedi,рдЕрдкрдиреЗ рд╣реА рдирд╛рдЧрд░рд┐рдХреЛрдВ рдХреЛ рджреЗрд╢рджреНрд░реЛрд╣реА рдЬреИрд╕реА рд╕реНрдерд┐рддрд┐ рдореЗрдВ рдврдХреЗрд▓рдиреЗ рдХреЛ рдкрд░рдо рдХрд░реНрддрд╡реНрдп рдорд╛рдирд╛ рдЬрд╛ рд░рд╣рд╛ рд╣реИ,2020-11-27T18:30:08Z,14,0,,,,
рд╡рд┐рдХрд╛рд╕ рджреБрдмреЗ рдХрд╛рдирдкреБрд░ рд╡рд╛рд▓рд╛,"рдореЛрджреА рдХрд┐рд╕рд╛рдиреЛрдВ рдкрд░ рдЕрддреНрдпрд╛рдЪрд╛рд░ рдХрд░рдиреЗ рдХрд╛ рдирдпрд╛ рддрд░реАрдХрд╛ рдвреВрдВрдв рдирд┐рдХрд╛рд▓рд╛ рд╣реИ,&quot;рдпреЗ рдЖрдВрджреЛрд▓рдирдХрд╛рд░реА рдХрд┐рд╕рд╛рди рдирд╣реАрдВ рдЦрд╛рд▓рд┐рд╕реНрддрд╛рдиреА рдЕрддрдВрдХрд╡рд╛рджреА рд╣реИрдВред&quot;",2020-11-27T18:28:59Z,28,7,,,,
,,,,,Sukhminder Singh,"Bilkul sir we are proud Indian,hum unke bete border pr hain.",2020-11-28T01:19:49Z,2020-11-28T01:19:49Z
,,,,,Desi Boy,Maaro saalo ko.<br>Ye saale danga krna chahte h.<br>Delhi me,2020-11-28T02:49:37Z,2020-11-28T02:49:37Z
,,,,,Desi Boy,@р╕гр╕Д╥У╥У╨│р╣Пр╕Б ╥н─лр╕З╤Ф╨│ Abhi check karne par aadhe saheen baag wale hi nikalenge Soniya Gandhi gang&#39;s.<br>Maaro saalo ko,2020-11-28T07:10:57Z,2020-11-28T07:10:57Z
,,,,,larev khan,"@Sukhminder Singh Bhai koi atankwadi, Khalistani ya Pakistani kuch bhi kahe aap apna protest jari rakhna",2020-11-28T11:10:55Z,2020-11-28T11:10:55Z
,,,,,Gaming All the time,@Desi Boy andh bhakt again spotted,2020-11-28T18:15:07Z,2020-11-28T18:15:07Z
,,,,,Desi Boy,@Gaming All the time Abe gaddar chup,2020-11-28T20:03:30Z,2020-11-28T20:03:30Z
,,,,,Gaming All the time,Ha bhai jo ЁЯШВ ruling party ke khilaf bole ve sabi log anti national hai me salute karta hu in andh bhakt koЁЯШ▒ЁЯШ▒ЁЯШ▒ЁЯШ▒ЁЯШ▒ЁЯШБ,2020-11-29T03:37:45Z,2020-11-29T03:37:45Z
My Religion-HUMANITY,"Bewakoofon, apna zameer jhhakkjhood ke jagao, varna, tum bhi bhugtoge badboodaar beemaar sade hue bhayaanak daraavne ghatiya ache din, aaj nhi to kalЁЯЩПЁЯЩПЁЯЩПЁЯЩПЁЯЩПЁЯЩПЁЯЩПЁЯЩПЁЯЩПЁЯЩПЁЯЩПЁЯЩПЁЯЩПЁЯЩПЁЯЩПЁЯШВЁЯШВЁЯШВЁЯШВЁЯШШ",2020-11-27T18:28:26Z,0,0,,,,
